Chapter,Section,Subsection,Subsubsection,Subsubsubsection,Knowledge Point,Label 1,Content 1,Label 2,Content 2,Label 3,Content 3,Label 4,Content 4,Label 5,Content 5,Label 6,Content 6,Label 7,Content 7,Label 8,Content 8,Label 9,Content 9,Label 10,Content 10
Referring expressions,Noun-forming processes\is{noun-forming processes|(\is{nominalization|(,ka-: abstract quality,,,Examples \REF{bkm:Ref447113409} and \REF{bkm:Ref441302833} illustrate ka{}- nominalizations used as nouns in context:,bkm:Ref447113409,\gsrc Daw ino na \textbf{kadayad} mga dikurasyon an na mga paniin. | \gll Daw ino na \textbf{ka-dayad} mga dikurasyon an na mga paniin. | \gls if/when what LK NR-good PL decoration DEF.M LK PL shells | \glt ‘What \textbf{beauty} of the shell decorations!’,bkm:Ref441302833,\gsrc Tagan kay ta \textbf{kabaskeg} ta ame na mga lawa para mag-ubra kay... | \gll ∅-atag-an kay ta \textbf{ka-baskeg} ta ame na mga lawa para mag--ubra kay... | \gls T.IR-give-APL 1P.EXCL.ABS NABS NR-strong NABS 1P.EXCL.GEN LK PL body for I.IR-work 1P.EXCL.ABS | \glt ‘Give us \textbf{strength} for our bodies in order for us to work ...',,,,,,,,,,,,,,,,
Referring expressions,Noun-forming processes\is{noun-forming processes|(\is{nominalization|(,ka-...-én/-ón: abstract quality/dimension,,,Examples \REF{bkm:Ref116398555}{}-\REF{bkm:Ref116398718} illustrate some ka{}-...-én nominalizations in context:,bkm:Ref116398555,\gsrc Piro ta \textbf{kasàkeén} ta iran na ubra uļa danen namasmasi na iran na bata may kalain ta beet ki danen. | \gll Piro ta \textbf{ka-s}à\textbf{ke-én} ta iran na ubra uļa danen na-masmas--i na iran na bata may ka-lain ta beet ki danen. | \gls but NABS NR-busy-NR NABS 3P.GEN LK work NEG.R 3P.ERG A.HAP.R-notice-XC.APL LK 3P.GEN LK child EXT.IN NR-bad NABS inner.being OBL.P 3p | \glt `But in the \textbf{business} of their work they did not notice that their child had bad feelings towards them.’,bkm:Ref116398718,\gsrc \textbf{Katamarén} din paryo ta iya na amay. | \gll \textbf{ka-tamad-én} din paryo ta iya na amay. | \gls NR-lazy-NR 3S.GEN same NABS 3S.GEN LK father | \glt ‘His/her \textbf{laziness} is like his/her father.’,,,,,,,,,,,,,,,,
Referring expressions,Noun-forming processes\is{noun-forming processes|(\is{nominalization|(,"{-an, and ka-...-an: location",,,The following examples illustrate some of these constructions in context. Example \REF{bkm:Ref419298360} illustrates the form tumanan used as a noun:,bkm:Ref419298360,Not found,,,,,,,,,,,,,,,,,,
Referring expressions,Noun-forming processes\is{noun-forming processes|(\is{nominalization|(,"{-an, and ka-...-an: location",,,"Example \REF{bkm:Ref106949019} illustrates the form kaguļangan ‘mature (land)’, based on a prop\-er\-ty-concept root\is{property-concept roots (adjectives)}\is{adjectives}, and kakauyan ‘forest’ based on a nominal root both functioning as nouns:",bkm:Ref106949019,\gsrc Amo i isya na ayep naan gaistar ta \textbf{kaguļangan} o \textbf{kakauyan}. | \gll Amo i isya na ayep naan ga-istar ta \textbf{ka-guļang-an} o \textbf{ka-kauy-an}. | \gls monkey DEF.N one LK animal SPAT.DEF I.R-live NABS NR-mature-NR or NR-tree-NR \glt ‘Monkeys are one (kind of) animal living in \textbf{oldest} \textbf{(virgin} \textbf{forests)} or \textbf{places} \textbf{with} \textbf{many} \textbf{trees}.’,,,,,,,,,,,,,,,,,,
Referring expressions,Noun-forming processes\is{noun-forming processes|(\is{nominalization|(,"{-an, and ka-...-an: location",,,"Example \REF{bkm:Ref106949274} illustrates the form batuan ‘rocky place’, functioning as a location:",bkm:Ref106949274,"\gsrc Niog nai derse nang pļapa din tak naan gatubo ta \textbf{batuan}. | \gll Niog nai derse nang pļapa din tak naan ga-tubo ta \textbf{bato-an}. | \gls coconut D1ABS small.PL only frond 3S.GEN because SPAT.DEF I.R-grow NABS rock-NR | \glt ‘This coconut tree, its fronds are small only because it grows in a \textbf{rocky} \textbf{place}.’",,,,,,,,,,,,,,,,,,
Referring expressions,Noun-forming processes\is{noun-forming processes|(\is{nominalization|(,"{-an, and ka-...-an: location",,,"Example \REF{bkm:Ref106949527} illustrates the verbal root ugsak ‘put inside’ nominalized with -an, to refer to a location.",bkm:Ref106949527,\gsrc Gakamang a ta kaļaw daw \textbf{ugsakan} ta ummay na ega. | \gll Ga-kamang a ta kaļaw daw \textbf{ugsak-an} ta ummay na ega. | \gls I.R-get 1S.ABS NABS winnowing.basket and put.inside-NR NABS unmilled.rice LK dry | \glt `I got a winnowing basket and a \textbf{container} of unmilled rice that was dry.’,,,,,,,,,,,,,,,,,,
Referring expressions,Noun-forming processes\is{noun-forming processes|(\is{nominalization|(,"{-an, and ka-...-an: location",,,"Finally, example \REF{bkm:Ref106950024} illustrates the noun bata ‘child’ with -an meaning ‘group of children usually having the same parents’, while \REF{bkm:Ref106950027} illustrates the same root with ka-…-an meaning ‘group of many children’, or ‘youth’, usually having different parents:",bkm:Ref106950024,"\gsrc May bata daen appat buok, darwa bai, darwa man mama. Ta, tak ubos en may sawa \textbf{bataan} daen, darwa nang en bilin an baļay en. | \gll May bata daen appat buok, darwa bai, darwa man mama. Ta, tak ubos en may sawa \textbf{bata-an} daen, darwa nang en bilin an baļay en. | \gls EXT.IN child 3P.ABS four piece two female two too male so because all CM EXT.IN spouse child-NR 3P.GEN two only CM left SPAT.DEF house CM | \glt `They have four children, two female, two male too. So, because all their \textbf{children} have spouses, just (they) two only are left at the house.’",bkm:Ref106950027,"\gsrc Anduni mga bag-o tubo na mga \textbf{kabataan} uļa gataod ta iran na isigkaittaw. | \gll Anduni mga bag-o tubo na mga \textbf{ka-bata-an} uļa ga-taod ta iran na isigka-ittaw.\footnotemark{} | \gls now/today PL new grow LK PL NR-child-NR NEG.R I.R-respect NABS 3P.GEN LK fellow-people | \glt `Now/today, the new generation of \textbf{children} do not respect their fellow people.’",,,,,,,,,,,,,,,,
Referring expressions,Noun-forming processes\is{noun-forming processes|(\is{nominalization|(,"{-an, and ka-...-an: location",,,There are other nouns that seem to have the ka{}- nominalizer and either -en or -an suffix but are not easily divided into morphemes. These may have been borrowed from other languages (notably Hiligaynon) or are simply lexicalized. A selection of such words is given in \REF{bkm:Ref51161274}. An example of an irregular formation is given in \ref{ex:kindness}:,bkm:Ref51161274,Not found,,,,,,,,,,,,,,,,,,
Referring expressions,Noun-forming processes\is{noun-forming processes|(\is{nominalization|(,-én/-ón: future patient noun,,,Future patient nouns may also be derived from nominal roots (examples in \ref{bkm:Ref117346657}).,bkm:Ref117346657,Not found,,,,,,,,,,,,,,,,,,
Referring expressions,Noun-forming processes\is{noun-forming processes|(\is{nominalization|(,-én/-ón: future patient noun,,,"The suffix -én/-ón can also derive adjectives as described in \chapref{chap:modification}, \sectref{bkm:Ref117512242}. Examples \REF{bkm:Ref116398789} and \REF{bkm:Ref116398793} illustrate some future patient nominalizations from the corpus:",bkm:Ref116398789,\gsrc Gatanem kay ta mga saging daw mga \textbf{laswaén}. | \gll Ga-tanem kay ta mga saging daw mga \textbf{laswa-én}. | \gls I.R-plant 1P.EXCL.ABS NABS PL banana and PL cook.fish.stew-NR | \glt ‘We planted bananas and \textbf{fish-stew-vegetables}.’,bkm:Ref116398793,"\gsrc \textbf{Gulayén} ta Cagayancillo klasi-klasi na mga prutas tampayas puso ta saging, sitaw, bļatong, taļong, kļubay, klabasa, nangka daw duma pa na \textbf{gulayén}. | \gll \textbf{Gulay-én} ta Cagayancillo klasi--klasi na mga prutas tampayas puso ta saging, sitaw, bļatong, taļong, kļubay, klabasa\footnotemark{}, nangka daw duma pa na \textbf{gulay-én}. | \gls vegetables-NR NABS Cagayancillo RED-kind LK PL fruit papaya heart NABS banana yardlong.bean string.bean eggplant bottle.gourd summer.squash jackfruit and other INC LK vegetable-NR | \glt `\textbf{Cooking} \textbf{vegetables} on Cagayancillo, (are) kinds of fruits, papaya, flower (lit. heart) of banana, yardlong beans, string beans, eggplant, bottle gourd, summer squash, jackfruit, and other \textbf{cooking} \textbf{vegetables}.’",,,,,,,,,,,,,,,,
Referring expressions,Noun-forming processes\is{noun-forming processes|(\is{nominalization|(,<in>: resultative,,,"The nominalizing infix <in> occurs after the first consonant of the root.\footnote{As discussed in Chapter 2, in Kagayanen all words begin with consonants. Words that begin with vowel letters in the orthography actually start with an unwritten glottal stop, which is a full consonant in Kagayanen. So, for example, the verb ambaļ has an initial unwritten glottal stop. The infix <in> occurs after the initial glottal stop to form the word spelled inambaļ.} The resulting noun usually refers to something that is affected by the action or process described by the root (examples \ref{bkm:Ref419299508} and \ref{bkm:Ref419299510}). In this sense, <in> is analogous to a past-participle marker. Unlike \isi{Tagalog} and many other Philippine languages, <in> alone has no function as a Transitivity/Modality marker on inflected verbs. Rather, in Kagayanen the corresponding \isi{inflectional} form is the transitive realis pa{}- (see \chapref{chap:verbstructure}, \sectref{sec:transitiverealis}):",bkm:Ref419299508,\gsrc May baļon a na \textbf{linub-ong}. | \gll May baļon a na \textbf{l<in>ub-ong}. | \gls EXT.IN provisions 1S.ABS LK <NR.RES>cooked.cassava | \glt ‘I have some \textbf{steamed} \textbf{cassava} provisions.’,bkm:Ref419299510,\gsrc Daw luto en iran na \textbf{sinin-ad} magtumpok danen daw magkaan. | \gll Daw luto en iran na \textbf{s<in>in-ad} mag-tumpok danen daw mag-kaan. | \gls if/when cook CM 3P.GEN LK <NR.RES>cook.grain I.IR-gather 3S.ABS and I.IR-eat | \glt ‘When \textbf{what} \textbf{was} \textbf{cooked} is already cooked (completely) they gather together and eat.’,,,,,,,,,,,,,,,,
Referring expressions,Noun-forming processes\is{noun-forming processes|(\is{nominalization|(,<in>: resultative,,,"Like all Kagayanen nouns, nominalizations formed with the infix <in> can function as modifiers (as in \ref{bkm:Ref419299508}). For example, baļad ‘to sun dry’ with <in> becomes binaļad ‘sun dried thing’. This form may occur in the position of a modifier in Referring Phrases, e.g., binaļad na mais ‘sun dried corn’. Examples \REF{bkm:Ref419378020} and \REF{bkm:Ref51233639} are corpus examples illustrating this usage with the roots sugba ‘to roast’ and begkes ‘to bundle’ respectively:",bkm:Ref419299508,\gsrc May baļon a na \textbf{linub-ong}. | \gll May baļon a na \textbf{l<in>ub-ong}. | \gls EXT.IN provisions 1S.ABS LK <NR.RES>cooked.cassava | \glt ‘I have some \textbf{steamed} \textbf{cassava} provisions.’,bkm:Ref419378020,"\gsrc Pag-abot nay dya, listo kay eman kaan tak may mga \textbf{sinugba} na sidda. | \gll Pag--abot nay dya, listo kay eman kaan tak may mga \textbf{s<in>inugba} na sidda. | \gls NR.ACT-arrive 1P.EXCL.GEN D4LOC quickly 1P.EXCL.ABS again.as.before eat because EXT.IN PL <NR.RES>roast LK fish | \glt `When we arrived there, quickly we ate again because there were some \textbf{roasted} fish.’",bkm:Ref51233639,"\gsrc Masimba anay danen an daw magprusisyon na daļa a santos na Santo Ninyo palibot ta banwa na gadaļa ta \textbf{binegkes} na tanitang. | \gll Ma-simba anay danen an daw mag-prusisyon na daļa a santos na Santo Ninyo pa-libot ta banwa na ga-daļa ta \textbf{b<in>egkes} na tanitang. | \gls A.HAP.IR-worship first 3P.ABS DEF.M and I.IR-procession LK carry INJ statue LK Holy Child T.R-around NABS town/country LK I.R-carry NABS <NR.RES>bundle LK dried.coconut.frond | \glt `They will first go to church and go in a procession carrying the statue, the Holy Child, taking (it) around the town carrying \textbf{bundled} dried coconut fronds.’",,,,,,,,,,,,,,
Referring expressions,Noun-forming processes\is{noun-forming processes|(\is{nominalization|(,<in>: resultative,,,"When <in> occurs on nominal roots referring to units of time, the meaning is plural, with (\ref{bkm:Ref419299808} and \ref{bkm:Ref419299809}) or without (\ref{bkm:Ref441664725}) the \isi{plural} marker mga:",bkm:Ref419299808,\gsrc Ta \textbf{mga} \textbf{binuļan} na gubra mga mama ta simbaan daw iskwilaan malised na uļa angay pangabui ta mga ittaw. | \gll Ta \textbf{mga} \textbf{b<in>uļan} na ga-ubra mga mama ta simba-an daw iskwila-an ma-lised na uļa angay pangabui ta mga ittaw. | \gls NABS PL <NR.RES>month LK I.R-work PL man NABS worship-NR and go.to.school-NR ADJ-distress LK NEG.R fitting living NABS PL person | \glt ‘During the \textbf{months} when the men were working on the church and school (it was) distressing (and) not fitting for the lives of people.',bkm:Ref419299809,\gsrc Ta una sa na \textbf{mga} \textbf{inadlaw} panliton i pasunod ta maid-id ta mga ittaw ta banwa ta i. | \gll Ta una sa na \textbf{mga} \textbf{<in>adlaw} panliton i pa-sunod ta maid-id ta mga ittaw ta banwa ta i. | \gls NABS first D4NABS LK PL <NR.RES>day baby.ritual DEF.N T.R-follow NABS well NABS PL person NABS town/country 1P.INCL.GEN DEF.N | \glt `In the first (i.e. early) \textbf{days} the ritual of presenting babies to ancestor spirits the people in our town followed (it) well.’,bkm:Ref441664725,\gsrc Piro duma ya na galambay ya na \textbf{tinaon} dili pa gid segeng na pag-ataki ta apo. | \gll Piro duma ya na ga-lambay ya na \textbf{t<in>aon} dili pa gid segeng na pag--ataki ta apo. | \gls but some DEF.F LK I.R-pass.by DEF.F LK <NR.RES>year NEG.IR INC INT extreme LK NR.ACT-attack NABS asthma | \glt `But other past \textbf{years} it was not yet really an extreme attack of asthma.’,,,,,,,,,,,,,,
Referring expressions,Noun-forming processes\is{noun-forming processes|(\is{nominalization|(,<in>: resultative,,,"The infix <in> may combine with the applicative \textit{{}-an}. Only verb roots which require or allow the applicative \nobreakdash-an may be nominalized in this way (see \chapref{chap:stemformingprocesses}, \sectref{sec:applicative-an}). The interpretation of the resulting nominalization depends largely on the nature of the verb root, and is generally consistent with the use of the applicative suffix on Inflected Verbs. For example, as discussed in \chapref{chap:stemformingprocesses}, \sectref{sec:applicative-an}, some transitive verbs require \textit{{}-an} in their normal active-transitive use as main verbs. For this same set of roots, <in>...-an forms a nominalization that refers to the Patient of the verb (\ref{bkm:Ref419300230}-\ref{bkm:Ref419300233}). The stress on such nominalizations is regular---the main stress falls on the penultimate syllable and the secondary stress two syllables to the left.",bkm:Ref419300230,\gsrc \textbf{Tinanuran} ko ya na bata nuļog ta geddan. | \gll \textbf{T<in>anur-an} ko ya na bata na-uļog ta geddan. | \gls <NR.RES>care.for-APL 1S.GEN DEF.F LK child A.HAP.R-fall NABS stairs | \glt `\textbf{The} child I \textbf{cared} \textbf{for} fell down the stairs.’ (lit. `my cared for child'),bkm:Ref419300233,Not found,,,,,,,,,,,,,,,,
Referring expressions,Noun-forming processes\is{noun-forming processes|(\is{nominalization|(,<in>: resultative,,,"Some roots can take either <in> alone or <in>...-an to form a Patient nominalization (\ref{bkm:Ref419300396} and \ref{bkm:Ref447637695}). With <in> alone the patient is presented as more precise and individuated and in some situations is more directly acted upon than the corresponding form with <in>...-an. This meaning difference is comparable to the difference between pa- and pa-…-an for this same class of roots used as inflected verbs (see \chapref{chap:verbstructure}, \sectref{bkm:Ref448124627}).",bkm:Ref419300396,\gsrc \textbf{Pinetpet} din na kaoy kamang ta duma na ittaw. | \gll \textbf{P<in>etpet} din na kaoy kamang ta duma na ittaw. | \gls <NR.RES>chop 3S.GEN LK tree/wood get NABS other LK person | \glt ‘His/her \textbf{chopped} wood another person took (it).’,bkm:Ref447637695,\gsrc \textbf{Pinetpetan} din na kaoy nabilin din naan uma nay. | \gll \textbf{P<in>etpetan} din na kaoy nabilin din naan\footnotemark{} uma nay. | \gls <NR.RES>chop-APL 3S.GEN LK tree/wood A.HAP.R-left 3S.ERG SPAT.DEF field 1P.EXCL.GEN | \glt ‘Some of his/her \textbf{chopped} wood s/he happened to leave behind in our field.’,,,,,,,,,,,,,,,,
Referring expressions,Noun-forming processes\is{noun-forming processes|(\is{nominalization|(,<in>: resultative,,,"On other verbs, <in> plus -an forms a Location or Recipient nominalization. Again, this usage is consistent with the function of -an as an applicative marker (see \chapref{chap:stemformingprocesses}, \sectref{sec:applicative-an}). Examples \REF{bkm:Ref419300326} and \REF{bkm:Ref419300323} illustrate Location nominalizations (the place where something occurs):",bkm:Ref419300326,\gsrc Kada kilem may pagwa kanen an daw indi na mga \textbf{binaylian}. | \gll Kada kilem may pa-gwa\footnotemark{} kanen an daw indi na mga \textbf{b<in>ayli-an}. | \gls each night EXT.IN CAUS-out 3S.ABS DEF.M if/when where LK PL <NR.RES>slow.dance-APL | \glt `Each night he had a presentation wherever there were \textbf{places} \textbf{for} \textbf{dances}.’,bkm:Ref419300323,Not found,,,,,,,,,,,,,,,,
Referring expressions,Noun-forming processes\is{noun-forming processes|(\is{nominalization|(,<in>: resultative,,,"\footnotetext[13]{The root alin functions as an oblique preposition with the meaning ‘from.’ It also functions as a verb, as in example \REF{bkm:Ref419300323}, meaning ‘come from’, or ‘be from.’}",bkm:Ref419300323,Not found,,,,,,,,,,,,,,,,,,
Referring expressions,Noun-forming processes\is{noun-forming processes|(\is{nominalization|(,<in>: resultative,,,"In example \REF{bkm:Ref419380070}, <in> with the verb tudlo ‘teach’ becomes tinudlo referring to what is being taught, which in this example is a dance. In example \REF{bkm:Ref419444251}, <in>...-an with tudlo ‘teach’ becomes tinudluan referring to the recipient of the action, that is, the one taught, which in this example are children.",bkm:Ref419380070,\gsrc \textbf{Tinudlo} din an na sayaw dili dayad. | \gll \textbf{T<in>udlo} din an na sayaw dili\footnotemark{} dayad. | \gls <NR.RES>teach 3S.GEN DEF.M LK dance NEG.IR good | \glt ‘The dance he taught was not good.’ (lit. ‘His/her taught dance ...),bkm:Ref419444251,"\gsrc Yi na \textbf{tinudluan} ko na mga bata kan-o, gatudlo man anduni. | \gll Yi na \textbf{t<in>udlu-an} ko na mga bata kan-o, ga-tudlo man anduni. | \gls D1ABS LK <NR.RES>teach-APL 1S.GEN LK PL child previously I.R-teach also now/today | \glt `These children I taught previously, are teaching also now.’ (lit. ‘My taught children ...”)",,,,,,,,,,,,,,,,
Referring expressions,Noun-forming processes\is{noun-forming processes|(\is{nominalization|(,pang-: instrumental,,,"Example \REF{bkm:Ref447638230} is a riddle, with two possible answers:",bkm:Ref447638230,\gsrc Daw bata pa \textbf{panggulay}. Daw manakem en \textbf{pangbaļay}. Patong. / Tambo. | \gll Daw bata pa \textbf{pang-gulay}. Daw manakem en \textbf{pang-baļay}. Patong. / Tambo. | \gls if/when young INC INST-vegetable if/when older CM INST-house rattan / bamboo.shoot | \glt `When still young (it is) \textbf{used} \textbf{for} \textbf{vegetable}. When older (it is) \textbf{used} \textbf{for} \textbf{the} \textbf{house}. Rattan. / Bamboo shoot.’,,,,,,,,,,,,,,,,,,
Referring expressions,Noun-forming processes\is{noun-forming processes|(\is{nominalization|(,pagka-: abstract qualities,,,"On roots describing times or activities, pagka{}- creates an action nominalization that refers to the time after something else happens. In this usage, pagka{}- contrasts with pag{}-, which indicates simultaneous or sequential events that are closely related to the previous action (see \chapref{chap:clausecombining}, \sectref{sec:nominalizationsasdependentclauses}). Examples \REF{bkm:Ref116460168} and \REF{bkm:Ref116460171} illustrate some pagka- nominalizations in contrast with pag{}- nominalizations:",bkm:Ref116460168,Not found,bkm:Ref116460171,Not found,,,,,,,,,,,,,,,,
Referring expressions,Noun-forming processes\is{noun-forming processes|(\is{nominalization|(,pagka-: abstract qualities,,,"\footnotetext{There are two words glossed as ‘again’ in this example. Eman is the marked member of the pair, and refers to the continuation of an action that was interrupted. Isab expresses no particular sense of continuation. In the context of example \REF{bkm:Ref447656201}, eman would have been semantically appropriate in both positions, however we speculate that having two emans in a row would have sounded odd, so the speaker chose to use isab in the second instance, which is also semantically appropriate.}",bkm:Ref447656201,"\gsrc \textbf{Pagkasellem} eman, gapanaw kay isab na miling ta isya na ristaurant. | \gll \textbf{Pag-ka-sellem} eman, ga-panaw kay isab\footnotemark{} na m-iling ta isya na ristaurant. | \gls NR.ACT-NR-morning again.as.before I.R-walk/leave 1P.INCL.ABS again LK I.V.IR-go NABS one LK restaurant | \glt `\textbf{After it became morning} again as before, we left again going to a restaurant.’",,,,,,,,,,,,,,,,,,
Referring expressions,Noun-forming processes\is{noun-forming processes|(\is{nominalization|(,mag-: human relationships,,,"The affix mag{}- with nouns that indicate a human relationship, such as kinship terms and words such as arey ‘friend’, result in a noun that refers to particular persons who are in that relationship. Some of these nouns express reciprocal and others non-reciprocal relationships. For example, mag{}- with utod ‘sibling’ becomes mag-utod ‘siblings (to each other)’ (\ref{bkm:Ref420509881}); mag- with arey ‘friend’ becomes mag-arey meaning ‘friends (to each other)’, (\ref{bkm:Ref420509947}). These are reciprocal relationships, since each member of the relationship is equal---sibling-to-sibling, or friend-to-friend. An example of a non-reciprocal relationship is mag{}- + inay ‘mother’ yielding mag-inay ‘mother and child(ren)’:",bkm:Ref420509881,Not found,bkm:Ref420509947,"\gsrc Isya na adlaw, darwa i na \textbf{mag-arey}, Umang i daw Pwikan, namasyar naan ta baybay. | \gll Isya na adlaw, darwa i na \textbf{mag--arey}, Umang i daw Pwikan, na-ŋ-pasyar naan ta baybay. | \gls one LK day two DEF.N LK REL-friend hermit.crab DEF.N and sea.turtle A.HAP.R-PL-visit SPAT.DEF NABS beach | \glt `One day, the two \textbf{friends}, Hermit Crab and Sea Turtle, went strolling on the beach.’",,,,,,,,,,,,,,,,
Referring expressions,Noun-forming processes\is{noun-forming processes|(\is{nominalization|(,king-: style of X,,,"The prefix king- is added to a nominal root to form a new noun that refers to the ‘style’ or ‘manner’ of the root noun. This is not a common prefix. Example \REF{bkm:Ref116461310} below is the only instance of this prefix in the corpus. The others are all from conversation, or are elicited. Words formed with king- are not adjectives by the definition given in \chapref{chap:modification}, \sectref{sec:adjectives}, because they do not occur with degree adverbs such as sikad ‘very’:",bkm:Ref116461310,\gsrc Patugtug an ta banda mga tukar an \textbf{kingmanakem} en pugya a.\\ | \gll Pa-tugtug an ta banda mga tukar an \textbf{king-manakem} en pugya a. | \gls T.R-play.music DEF.M NABS band PL music DEF.M style/way-older CM long.ago INJ | \glt `The music the band played was the older people’s style of music of long ago.’,,,,,,,,,,,,,,,,,,
Referring expressions,Noun-forming processes\is{noun-forming processes|(\is{nominalization|(,taga-: place of origin,,,"The prefix taga{}- forms a noun or modifier that refers to a person who is originally from a location specified in the root. Example \REF{bkm:Ref447688060} is a predicate nominal consisting of a predicate meaning “someone originally from Cagayancillo”, followed by the single Argument:",bkm:Ref447688060,\gsrc \textbf{Taga-Cagayancillo} yaken i. | \gll \textbf{Taga-Cagayancillo} yaken i. | \gls ORIG-Cagayancillo 1S.ABS DEF.N | \glt ‘I am \textbf{originally} \textbf{from} \textbf{Cagayancillo}.’,,,,,,,,,,,,,,,,,,
Referring expressions,Noun-forming processes\is{noun-forming processes|(\is{nominalization|(,taga-: place of origin,,,"Some writers use a hyphen following taga-, especially when it occurs before a capitalized place name, such as Cagayancillo (\ref{bkm:Ref447688060}) or Negros \REF{ex:negros}. However, this is not consistent \REF{ex:philippines}.",bkm:Ref447688060,\gsrc \textbf{Taga-Cagayancillo} yaken i. | \gll \textbf{Taga-Cagayancillo} yaken i. | \gls ORIG-Cagayancillo 1S.ABS DEF.N | \glt ‘I am \textbf{originally} \textbf{from} \textbf{Cagayancillo}.’,,,,,,,,,,,,,,,,,,
Referring expressions,Noun-forming processes\is{noun-forming processes|(\is{nominalization|(,{-anen: having the characteristic of X,,,"The suffix -anen is an uncommon and non-productive suffix that designates a person or characteristic associated with the root to which it attaches. It is possibly a reflex of the common Bisayan suffix -anon. It occurs in only six words in Kagayanen, all of which were probably borrowed from \isi{Hiligaynon}. These are illustrated in \REF{bkm:Ref118704475}:",bkm:Ref118704475,Not found,,,,,,,,,,,,,,,,,,
