Chapter,Section,Subsection,Subsubsection,Subsubsubsection,Knowledge Point,Label 1,Content 1,Label 2,Content 2,Label 3,Content 3,Label 4,Content 4,Label 5,Content 5,Label 6,Content 6,Label 7,Content 7,Label 8,Content 8,Label 9,Content 9,Label 10,Content 10
Grammatical relations,Valency\label{sec:9.3,Weather phenomena\label{sec:9.3.7,,,"The second type of construction also involves an intransitive clause but it features the expletive subject\is{expletive} pronoun e ‘\textsc{3sg.sbj}’ rather than a weather noun. This construction is limited to a single intransitive verb, namely fɔ́l ‘rain’, which exclusively functions as a weather verb \REF{ex:key:1245}. The verb fɔ́l may, however, also occur in the first type of construction, together with the weather noun rén ‘rain’ in subject position \REF{ex:key:1246}:",ex:key:1245,\gll A de sí di dé lɛkɛ sé \textbf{e} wánt \textbf{fɔ́l}. | \gls 1SG.SBJ IPFV see DEF day like QUOT 3SG.SBJ want rain | \glt ‘I think the weather is like it’s going to rain.’,ex:key:1246,\gll A bin chɛ́k sé \textbf{rén} go \textbf{fɔ́l}. | \gls 1SG.SBJ PST check QUOT rain POT rain | \glt ‘I thought it would rain.’,,,,,,,,,,,,,,,,
Grammatical relations,Valency\label{sec:9.3,Body states\label{sec:9.3.8,,,"Body states are expressed in constructions involving transitive (cf. 1a–1c in \tabref{tab:key:9.11}) and intransitive (2a–2c) clauses. Type 1 constructions in the table involve transitive clauses. In type 1a constructions, the affected body part\is{} is found in the subject\is{subjects} position, while the experiencer\is{experiencer} is in the object position. This construction is the preferred one for expressing pain and hurt. The verb is either of the dynamic experiential verbs hát ‘hurt’ or pén ‘pain’ (\ref{ex:key:1249}–\ref{ex:key:1251}).",ex:key:1249,\gll Mi \textbf{bɛlɛ́} de \textbf{hát} mí. | \gls 1SG.POSS belly IPFV hurt 1SG.INDP | \glt ‘My stomach is hurting me.’,ex:key:1251,\gll Mi \textbf{tít} de \textbf{pén} mí. | \gls 1SG.POSS tooth IPFV pain 1SG.INDP | \glt ‘My tooth is paining me.’,,,,,,,,,,,,,,,,
Grammatical relations,Valency\label{sec:9.3,Body states\label{sec:9.3.8,,,"Type 1c constructions in \tabref{tab:key:9.11} are the mirror-image of type 1b constructions. The experiencer is in the subject position, while the body state or sensation is expressed as a deverbal noun in the object position. Hunger, thirst, and sleep(iness) can be expressed by this construction with the dynamic body state verbs fíl ‘feel’ (\ref{ex:key:1255}–\ref{ex:key:1256}). Hunger and thirst can also be expressed in combination with the verb sɔ́fa ‘suffer, endure’ \REF{ex:key:1257}:",ex:key:1255,"\gll A de \textbf{fíl} \textbf{hángri}, A de \textbf{fíl} \textbf{slíp}. | \gls 1SG.SBJ IPFV feel hungry 1SG.SBJ IPFV feel sleep | \glt ‘I’m feeling hungry, I’m feeling sleepy.’",ex:key:1256,\gll A \textbf{fíl} di pikín in \textbf{pén}. | \gls 1SG.SBJ feel DEF child 3SG.POSS pain | \glt ‘I went into labour.’ [Lit. ‘I felt the child’s pain].’,ex:key:1257,\gll A \textbf{sɔ́fa} wán \textbf{hángri} na dán kɔ́ntri. | \gls 1SG.SBJ suffer one hunger LOC that country | \glt ‘I endured extraordinary hunger in that country.’,,,,,,,,,,,,,,
Grammatical relations,Valency\label{sec:9.3,Body states\label{sec:9.3.8,,,"Proof for the nominal status of the body state in the constructions above is provided by sentences \REF{ex:key:1256} and \REF{ex:key:1257}. In the former example, we find a dislocated possessive construction\is{possessive constructions} in the object position of fíl. In the latter example, the indefinite determiner wán ‘one, a’ precedes hángri ‘hunger’, the object of sɔ́fa ‘endure’.",ex:key:1256,\gll A \textbf{fíl} di pikín in \textbf{pén}. | \gls 1SG.SBJ feel DEF child 3SG.POSS pain | \glt ‘I went into labour.’ [Lit. ‘I felt the child’s pain].’,ex:key:1257,\gll A \textbf{sɔ́fa} wán \textbf{hángri} na dán kɔ́ntri. | \gls 1SG.SBJ suffer one hunger LOC that country | \glt ‘I endured extraordinary hunger in that country.’,,,,,,,,,,,,,,,,
Grammatical relations,Valency\label{sec:9.3,Body states\label{sec:9.3.8,,,"Type 2 constructions involve intransitive clauses. In type 2a, the experiencer appears in the subject position. The body state is instantiated in a dynamic verb. Once more, the basic body states of hunger and thirst can be expressed in this way (\ref{ex:key:1260}–\ref{ex:key:1261}). However, other transient body states like sík ‘be sick’ also appear in this construction \REF{ex:key:1262}:",ex:key:1260,\gll A \textbf{de} \textbf{hángri}. | \gls 1SG.SBJ IPFV be.hungry | \glt ‘I’m hungry.’,ex:key:1261,\gll A \textbf{de} \textbf{tɔ́sti}. | \gls 1SG.SBJ IPFV be.thirsty | \glt ‘I’m thirsty.’,ex:key:1262,"\gll Wán dé wán pikín bin \textbf{de} \textbf{sík}. | \gls one day one child PST IPFV sick | \glt ‘One day, a certain child was sick.’",,,,,,,,,,,,,,
Grammatical relations,Valency\label{sec:9.3,Body states\label{sec:9.3.8,,,"In type 2b constructions, the body state verb is inchoative-stative. Compare táya ‘be tired’ \REF{ex:key:1263} wɛ́l ‘be well’ \REF{ex:key:1264}, bɛlfúl ‘be satiated’ \REF{ex:key:1265}, and hát ‘be hurt’ \REF{ex:key:1266}:",ex:key:1263,\gll A \textbf{táya}. | \gls 1SG.SBJ be.tired | \glt ‘I’m tired.’,ex:key:1264,\gll A \textbf{wɛ́l}. | \gls 1SG.SBJ well | \glt ‘I’m well.’,ex:key:1265,\gll A \textbf{bɛlfúl}. | \gls 1SG.SBJ be.satiated | \glt ‘I’m full.’,ex:key:1266,\gll Di gál \textbf{hát}. | \gls DEF girl hurt | \glt ‘The girl is hurt.’,,,,,,,,,,,,
Grammatical relations,Valency\label{sec:9.3,Body states\label{sec:9.3.8,,,"Type 2c constructions are intransitive copula clauses. The body state verb appears as an adjective complement\is{complements} to the locative-existential\is{copula!locative-existential} copula dé \textsc{‘be.loc’} \REF{ex:key:1267}. The property items gúd ‘be well’, bád ‘be bad’, and fáyn ‘be fine’ appear in such predicate adjective constructions when they express a transient body state rather than an (intrinsic) value (cf. \sectref{sec:7.6.5}):",ex:key:1267,"\gll Dán tɛ́n a \textbf{dé} \textbf{fáyn}. | \gls that time 1SG.SBJ BE.LOC fine | \glt ‘That time, I was fine.’",,,,,,,,,,,,,,,,,,
Grammatical relations,Valency adjustments\label{sec:9.4,Unexpressed subjects\label{sec:9.4.1,,,"Subjects are normally expressed overtly but subject omission\is{subject omission} (indicated by {\emptyset}) occasionally occurs with verbs with impersonal reference, as with fít ‘can’ in an excerpt from a procedural text \REF{ex:key:1270}:",ex:key:1270,Not found,,,,,,,,,,,,,,,,,,
Grammatical relations,Valency adjustments\label{sec:9.4,Unexpressed subjects\label{sec:9.4.1,,,"The following two sentences are uttered in sequence by the same speaker. Compare the ambiguous function of sé in \REF{ex:key:1271b}, which is introduced by sé, with (a) where sé is firmly integrated into the sentence as a quotative marker:",ex:key:1271b,"\gll \textbf{Sé} chico, dí tín nó go dú mí. | \gls QUOT boy this thing NEG POT do 1SG.INDP | \glt ‘(He said) “man, this won’t do for me”.’",,,,,,,,,,,,,,,,,,
Grammatical relations,Valency adjustments\label{sec:9.4,Unexpressed objects\label{sec:9.4.2,,,"In principle, objects need not be overtly expressed. In practice, highly transitive verbs are unlikely to appear without a patient object, even if the object is non-specific. The verb bló ‘give a blow’ in \REF{ex:key:1272} denotes a situation which implies a high degree of volition and instigation by an agent. Equally, the situation involves no notion of affectedness of the agent (cf. \citealt{Naess2007}):",ex:key:1272,\gll A \textbf{bló} \textbf{dí} \textbf{pikín}. | \gls 1SG.SBJ give.blow this child | \glt ‘I gave this child [guy] a blow.’,,,,,,,,,,,,,,,,,,
Grammatical relations,Valency adjustments\label{sec:9.4,Unexpressed objects\label{sec:9.4.2,,,"When bló occurs without an object it is understood to be the homophonous bló ‘rest, relax’ \REF{ex:key:1273}, a verb which is lower on the transitivity scale, but may also be used transitively \REF{ex:key:1274}, due to its status as a labile\is{labile verbs} experiential verb:",ex:key:1273,\gll A de \textbf{bló} ɔ a de \textbf{rɛ́s}. | \gls 1SG.SBJ IPFV relax or 1SG.SBJ IPFV rest | \glt ‘I’m relaxing or I’m resting.’,ex:key:1274,\gll Mék a \textbf{bló} \textbf{dí} \textbf{pɔ́sin} mék e fít recupera. | \gls SBJV 1SG.SBJ relax this person SBJV 3SG.SBJ can recover | \glt ‘Let me make this person rest for her to be able to recover.’,,,,,,,,,,,,,,,,
Grammatical relations,Valency adjustments\label{sec:9.4,Unexpressed objects\label{sec:9.4.2,,,"When highly transitive verbs are used in a context of non-specificity, they usually occur with generic noun\is{generic nouns}s as objects. Compare the non-specific object sɔn tín ‘something’ of the highly transitive verb híb ‘throw (away)’ \REF{ex:key:1275} and pɔ́sin ‘person’, object of nák ‘hit’ \REF{ex:key:1276}:",ex:key:1275,\gll (...) yu \textbf{híb} \textbf{sɔn} \textbf{tín} fɔ grɔ́n (...) | \gls (...) 2SG throw some thing PREP ground (...) | \glt ‘(...) (if) you throw something on the ground (...)’,ex:key:1276,\gll (...) na ín e de \textbf{nák} \textbf{pɔ́sin}. | \gls (...) FOC 3SG.INDP 3SG.SBJ IPFV hit person | \glt ‘(...) that’s why she’s hitting somebody.’,,,,,,,,,,,,,,,,
Grammatical relations,Valency adjustments\label{sec:9.4,Unexpressed objects\label{sec:9.4.2,,,"The objects of effected-object verbs come into existence through the situation denoted by the verb. They are not affected or changed by the situation denoted by the verb like the patient objects of more prototypically transitive verbs. The non-specific effected objects of verbs of speech and sound emission often occur without a speech- and sound-denoting noun or pronoun. Consider the following use of tɔ́k ‘say, talk’ in a transitive \REF{ex:key:1277} and in an intransitive clause \REF{ex:key:1278}:",ex:key:1277,"\gll Bikɔs yu dɔ́n \textbf{tɔ́k} \textbf{wán} \textbf{bád} \textbf{tɔ́k}, e sé “gɔ́d háma yu mɔ́t!” | \gls because 2SG PRF talk one bad word 3SG.SBJ QUOT God hammer 2SG mouth | \glt ‘Because you have said something bad, she says “may God hammer your mouth!”’",ex:key:1278,\gll Sé “a bin sí bɔt a nó fít \textbf{tɔ́k}.” | \gls QUOT 1SG.SBJ PST see but 1SG.SBJ NEG can talk. | \glt ‘(He) said “I saw (it) but I couldn’t talk”.’,,,,,,,,,,,,,,,,
Grammatical relations,Valency adjustments\label{sec:9.4,Unexpressed objects\label{sec:9.4.2,,,Another verb that may be used in this way is síng ‘síng’ \REF{ex:key:1279}:,ex:key:1279,\gll E de \textbf{síng} na Píchi. | \gls 3SG.SBJ IPFV síng LOC Pichi | \glt ‘He sings in Pichi.’,,,,,,,,,,,,,,,,,,
Grammatical relations,Valency adjustments\label{sec:9.4,Unexpressed objects\label{sec:9.4.2,,,"Likewise, the effected non-specific objects of verbs denoting a process of production may remain unexpressed. Compare só ‘sew’ (\ref{ex:key:1280}–\ref{ex:key:1281}) and kúk ‘cook’ (\ref{ex:key:1282}–\ref{ex:key:1283}) in the transitive and intransitive sentence pairs below:",ex:key:1280,"\gll (...) wé yu nó nó to fíks wán klós, to \textbf{só} \textbf{wán} \textbf{klós} (...) | \gls (...) SUB 2SG NEG know to fix one clothing to sew one clothing (...) | \glt ‘(...) when you don’t know how to fix a dress, to sew a dress (...)’",ex:key:1281,\gll Di sastre de \textbf{só}. | \gls DEF tailor IPFV sew | \glt ‘The tailor is sewing.’,ex:key:1282,\gll E kin \textbf{kúk} \textbf{súp}. | \gls 3SG.SBJ HAB cook soup | \glt ‘He cooks soups.’,ex:key:1283,\gll Di húman kán na hós di áwa wé a de \textbf{kúk}. | \gls DEF woman come LOC house DEF hour SUB 1SG.SBJ IPFV cook | \glt ‘The woman came to the house at the time when I was cooking.’,,,,,,,,,,,,
Grammatical relations,Valency adjustments\label{sec:9.4,Unexpressed objects\label{sec:9.4.2,,,"Affected-agent verbs are also lower on the scale of semantic transitivity than prototypical transitive verbs, because the actors are themselves affected by the situation in addition to the undergoer. In this group, we find transitive motion verbs\is{motion verbs} like rích ‘reach, arrive’ (\ref{ex:key:1284}–\ref{ex:key:1285}) and gó ‘go (away)’ (\ref{ex:key:1286}–\ref{ex:key:1287}), whose goal\is{goal} objects may remain unexpressed:",ex:key:1284,\gll Yu nɛ́a \textbf{rích} \textbf{Lubá}? | \gls 2SG NEG.PRF arrive PLACE | \glt ‘You’ve not yet been to Luba?’,ex:key:1285,\gll E dɔ́n \textbf{rích}. | \gls 3SG.SBJ PRF arrive | \glt ‘He has arrived.’,ex:key:1286,"\gll Bueno, a de \textbf{gó} \textbf{mákit} náw. | \gls good 1SG.SBJ IPFV go market now | \glt ‘Alright, I’m going to the market now.’",ex:key:1287,\gll A go \textbf{gó}. | \gls 1SG.SBJ POT go | \glt ‘I’ll (eventually) go.’,,,,,,,,,,,,
Grammatical relations,Valency adjustments\label{sec:9.4,Unexpressed objects\label{sec:9.4.2,,,Typical affected-agent verbs are the ingestive verbs chɔ́p \REF{ex:key:1288} ‘eat’ and dríng ‘drink’ \REF{ex:key:1289}. These two transitive verbs are usually encountered without a patient\is{patient} object when its reference is non-specific. Note that object omission with dríng in combination with a habitual reading renders the idiomatic meaning ‘habitually drink alcohol’:,ex:key:1288,\gll A kán \textbf{chɔ́p}. | \gls 1SG.SBJ PFV eat | \glt ‘(Then) I ate.’,ex:key:1289,"\gll Dí pɔ́sin \textbf{de} \textbf{dríng}, na chak-mán. | \gls this person IPFV drink FOC drink.CPD-man | \glt ‘This person drinks, he’s a drunkard.’",,,,,,,,,,,,,,,,
Grammatical relations,Valency adjustments\label{sec:9.4,Unexpressed objects\label{sec:9.4.2,,,"When sí ‘see, perceive’ occurs without an object, its non-specific reading may translate as ‘understand’ or ‘witness’ (cf. e.g. \ref{ex:key:1278}). However, sí is also very often encountered in a non-specific context with a \textsc{3sg} object pronoun \REF{ex:key:1290} or an object \textsc{NP} di tín ‘the thing’ \REF{ex:key:1291}. Both of these objects are only faintly referential and therefore appear to function as dummy\is{dummy nouns} objects in very much the same way as non-referential subjects with expletive verbs (cf. \sectref{sec:9.2.4}):",ex:key:1278,\gll Sé “a bin sí bɔt a nó fít \textbf{tɔ́k}.” | \gls QUOT 1SG.SBJ PST see but 1SG.SBJ NEG can talk. | \glt ‘(He) said “I saw (it) but I couldn’t talk”.’,ex:key:1290,"\gll Yɛ́s, yu de \textbf{sí=an}? | \gls yes 2SG IPFV see=3SG.OBJ | \glt ‘Yes, do you understand?’",ex:key:1291,\gll Yu \textbf{sí} \textbf{di} \textbf{tín}? | \gls 2SG see DEF thing | \glt ‘You see?’,,,,,,,,,,,,,,
Grammatical relations,Valency adjustments\label{sec:9.4,Unexpressed objects\label{sec:9.4.2,,,The cognition verb mɛ́mba often appears without an explicit object with its meaning of ‘remember’ \REF{ex:key:1292}:,ex:key:1292,\gll A nó de \textbf{mɛ́mba}. | \gls 1SG.SBJ NEG IPFV remember | \glt ‘I don’t remember.’,,,,,,,,,,,,,,,,,,
Grammatical relations,Valency adjustments\label{sec:9.4,Unexpressed objects\label{sec:9.4.2,,,"However, when mɛ́mba occurs in a transitive clause, it is best translated as ‘think of’, both with a specific object \REF{ex:key:1293} and a non-specific one \REF{ex:key:1294}:",ex:key:1293,\gll A kin \textbf{mɛ́mba} \textbf{yú} bɔkú. | \gls 1SG.SBJ HAB think 2SG.INDP much | \glt ‘I think of you a lot.’,ex:key:1294,"\gll Nó hambɔ́g mí, a de \textbf{mɛ́mba} \textbf{sɔn} \textbf{tín}! | \gls NEG bother 1SG.INDP 1SG.SBJ IPFV think some thing | \glt ‘Don’t bother me, I’m thinking about something!’",,,,,,,,,,,,,,,,
Grammatical relations,Valency adjustments\label{sec:9.4,Unexpressed objects\label{sec:9.4.2,,,"Likewise, verbs denoting physical activities often occur with unexpressed objects. Consider plé ‘play’ in \REF{ex:key:1295}:",ex:key:1295,"\gll Bɔt wi fít de \textbf{plé} a jám yú yu fɔdɔ́n. | \gls but 1PL can IPFV play 1SG.SBJ make.contact 2SG.INDP 2SG fall | \glt ‘But we could be playing [football], I hit you (and) you fall.’",,,,,,,,,,,,,,,,,,
Grammatical relations,Valency adjustments\label{sec:9.4,Unexpressed reflexive and reciprocal nominals\label{sec:9.4.3,,,"The following examples involve the “body care” verbs wás ‘wash’ \REF{ex:key:1297}, báf ‘bathe’ \REF{ex:key:1298}, and wɛ́r ‘dress (up)’ \REF{ex:key:1231}. Note that wɛ́r takes an object in \REF{ex:key:1300} and still implies reflexivity:",ex:key:1297,\gll Dɛn de kán sé dɛn kán \textbf{wás}. | \gls 3PL IPFV come QUOT 3PL come wash | \glt ‘They come to wash themselves.’,ex:key:1298,\gll Yu dɔ́n \textbf{báf}? | \gls 2SG PRF bathe | \glt ‘Have you bathed?’,ex:key:1231,\gll A \textbf{wɛ́r}. | \gls 1SG.SBJ wear | \glt ‘I’m dressed/have got dressed.’,ex:key:1300,\gll Na lɛk if yu \textbf{wɛ́r} \textbf{sɔ́t} di gud-sáy wet di rɔn-sáy. | \gls FOC like if 2SG wear shirt DEF good.CPD-side with DEF wrong.CPD-side | \glt ‘That’s like if you put on a shirt the right way or inside out.’,,,,,,,,,,,,
Grammatical relations,Valency adjustments\label{sec:9.4,Unexpressed reflexive and reciprocal nominals\label{sec:9.4.3,,,"The basic posture verbs slíp ‘lie (down), sleep’, tínap ‘stand (up)’ and sidɔ́n ‘sit (down)’ are never encountered with a reflexive pronoun in the corpus (cf. \sectref{sec:8.1.3} for an extensive treatment). In contrast, verbs denoting less prototypical postures, e.g. líng ‘lean over’ and bɛ́n ‘bend (over)’ in (\ref{ex:key:1303}–\ref{ex:key:1304}), as well as those denoting other types of body-related events, e.g. háyd ‘hide’ in (\ref{ex:key:1305}–\ref{ex:key:1306}) are found with or without reflexive pronouns:",ex:key:1303,\gll E de wáka e \textbf{bɛ́n}. | \gls 3SG.SBJ IPFV walk 3SG.SBJ bend | \glt ‘He is walking stooped over.’,ex:key:1304,\gll Sé dɛn \textbf{líng} dɛn sɛ́f ɔ fɔ lɛk háw dɛn \textbf{bɛ́n} dɛn sɛ́f? | \gls QUOT 3PL lean 3PL self or PREP like how 3PL bend 3PL self | \glt ‘That they’re leaning (onto something) or how they’re stooped over?’,ex:key:1305,\gll A kán \textbf{háyd} ínsay hós. | \gls 1SG.SBJ PFV hide inside house | \glt ‘(Then) I hid in the house.’,ex:key:1306,\gll A \textbf{háyd} mi sɛ́f na hós. | \gls 1SG.SBJ hide 1SG.POSS self LOC house | \glt ‘I hid myself in the house.’,,,,,,,,,,,,
Grammatical relations,Valency adjustments\label{sec:9.4,Unexpressed reflexive and reciprocal nominals\label{sec:9.4.3,,,"Verbs with an inherently reciprocal meaning may appear with or without the reflexive and reciprocal anaphor sɛ́f ‘self’. Consider the use of reciprocal sɛ́f with the sexual act denoting verbs nák ‘knock’ \REF{ex:key:1310} and slíp ‘sleep with’ \REF{ex:key:1311}, as well as the unexpressed reciprocal pronoun in \REF{ex:key:1312}. These examples also illustrate that sexual act denoting verbs, including highly transitive ones like nák, do not imply a male agent in Pichi:",ex:key:1310,\gll (...) wi \textbf{nák} \textbf{wi} \textbf{sɛ́f}. | \gls (...) 1PL knock 1PL self | \glt ‘(...) we knocked each other.’,ex:key:1311,"\gll \'{I}nsay di motó, na dé unu de \textbf{slíp} \textbf{unu} \textbf{sɛ́f}? | \gls inside DEF car FOC there 2PL IPFV sleep 2PL self | \glt ‘In the car, that’s where you sleep with each other?’",ex:key:1312,\gll Una \textbf{slíp}? | \gls 2PL sleep | \glt ‘You slept (with each other)?’,,,,,,,,,,,,,,
Grammatical relations,Valency adjustments\label{sec:9.4,Unexpressed reflexive and reciprocal nominals\label{sec:9.4.3,,,"Conversely, the inherently reciprocal verbs of social interaction mít ‘meet’ and mítɔp ‘meet’ do not normally occur with the anaphor sɛ́f (\ref{ex:key:1313}–\ref{ex:key:1314}):",ex:key:1313,\gll E tɛ́l mí sé wi kin \textbf{mítɔp} ínsay wán motó. | \gls 3SG.SBJ tell 1SG.INDP QUOT 1PL HAB meet inside one car | \glt ‘He told me “we usually meet inside a car”.’,ex:key:1314,\gll \'{A}fta wi kán \textbf{mít} layk wán seis años después. | \gls then 1PL PFV meet like one six years afterwards | \glt ‘Then we met some six years later.’,,,,,,,,,,,,,,,,
Grammatical relations,Valency adjustments\label{sec:9.4,Unexpressed reflexive and reciprocal nominals\label{sec:9.4.3,,,"Nevertheless, like other inherently reciprocal verbs, mít and mítɔp may take part in a reciprocal alternation (cf. also fɛ́t ‘fight’ in \ref{ex:key:1090}). The two participants may be expressed as coordinate subject{\fff}s in an intransitive clause while reciprocity is understood. Compare the transitive use of mít ‘meet’ in \REF{ex:key:1315}, with its intransitive use with two coordinate subjects in \REF{ex:key:1316}:",ex:key:1090,Not found,ex:key:1315,\gll Pero e \textbf{mít} \textbf{mi} \textbf{gran-má}. | \gls but 3SG.SBJ meet 1SG.POSS grand-ma | \glt ‘But he met my grandmother.’,ex:key:1316,\gll \textbf{Mí} \textbf{wet} \textbf{Djunais} wi mítɔp. | \gls 1SG.INDP with NAME 1PL meet | \glt ‘Me and Djunais (we) met.’,,,,,,,,,,,,,,
Grammatical relations,Valency adjustments\label{sec:9.4,Causative constructions\label{sec:9.4.4,,,"Causative and permissive constructions are formed with the two verbs mék ‘make’ and lɛ́f ‘leave, permit’. Examples (\ref{ex:key:1319}–\ref{ex:key:1320}) present their use in non-causative transitive clauses:",ex:key:1319,\gll Yu fít \textbf{mék} mí wán café? | \gls 2SG can make 1SG.INDP one coffee | \glt ‘Can you make me a coffee?’,ex:key:1320,\gll A sé a nó fít \textbf{lɛ́f}=an. | \gls 1SG.SBJ QUOT 1SG.SBJ NEG can leave=3SG.OBJ | \glt ‘I said I can’t leave her (behind).’,,,,,,,,,,,,,,,,
Grammatical relations,Valency adjustments\label{sec:9.4,Causative constructions\label{sec:9.4.4,,,"Two types of causative constructions can be distinguished on formal grounds (cf. \citealt{Yakpo2012a}, \citealt{Yakpo2017a}). The most common type of causative construction in Pichi inolves a “balanced” structure \citep{Cristofaro2003}. The causative event is expressed in two finite clauses and the causative verb and the verb-of-effect are linked in a relation of subordination\is{subordination}. Sentence \REF{ex:key:1321} below features the (inanimate) causer NP lotería ‘lottery’, the causative main verb mék ‘make’, the causee NP mi mɔní ‘my money’, and the subordinate verb-of-effect bɔkú ‘be much’. The subordinate status of the effect situation is evident through its appearance in a subjunctive clause introduced by the modal complementiser and subjunctive marker mék ‘\textsc{sbjv}’:",ex:key:1321,\gll Lotería dɔ́n \textbf{mék} \textbf{mék} mi mɔní \textbf{bɔkú}. | \gls lottery PRF make SBJV 1SG.POSS money be.much | \glt ‘The lottery has made my money become a lot.’,,,,,,,,,,,,,,,,,,
Grammatical relations,Valency adjustments\label{sec:9.4,Causative constructions\label{sec:9.4.4,,,"The second type of causative construction involves a “deranked” \citep{Cristofaro2003} or “reduced” \citep{Lehmann1988} structure and argument sharing. The causee (here =an \textsc{‘3sg.obj’}) is the syntactic object of the causative main verb mék and at once the notional subject of the subordinate verb-of-effect gó as in \REF{ex:key:1322}. This construction is marginal in terms of frequency, and only attested with Group 1 speakers (cf. \sectref{sec:1.3}). I could not identify any semantic differences between the two types of caustive constructions:",ex:key:1322,\gll A go \textbf{mék}=an \textbf{gó} tumɔ́ro. | \gls 1SG.SBJ POT make=3SG.OBJ go tomorrow | \glt ‘I’ll make him go tomorrow.’,,,,,,,,,,,,,,,,,,
Grammatical relations,Valency adjustments\label{sec:9.4,Causative constructions\label{sec:9.4.4,,,"Both transitive and intransitive verbs may be causativised. Example \REF{ex:key:1323} features a causative construction with the intransitive verb of effect bɛ́lch ‘belch’ and \REF{ex:key:1324} one with the transitive verb wích ‘bewitch’. Like all complement clauses, the subjunctive clause in these constructions can optionally be introduced by the quotative marker sé ‘\textsc{quot}’ in addition to mék ‘\textsc{sbjv}’ \REF{ex:key:1324}:",ex:key:1323,\gll A níd fɔ drink sɔn tín wé de mék \textbf{mék} a \textbf{bɛ́lch} | \gls 1SG.SBJ need PREP drink some thing SUB IPFV make SBJV 1SG.SBJ belch | \glt ‘I need to drink something that will make me belch.’,ex:key:1324,\gll Na ín mék \textbf{sé} \textbf{mék} dɛn \textbf{wích}=an. | \gls FOC 3SG.INDP make QUOT SBJV 3PL bewitch=3SG.OBJ | \glt ‘That’s why he was bewitched.’,ex:key:1324,\gll Na ín mék \textbf{sé} \textbf{mék} dɛn \textbf{wích}=an. | \gls FOC 3SG.INDP make QUOT SBJV 3PL bewitch=3SG.OBJ | \glt ‘That’s why he was bewitched.’,,,,,,,,,,,,,,
