Chapter,Section,Subsection,Subsubsection,Subsubsubsection,Knowledge Point,Label 1,Content 1,Label 2,Content 2,Label 3,Content 3,Label 4,Content 4,Label 5,Content 5,Label 6,Content 6,Label 7,Content 7,Label 8,Content 8,Label 9,Content 9,Label 10,Content 10
Grammatical relations,Valency\label{sec:9.3,Associative objects\label{sec:9.3.2,,,"Associative objects are assigned a content role by the labile change-of-state verbs fúlɔp ‘fill up’ \REF{ex:key:1173} and pák ‘pack, fill up’ \REF{ex:key:1174}:",ex:key:1173,\gll Na China motó dɛn \textbf{fúlɔp} \textbf{pípul}. | \gls LOC PLACE car PL be.full people | \glt ‘In China cars are full of people.’,ex:key:1174,\gll ɔ́l hía \textbf{pák} \textbf{polvo}. | \gls all here pack dust | \glt ‘Everywhere here is full of dust.’,,,,,,,,,,,,,,,,
Grammatical relations,Valency\label{sec:9.3,Associative objects\label{sec:9.3.2,,,Content objects can be replaced by a corresponding prepositional phrase without a change in meaning. Compare the PPs introduced by wet ‘with’ in \REF{ex:key:1175} and \REF{ex:key:1176}:\is{adjuncts},ex:key:1175,\gll Na lɛk sé yu \textbf{fúlɔp} di glás \textbf{watá}? | \gls FOC like QUOT 2SG fill DEF glass water | \glt ‘That’s as if you fill up a glass with water?’,ex:key:1176,\gll E \textbf{fúlɔp} di glás \textbf{wet} \textbf{watá}. | \gls 3SG.SBJ fill DEF glass with water | \glt ‘He filled the glass with water.’,,,,,,,,,,,,,,,,
Grammatical relations,Valency\label{sec:9.3,Associative objects\label{sec:9.3.2,,,Instrument is among the most common semantic roles expressed by associative objects \REF{ex:key:1177}. The instrument role may also be expressed by a wet{}-prepositional phrase \REF{ex:key:1178}:,ex:key:1177,\gll Yu fít tɔ́k sé “dɛn \textbf{chúk}=an \textbf{nɛ́f}”. | \gls 2SG can talk QUOT 3PL {stab=SG.OBJ} knife | \glt ‘You can say “he was stabbed with a knife”.’,ex:key:1178,\gll Dɛn \textbf{chúk} mí \textbf{wet} \textbf{nɛ́f}. | \gls 3PL stab 1SG.INDP with knife | \glt ‘I was stabbed with a knife.’,,,,,,,,,,,,,,,,
Grammatical relations,Valency\label{sec:9.3,Associative objects\label{sec:9.3.2,,,Sentences \REF{ex:key:1181} and \REF{ex:key:1182} provide examples for the use of associative objects with the semantic role of purpose. These may equally be expressed through a prepositional phrase introduced by the associative preposition fɔ \REF{ex:key:1182}:,ex:key:1181,\gll Yu de \textbf{kapú} \textbf{hós}. | \gls 2SG IPFV fight.over house | \glt ‘You’re fighting over a house.’,ex:key:1182,\gll Dɛn de \textbf{kapú} \textbf{fɔ} di \textbf{hós}. | \gls 3PL IPFV fight.over PREP DEF house | \glt ‘They’re fighting over the house.’,ex:key:1182,\gll Dɛn de \textbf{kapú} \textbf{fɔ} di \textbf{hós}. | \gls 3PL IPFV fight.over PREP DEF house | \glt ‘They’re fighting over the house.’,,,,,,,,,,,,,,
Grammatical relations,Valency\label{sec:9.3,Associative objects\label{sec:9.3.2,,,"The source\is{} of the motion verb\is{motion verbs} fɔdɔ́n ‘fall’ may be realised as an associative object \REF{ex:key:1183}. Alternatively, the source may be indicated via the preposition frɔn ‘from’ when it marks the ground \REF{ex:key:1184}. Note the possibility of additionally using the “at rest” locative noun\is{locative nouns} ɔ́p ‘up(perside)’ to mark the ground in \REF{ex:key:1184}:",ex:key:1183,\gll Di pikín \textbf{fɔdɔ́n} \textbf{di} \textbf{stík}. | \gls DEF child fall DEF tree | \glt ‘The child fell from the tree.’,ex:key:1184,"\gll Di pikín \textbf{fɔdɔ́n} \textbf{frɔn} \textbf{ɔ́p} \textbf{di} \textbf{stík}, frɔn di stík. | \gls DEF child fall from up DEF tree from DEF tree | \glt ‘The child fell from (up on) the tree, from the tree.’",ex:key:1184,"\gll Di pikín \textbf{fɔdɔ́n} \textbf{frɔn} \textbf{ɔ́p} \textbf{di} \textbf{stík}, frɔn di stík. | \gls DEF child fall from up DEF tree from DEF tree | \glt ‘The child fell from (up on) the tree, from the tree.’",,,,,,,,,,,,,,
Grammatical relations,Valency\label{sec:9.3,Associative objects\label{sec:9.3.2,,,"The semantic role of the objects of smɛ́l ‘smell’ can only be disambiguated by context. In \REF{ex:key:1185} the associative object chɔ́p ‘food’ denotes the source of the sensation, in \REF{ex:key:1186}, chɔ́p denotes the stimulus{\fff}:",ex:key:1185,"\gll E de kúk, áfta e de \textbf{smɛ́l} \textbf{chɔ́p}. | \gls 3SG.SBJ IPFV cook then 3SG.SBJ IPFV smell food | \glt ‘He’s cooking, afterwards he’ll smell of food.’",ex:key:1186,"\gll Yu de \textbf{smɛ́l} \textbf{chɔ́p}, dɛn de fráy ɛ́ks dé. | \gls 2SG IPFV smell food 3PL IPFV fry egg there | \glt ‘You smell food, they’re frying eggs there.’",,,,,,,,,,,,,,,,
Grammatical relations,Valency\label{sec:9.3,Associative objects\label{sec:9.3.2,,,"Another instance of an associative object with the semantic role of cause is mɔní ‘money’, the object of kráy ‘cry’ in \REF{ex:key:1190}:",ex:key:1190,\gll (...) dán papá de \textbf{kráy} in \textbf{mɔní}. | \gls (...) that father IPFV cry 3SG.POSS money. | \glt ‘(...) that elderly man was crying over his (lost) money.’,,,,,,,,,,,,,,,,,,
Grammatical relations,Valency\label{sec:9.3,Associative objects\label{sec:9.3.2,,,"An associative object may be fronted for emphasis \REF{ex:key:1191}. However, unlike patient\is{patient} or beneficiary\is{beneficiary} objects, associative objects may not be questioned with wétin ‘what’ or údat ‘who’. Instead, associative objects must be questioned with the corresponding adverbial question phrase or with the selective question element ús=káyn ‘\textsc{which’}, which questions modifiers.",ex:key:1191,"\gll Dán pɔ́sin go ánsa yú, “yɛ́s, na malérya e bin de \textbf{sík}.” | \gls that person POT answer 2SG.INDP yes FOC malaria 3SG.SBJ PST IPFV sick | \glt ‘That person would reply to you “yes, it’s malaria that she was sick with”.’",,,,,,,,,,,,,,,,,,
Grammatical relations,Valency\label{sec:9.3,Associative objects\label{sec:9.3.2,,,"Hence the clause e de sík fíba \textsc{‘3sg.sbj} \textsc{ipfv} be sick fever’ = ‘she’s sick (with) fever’ cannot be questioned as *wétin e de sík ‘what \textsc{3sg.sbj} \textsc{ipfv} be.sick’ = ‘what is she sick (with)?’ Rather, the question must be phrased as in \REF{ex:key:1192}:",ex:key:1192,\gll \'{U}s=káyn \textbf{sík} e de \textbf{sík}? | \gls Q=kind sickness 3SG.SBJ IPFV be.sick | \glt ‘What kind of sickness does she have?’,,,,,,,,,,,,,,,,,,
Grammatical relations,Valency\label{sec:9.3,Cognate objects\label{sec:9.3.3,,,"Aside from that, the use of cognate objects provides an important means of expressing emphasis \is{emphasis}in pragmatically marked, emphatic contexts such as (\ref{ex:key:1195}–\ref{ex:key:1196}). Emphatic cognate objects are frequently preceded by the indefinite determiner wán ‘one, a’ which provides emphasis in other contexts as well (e.g. in the context of negative indefinite phrases, cf. \ref{ex:key:575}):",ex:key:1195,\gll Dɛn bin \textbf{fáyn} \textbf{wán} \textbf{fáyn}. | \gls 3PL PST be.fine one fineness | \glt ‘They were really fine.’,ex:key:1196,\gll Dán torí bin de \textbf{swít} mí \textbf{wán} \textbf{swít}. | \gls that story PST IPFV be.tasty 1SG.INDP one tastiness | \glt ‘I really enjoyed that story.’,ex:key:575,\gll \textbf{Nó} tɔ́k \textbf{nó} \textbf{wán} wɔ́d! | \gls NEG talk NEG one word | \glt ‘Don’t say a single word!’,,,,,,,,,,,,,,
Grammatical relations,Valency\label{sec:9.3,Cognate objects\label{sec:9.3.3,,,The cognate object dáy ‘death’ also appears as a cognate object to the verb dáy ‘die’ in emphatic contexts like \REF{ex:key:1197}:,ex:key:1197,"\gll \'{E}y, dán káyn spɛ́tikul, a \textbf{dáy} \textbf{dáy}. | \gls INTJ that kind glasses 1SG.SBJ die death | \glt ‘Hey, [if I had] that kind of glasses, I would surely die.’",,,,,,,,,,,,,,,,,,
Grammatical relations,Valency\label{sec:9.3,Double-object constructions\label{sec:9.3.4,,,"The bulk of Pichi verbs can occur with one as well as two objects\is{objects}. The primacy of the object next to the verb – which is usually animate and has the role of recipient\is{recipient} or beneficiary – is evident in double-object constructions involving two object pronouns. The presence of two pronominal objects is ungrammatical if the clitic object pronoun =an is preceded by the low-toned personal pronoun una/unu ‘\textsc{2pl}’ or another \textsc{3sg.obj} pronoun =an (for details, see \sectref{sec:3.3}, on tone-conditioned suppletive allomorphy). In such cases, it is the patient object that remains unexpressed. Compare the double-object construction in \REF{ex:key:1199} with the ungrammatical example \REF{ex:key:1200} and sentence \REF{ex:key:1201}. In the latter example, the \textsc{3sg.obj} theme\is{theme} object =an remains unexpressed:",ex:key:1199,\gll Yu gɛ́fɔ sɛ́n \textbf{wí=an}. | \gls 2SG have.to send 1PL.INDP=3SG.OBJ | \glt ‘You have to send it to us.’,ex:key:1200,Not found,ex:key:1201,\gll A go gí \textbf{unu} tumɔ́ro. | \gls 1SG.SBJ POT give 2PL tomorrow | \glt ‘I’ll give you (it) tomorrow.’,,,,,,,,,,,,,,
Grammatical relations,Valency\label{sec:9.3,Double-object constructions\label{sec:9.3.4,,,"In the type 1 double-object construction, the primary object to the right of the verb occupies the recipient role, while the secondary object that follows the recipient invariably takes on a patient \is{patient}role. This kind of construction is found with verbs expressing the transfer of an entity or an act of communication from the subject\is{subjects} to a recipient. All ditransitive communication and transfer verbs encountered in the corpus are listed in \REF{ex:key:1202}:",ex:key:1202,Not found,,,,,,,,,,,,,,,,,,
Grammatical relations,Valency\label{sec:9.3,Double-object constructions\label{sec:9.3.4,,,"Pichi has no SVCs of the \textsc{give} type in order to mark a recipient or beneficiary\is{beneficiary SVC}. In double-object constructions featuring transfer verbs, the primary object next to the verb always has the semantic role of recipient \REF{ex:key:1203}. With transfer and communication verbs, a beneficiary\is{associative preposition} is usually expressed in a PP\is{prepositional phrases} introduced by fɔ ‘\textsc{prep’} \REF{ex:key:1204}. Hence, double-object constructions are the only means of expressing the grammatical relation between the ditransitive verb, its subject, and its recipient and theme\is{theme} objects:",ex:key:1203,\gll Mi mamá dás \textbf{mí} \textbf{sɔn} \textbf{regalo}. | \gls 1SG.POSS mother give.as.present 1SG.INDP some present | \glt ‘My mother gave me a present.’,ex:key:1204,\gll Mi mamá dás \textbf{sɔn} \textbf{regalo} \textbf{fɔ} \textbf{mí}. | \gls 1SG.POSS mother give.as.present some present PREP 1SG.INDP | \glt ‘My mother gave (somebody) a present for me.’,,,,,,,,,,,,,,,,
Grammatical relations,Valency\label{sec:9.3,Double-object constructions\label{sec:9.3.4,,,The following two double-object constructions involve the transfer verb gí ‘give’ \REF{ex:key:1206} and the verb of communication púl (torí) ‘narrate (a story)’ \REF{ex:key:1207}:,ex:key:1206,\gll Dɛn bin gí \textbf{mí} \textbf{beca}. | \gls 3PL PST give 1SG.INDP scholarship. | \glt ‘I was given a scholarship.’,ex:key:1207,\gll Na ín e de kán púl \textbf{mí} \textbf{dán} \textbf{torí}. | \gls FOC 3SG.INDP 3SG.SBJ IPFV come pull 1SG.INDP that story | \glt ‘That’s when she comes to tell me that story.’,,,,,,,,,,,,,,,,
Grammatical relations,Valency\label{sec:9.3,Double-object constructions\label{sec:9.3.4,,,"The verb sɛ́n ‘send, throw’ denotes a situation in which both a transfer and a motion event{\fff} co-occur. When sɛ́n is used in a double-object construction, the primary object is always a recipient \REF{ex:key:1208}.",ex:key:1208,\gll E gɛ́fɔ sɛ́n \textbf{mí=an}. | \gls 3SG.SBJ have.to send 1SG.INDP=3SG.OBJ | \glt ‘He has to send/throw it to me.’,,,,,,,,,,,,,,,,,,
Grammatical relations,Valency\label{sec:9.3,Double-object constructions\label{sec:9.3.4,,,"Like with other transfer verbs, the recipient of sɛ́n may not be expressed as a prepositional phrase. Where we do find a prepositional phrase (usually introduced by fɔ ‘\textsc{prep}’), it can therefore only denote a beneficiary {\fff}or a goal{\fff} but not a recipient {\fff}\REF{ex:key:1209}:",ex:key:1209,\gll E gɛ́fɔ sɛ́n=an \textbf{fɔ} \textbf{yú}. | \gls 3SG.SBJ have.to send=3SG.OBJ PREP 2SG.INDP | \glt ‘He has to send it to (where) you (are).’ or ‘He has to send it for you.’ but not `He has to send it to you.',,,,,,,,,,,,,,,,,,
Grammatical relations,Valency\label{sec:9.3,Double-object constructions\label{sec:9.3.4,,,"Sentence \REF{ex:key:1210} features two type 2 double-object constructions. The verb dú ‘do’ takes the primary, beneficiary object mí ‘\textsc{1sg.indp}’ and the patient object sɔn fébɔ ‘a favour’. The verb wás ‘wash’ also takes mí ‘\textsc{1sg.indp}’ as the beneficiary object while klós dɛn ‘clothing’ functions as the patient object:",ex:key:1210,\gll A wánt mék yu dú \textbf{mí} \textbf{sɔn} \textbf{fébɔ} mék yu wás \textbf{mí} \textbf{sɔn} \textbf{klós} \textbf{dɛn}. | \gls 1SG.SBJ want SBJV 2SG do 1SG.INDP some favour SBJV 2SG wash 1SG.INDP some clothing PL | \glt ‘I want you to do me a favour (and) wash some clothes for me.’,,,,,,,,,,,,,,,,,,
Grammatical relations,Valency\label{sec:9.3,Double-object constructions\label{sec:9.3.4,,,"The semantic role of beneficiary may subsume a maleficiary\is{maleficiary}, i.e. the affected party of a socially unacceptable action. In \REF{ex:key:1211}, a worried mother explains why she has left her teenage daughter in Spain instead of bringing her along with her to Malabo. Also, compare the first object of tíf ‘steal’, the maleficiary mí ‘\textsc{1sg.indp}’ in \REF{ex:key:1212}:",ex:key:1211,\gll A lɛ́f mi pikín na Panyá bikɔs a de fía sé dɛn go bɛlɛ́ \textbf{mí} \textbf{mi} \textbf{pikín}. | \gls 1SG.SBJ leave 1SG.POSS child LOC Spain because 1SG.SBJ IPFV fear QUOT 3PL POT impregnate 1SG.INDP 1SG.POSS child | \glt ‘I have left my child in Spain because I fear that she would fall pregnant on me.’,ex:key:1212,\gll Dɛn tíf \textbf{mí} \textbf{mi} \textbf{sús}. | \gls 3PL steal 1SG.INDP 1SG.POSS shoe | \glt ‘They stole my shoes from me.’,,,,,,,,,,,,,,,,
Grammatical relations,Valency\label{sec:9.3,Double-object constructions\label{sec:9.3.4,,,"We have seen that a recipient\is{recipient} must be expressed as an object in type 1 double-object constructions. In contrast to type 1 constructions, type 2 constructions alternate freely with constructions in which the beneficiary is expressed as a prepositional phrase introduced by the associative preposition fɔ ‘\textsc{prep}’. In fact, the alternative involving a prepositional phrase is more common than the corresponding double-object construction. Compare the type 2 double-object construction \REF{ex:key:1213} involving the verb bay ‘buy’ with the PP alternative \REF{ex:key:1214}:",ex:key:1213,"\gll \'{A}fta primera dama báy=an \textbf{wán} \textbf{motó}, (...) | \gls then first lady buy=3SG.OBJ one car (...) | \glt ‘Then the first lady bought him a car (...)’",ex:key:1214,\gll \MakeUppercase{A} bin báy \textbf{wán} \textbf{motó} \textbf{fɔ} \textbf{mi} \textbf{mása}. | \gls SG.sbj PST buy one car PREP 1SG.POSS boss | \glt ‘I bought a car for my boss.’,,,,,,,,,,,,,,,,
Grammatical relations,Valency\label{sec:9.3,Double-object constructions\label{sec:9.3.4,,,"The second type of type 2 construction involves the caused location verb pút ‘put’. Here, the primary object has the semantic role of goal,\is{goal} while the secondary object fulfills a theme\is{theme} role. In \REF{ex:key:1215}, the primary object of pút is the goal object =an ‘\textsc{3sg.obj}’, while the secondary object saldo ‘(mobile phone) credit’ is the theme\is{theme}. Sentence \REF{ex:key:1216} also features the goal object =an ‘\textsc{3sg.obj}’, while the theme object is cacahuete ‘groundnut’:",ex:key:1215,"\gll Yu gɛ́t móvil, yu dɔ́n pút=\textbf{an} \textbf{saldo}? | \gls 2SG get mobile 2SG PRF put=3SG.OBJ credit | \glt ‘Do you have a mobile-phone, have you put credit into it?’",ex:key:1216,"\gll A báy dán dís tín, sɔn smɔ́l pépa, dɛn de pút=\textbf{an} \textbf{cacahuete}. | \gls 1SG.SBJ buy that this thing some small paper 3PL IPFV put=3SG.OBJ peanut | \glt ‘I bought that thing, a small paper, they put peanuts into it.’",,,,,,,,,,,,,,,,
Grammatical relations,Valency\label{sec:9.3,Double-object constructions\label{sec:9.3.4,,,"However, the corpus contains many more examples of pút{}-constructions, in which the goal role is expressed through a locative construction rather than a primary object. Likewise, there is no sentence in the data in which the goal object of pút is a full noun. The locative construction may be a PP \REF{ex:key:1217} or involve a locative noun \REF{ex:key:1218}. Unlike a few other verbs with a motion\is{motion verbs} component (cf. \sectref{sec:8.1.4}), the goal of pút cannot be expressed as a complement of the V2 of a motion-direction SVC (e.g. *a pút=an gó na glás \{\textsc{1sg.sbj} put=\textsc{3sg.obj} go \textsc{loc} glass\} = ‘I put it into the glass’):",ex:key:1217,\gll Dɛn kin pút=an \textbf{fɔ} \textbf{glás}. | \gls 3PL HAB put=3SG.OBJ PREP glass | \glt ‘They put it into the glass.’,ex:key:1218,\gll \MakeUppercase{A} dɔ́n \textbf{pút} mi búk \textbf{ínsay}. | \gls 1SG.SBJ PRF put 1SG.POSS book inside | \glt ‘I have put my book inside.’,,,,,,,,,,,,,,,,
Grammatical relations,Valency\label{sec:9.3,Double-object constructions\label{sec:9.3.4,,,"There is a preference to interpret a PP introduced by fɔ ‘\textsc{prep}’ as a beneficiary \is{beneficiary}in pút{}-double-object constructions, particularly where an object pronoun theoretically allows for both interpretations as in \REF{ex:key:1219}. A sentence like \REF{ex:key:1218} above, which involves a locative noun\is{locative nouns} (i.e. ínsay ‘inside’) is therefore preferred to avoid ambiguity. Nevertheless, an alternative with a prepositional phrase involving the general locative preposition na may also be exploited to the same end \REF{ex:key:1220}:",ex:key:1219,\gll A dɔ́n pút granát \textbf{fɔr=an}. | \gls 1SG.SBJ PRF put peanut PREP=3SG.OBJ | \glt ‘I have put peanuts [somewhere] for her.’,ex:key:1218,\gll \MakeUppercase{A} dɔ́n \textbf{pút} mi búk \textbf{ínsay}. | \gls 1SG.SBJ PRF put 1SG.POSS book inside | \glt ‘I have put my book inside.’,ex:key:1220,\gll A dɔ́n pút granát \textbf{na} \textbf{ín}. | \gls 1SG.SBJ PRF put peanut LOC 3SG.INDP | \glt ‘I have put peanuts into it.’,,,,,,,,,,,,,,
Grammatical relations,Valency\label{sec:9.3,Double-object constructions\label{sec:9.3.4,,,"Type 3 double-object construction involve verbs that may take associative objects (cf. \tabref{tab:key:9.9} above). Type 3 constructions differ from type 1 and type 2 constructions in that the primary object occupies the semantic role of patient. The secondary object is an associative object which may alternatively be expressed without any syntactic rearrangement through the mere insertion of a preposition, serial verb, or any other element between the two objects. The associative objects in type 3 constructions may therefore be paraphrased with the same means as associative objects in single-object constructions. Compare the double-object construction in \REF{ex:key:1222} with the single-object construction involving a PP in \REF{ex:key:1223}:\is{adjuncts}",ex:key:1222,\gll Na lɛk sé yu fúlɔp \textbf{di} \textbf{glás} \textbf{watá}? | \gls FOC like QUOT 2SG fill DEF glás water | \glt ‘As if you filled this glass with water?’,ex:key:1223,\gll E fúlɔp \textbf{di} \textbf{glás} \textbf{wet} \textbf{watá}. | \gls 3SG.SBJ fill.up DEF glass with water | \glt ‘She filled the glass with water.’,,,,,,,,,,,,,,,,
Grammatical relations,Valency\label{sec:9.3,Reflexivity\label{sec:9.3.5,,,"In the majority of cases, reflexivity is expressed through an object NP consisting of the pronominal and reflexive anaphor sɛ́f ‘self’ and a preceding possessive pronoun with the same person and number as the subject{\fff}. Sometimes, the body part{\fff} nouns skín ‘body’, bɔ́di ‘body’, and héd ‘head’ are also employed as reflexive anaphors in the same syntactic position as sɛ́f. A clause featuring a reflexive object NP indicates that the subject does something to her- or himself. The corpus only contains clauses in which subjects serve as antecedents to the reflexive anaphor, cf. \REF{ex:key:1224}:",ex:key:1224,"\gll Dán gál e kin fíks \textbf{in} \textbf{sɛ́f}, pént \textbf{in} \textbf{sɛ́f}. | \gls that girl 3SG.SBJ HAB fix 3SG.POSS self paint 3SG.POSS self | \glt ‘That girl habitually fixes herself up, paints herself [puts on make up].’",,,,,,,,,,,,,,,,,,
Grammatical relations,Valency\label{sec:9.3,Reflexivity\label{sec:9.3.5,,,Compare wɛ́r ‘dress (up)’ in an explicitly reflexive clause \REF{ex:key:1230} and a clause in which reflexivity remains unexpressed \REF{ex:key:1231}:,ex:key:1230,\gll Toichoa \textbf{wɛ́r} \textbf{in} \textbf{sɛ́f}. | \gls NAME wear 3SG.POSS self | \glt ‘Toichoa has/is dressed up.’,ex:key:1231,\gll A \textbf{wɛ́r}. | \gls 1SG.SBJ wear | \glt ‘I’m dressed/have got dressed.’,,,,,,,,,,,,,,,,
Grammatical relations,Valency\label{sec:9.3,Reciprocity\label{sec:9.3.6,,,"Next to its use as a reflexive anaphor, the pronominal sɛ́f ‘self’ also serves as a reciprocal pronominal with plural referents. In sentence \REF{ex:key:1232}, the reciprocal NP is an object to the verb sláp ‘slap’, in \REF{ex:key:1233} to the locative noun bifó ‘before’:",ex:key:1232,\gll Dɛn de sláp \textbf{dɛn} \textbf{sɛ́f}. | \gls 3PL IPFV slap 3PL self | \glt ‘They’re slapping each other.’,ex:key:1233,\gll Pero dɛn nó sidɔ́n bifó \textbf{dɛn} \textbf{sɛ́f}. | \gls but 3PL NEG sit.down before 3PL self | \glt ‘But they’re not sitting in front of each other.’,,,,,,,,,,,,,,,,
Grammatical relations,Valency\label{sec:9.3,Reciprocity\label{sec:9.3.6,,,"Reflexive and reciprocal meaning may be disambiguated through contextual factors, i.e. verb meaning and the presence of plural referents. The occurrence of compound personal pronouns indicating dual number (i.e. dɛn-ɔl-tú ‘the two of them’) as in \REF{ex:key:1234} or universal inclusivity (dɛn-ɔ́l ‘all of them’) as in \REF{ex:key:1235} is also quite common in reciprocal contexts:",ex:key:1234,\gll Fɔ́s na \textbf{dɛn-ɔl-tú} dɛn bin de abraza \textbf{dɛn} \textbf{sɛ́f}. | \gls first FOC 3PL.CPD-all.CPD-two 3PL PST IPFV embrace 3PL self | \glt ‘First it’s the two of them that were embracing each other.’,ex:key:1235,Not found,,,,,,,,,,,,,,,,
Grammatical relations,Valency\label{sec:9.3,Reciprocity\label{sec:9.3.6,,,Reciprocal relations within the \textsc{NP} find expression through the pronominal\is{possessive pronominal} yón as illustrated in \REF{ex:key:1236}:,ex:key:1236,\gll Dɛn lúk \textbf{dɛn} \textbf{yón} fés. | \gls 3PL look 3PL own face | \glt ‘They looked at thier own faces.’,,,,,,,,,,,,,,,,,,
Grammatical relations,Valency\label{sec:9.3,Weather phenomena\label{sec:9.3.7,,,"Pichi has three types of constructions for expressing weather phenomena. The first type of construction consists of an intransitive clause with the weather phenomenon in the subject\is{subjects} position. The verbs used in the first type of construction have a general meaning and also occur in other contexts including transitive clauses. Three sentences follow featuring the two weather verbs bló ‘blow’ (\ref{ex:key:1237}–\ref{ex:key:1238}) and bráyt ‘be bright’ \REF{ex:key:1239} and the weather nouns tináda ‘thunderstorm’, brís ‘air’, and sán ‘sun’:",ex:key:1237,\gll Tináda de \textbf{bló}. | \gls thunderstorm IPFV blow | \glt ‘A thunderstorm is raging.’,ex:key:1238,\gll Brís de \textbf{bló}. | \gls air IPFV blow | \glt ‘The wind is blowing.’,ex:key:1239,\gll Di sán \textbf{bráyt}. | \gls DEF sun be.bright | \glt ‘The sun is bright/is shining.’,,,,,,,,,,,,,,
Grammatical relations,Valency\label{sec:9.3,Weather phenomena\label{sec:9.3.7,,,"Sentence \REF{ex:key:1240} exemplifies the transitive usage of bló ‘blow’, sentence \REF{ex:key:1241} that of bráyt, here with the meaning ‘brighten, light up’:",ex:key:1240,\gll Di ventilador de \textbf{bló} \textbf{mí}. | \gls DEF fan IPFV blow 1SG.INDP | \glt ‘The fan is blowing at me.’,ex:key:1241,\gll Di sán \textbf{bráyt} \textbf{di} \textbf{dé}. | \gls DEF sun brighten DEF day | \glt ‘The sun lit up the sky.’,,,,,,,,,,,,,,,,
Grammatical relations,Valency\label{sec:9.3,Weather phenomena\label{sec:9.3.7,,,"In expressions where reference is made to the general atmospheric condition, the noun dé ‘day, weather’ appears in the subject\is{subjects} position instead of a specific natural element. This usage is exemplified in the following three sentences and also in \REF{ex:key:1241} above:",ex:key:1241,\gll Di sán \textbf{bráyt} \textbf{di} \textbf{dé}. | \gls DEF sun brighten DEF day | \glt ‘The sun lit up the sky.’,,,,,,,,,,,,,,,,,,
