Chapter,Section,Subsection,Subsubsection,Subsubsubsection,Knowledge Point,Label 1,Content 1,Label 2,Content 2,Label 3,Content 3,Label 4,Content 4,Label 5,Content 5,Label 6,Content 6,Label 7,Content 7,Label 8,Content 8,Label 9,Content 9,Label 10,Content 10
Enclitics\label{ch:enclitics,,,,,"\phono{-shI} (evidential~--~reportative/quotative) indicates that the speaker has non-perso\-nal-experience evidence for the proposition under the scope of the evidential. \phono{-shI} appears systematically in stories. Often translated as ‘they say.’ \phono{-trI} (evidential~--~conjectural) indicates that the speaker is making a conjecture to the proposition under the scope of the evidential from a set of propositions for which she has either direct or not-direct evidence. Generally translated in Spanish as \spanish{seguro} ‘for sure’, indicating possibility or probability. \phono{-ari} (assertive force) indicates conviction on the part of the speaker. Translated as ‘certainly’ or ‘of course’.\footnote{An anonymous reviewer writes that in other varieties of Quechuan, “\phono{-ari} is interpersonal. It expresses solidarity, affirming what someone else says, thinks or believes to be true.”} \phono{-ik} and \phono{-iki} (evidential modifiers) indicate increasing evidence strength (and increased assertive force or conjectural certainty, in the case of the direct and conjectural modifiers, \phono{-mI} and \phono{-trI}, respectively). Generally translated in Spanish as \spanish{pues} and \spanish{seguro}, respectively. Examples in Table~\ref{Tab30} are fully glossed in the corresponding sections.",Tab30,Not found,,,,,,,,,,,,,,,,,,
Enclitics\label{ch:enclitics,Individual enclitics\label{sec:indenc,,,,"In \SYQ, as in other Quechuan languages, the enclitics can be divided into two classes: (a)~those which position the utterance with regard to others salient in the discourse (restrictive/limitative \phono{-lla}, discontinuative \phono{-ña}, additive \phono{-pis}, topic marking \phono{-qa}, continuative \phono{-Raq}, sequential \phono{-taq}, and interrogative/negative/disjunctive \phono{-chu}); and (b)~those that position the speaker with regard to the utterance (emphatic \phono{-YÁ}, certainty marker \phono{-puni}, and the evidentials \phono{-mi}, \phono{-shi}, and \phono{-tri} along with their modifiers \phono{-ik}, \phono{-iki}, and \phono{-aRi}.). \sectref{ssec:emphatic}--\ref{ssec:emotive} cover all enclitics except the evidentials and their modifiers, in alphabetical order. The evidentials and their modifiers are the subject of \sectref{ssec:evidence}.",ssec:emotive,Not found,,,,,,,,,,,,,,,,,,
Enclitics\label{ch:enclitics,Individual enclitics\label{sec:indenc,Emphatic \phono{-Yá\label{ssec:emphatic\index[sub]{emphatic,,,"Realized as \phono{-yá} in all environments~(\ref{Glo6:Ari}--\ref{Glo6:Sirbisatatr}) except following an evidential, in which case both the \phono{I} of the evidential and the \phono{Y} of the emphatic are elided and \phono{Yá} is realized as \phono{á}~(\ref{Glo6:Balikushatr}--\ref{Glo6:Unayqa}).\\",Glo6:Ari,\gsrc ¡Ari\textbf{yá}! | \gll ari-yá | \gls yes-EMPH | \glt Yes \textbf{indeed}.,Glo6:Sirbisatatr,"\gsrc Sirbisatatr mas mastaqa rantikurun. Sirbisatayá. | \gll sirbisa-ta-tr mas mas-ta-qa ranti-ku-ru-n sirbisa-ta-yá | \gls beer-ACC-EVC more more-ACC-TOP buy-REFL-URGT-3 beer-ACC-EMPH | \glt \spkr~1: “They must have sold a lot more beer.” \spkr~2: “Beer, \textbf{all right}!”",Glo6:Balikushatr,\gsrc Balikushatr kara. Payta\textbf{má} rikarani. | \gll baliku-sha-tr ka-ra pay-ta-m-á rika-ra-ni | \gls request.a.service-PRF-EVC be-PST he-ACC-EVD-EMPH see-PST-1 | \glt He must have been requested. I saw him.,Glo6:Unayqa,"\gsrc Unayqa Awkichanka inkantakura\textbf{shá} wak altupa yantaman riptiki. | \gll unay-qa Awkichanka inkanta-ku-ra-sh-á wak altu-pa yanta-man ri-pti-ki | \gls before-TOP Awkichanka enchant-REFL-PST-EVR-EMPH DEM.D high-LOC firewood-ALL go-SUBDS-2 | \glt In olden times, Awkichanka, too, bewitched, \textbf{they say}, up hill if you went for firewood.",,,,,,,,,,,,
Enclitics\label{ch:enclitics,Individual enclitics\label{sec:indenc,"Interrogation, negation, disjunction \phono{-chu\label{ssec:innedi",,,"\phono{-chu} indicates absolute~(\ref{Glo6:Iskwilaman}) and disjunctive questions~(\ref{Glo6:Qari}), (\ref{Glo6:Don}), negation~(\ref{Glo6:Chaytri}), and disjunction~(\ref{Glo6:Kandilaryapa}).\footnote{An anonymous reviewer points out that in \ili{Huaylas} Q, negative \phono{-tsu} is distinguished from polar question \phono{-ku}. \ili{Huaylas} is not unique among Quechuan languages in making this distinction.}",Glo6:Iskwilaman,\gsrc ¿Iskwilaman trurashurqanki\textbf{chu} mamayki? | \gll iskwila-man trura-shu-rqa-nki-chu mama-yki | \gls school-ALL put-2.OBJ-PST-2-Q mother-3 | \glt \textbf{Did} your mother put you in school?,Glo6:Qari,\gsrc ¿Qari\textbf{chu} kanki warmi\textbf{chu} kanki? | \gll ¿qari-chu ka-nki warmi-chu ka-nki | \gls man-Q be-2 woman-Q be-2 | \glt Are you a man \textbf{or} a woman?,Glo6:Don,"\gsrc ¿Don Juan\textbf{chu} icha alman\textbf{chu} hamuyan? | \gll Don Juan-chu icha alma-n-chu hamu-ya-n | \gls Don Juan-Q or soul-3-Q come-PROG-3 | \glt Is it Don Juan, \textbf{or} is his spirit coming?",Glo6:Chaytri,\gsrc Chaytri \textbf{mana} suyawarqa\textbf{chu}. | \gll chay-tri mana suya-wa-rqa-chu | \gls DEM.D-EVC no wait-1.OBJ-PST-NEG | \glt That’s why she would\textbf{n’t} have waited for me.,Glo6:Kandilaryapa,\gsrc Kandilaryapa\textbf{chu} bintisinkupa\textbf{chu}. | \gll kandilarya-pa-chu binti-sinku-pa-chu | \gls Candelaria-LOC-DISJ twenty-five-LOC-DISJ | \glt \textbf{Either} on Candelaria \textbf{or} on the twenty-fifth.,,,,,,,,,,
Enclitics\label{ch:enclitics,Individual enclitics\label{sec:indenc,"Interrogation, negation, disjunction \phono{-chu\label{ssec:innedi",,,"Where it functions to indicate interrogation\index[sub]{interrogation!\phono{-chu}} or negation\index[sub]{negation!\phono{-chu}}, \phono{-chu} attaches to the sentence fragment that is the focus of the interrogation or negation~(\ref{Glo6:Chaypachu}).",Glo6:Chaypachu,\gsrc ¿Chaypa\textbf{chu} tumarqanki? | \gll chay-pa-chu tuma-rqa-nki | \gls DEM.D-LOC-Q take-PST-2 | \glt Did you take [pictures] \textbf{there}?,,,,,,,,,,,,,,,,,,
Enclitics\label{ch:enclitics,Individual enclitics\label{sec:indenc,"Interrogation, negation, disjunction \phono{-chu\label{ssec:innedi",,,Where it functions to indicate disjunction\index[sub]{disjunction} --~in either disjunctive questions or disjunctive statements~-- \phono{-chu} generally attaches to each of the disjuncts~(\ref{Glo6:Mario}).,Glo6:Mario,\gsrc Mario\textbf{chu} karqa Julián\textbf{chu} karqa. | \gll Mario-chu ka-rqa Julián-chu ka-rqa | \gls Mario-DISJ be-PST Julián-DISJ be-PST | \glt It was \textbf{either} Mario \textbf{or} Julián.,,,,,,,,,,,,,,,,,,
Enclitics\label{ch:enclitics,Individual enclitics\label{sec:indenc,"Interrogation, negation, disjunction \phono{-chu\label{ssec:innedi",,,Questions that anticipate a negative answer are indicated by \phono{mana-chu}~(\ref{Glo6:Manachu}).,Glo6:Manachu,\gsrc ¿\textbf{Manachu} kuska linman? | \gll mana-chu kuska li-n-man | \gls no-Q together go-3-COND | \glt \textbf{Couldn’t} they go together?,,,,,,,,,,,,,,,,,,
Enclitics\label{ch:enclitics,Individual enclitics\label{sec:indenc,"Interrogation, negation, disjunction \phono{-chu\label{ssec:innedi",,,\phono{mana-chu} may also “soften” questions~(\ref{Glo6:Paysanu}).,Glo6:Paysanu,"\gsrc Paysanu, ¿\textbf{manachu} vakata rantiyta munanki? | \gll paysanu mana-chu vaka-ta ranti-y-ta muna-nki | \gls countryman no-Q cow-ACC buy-INF-ACC want-2 | \glt My countryman, \textbf{do you not} want to buy a cow?",,,,,,,,,,,,,,,,,,
Enclitics\label{ch:enclitics,Individual enclitics\label{sec:indenc,"Interrogation, negation, disjunction \phono{-chu\label{ssec:innedi",,,"It may also be used, like \phono{aw} ‘yes’, in the formation of tag questions~(\ref{Glo6:Lliw}).",Glo6:Lliw,"\gsrc Lliw lliwtriki wañukushun, puchukashun entonces, ¿\textbf{manachu}? | \gll lliw lliw-tr-iki wañu-ku-shun puchuka-shun intunsis mana-chu | \gls all all-EVC-IKI die-REFL-1PL.FUT finish.off-1PL.FUT therefore no-Q | \glt We’ll all have to die, to finish off then, \textbf{isn’t that so}?",,,,,,,,,,,,,,,,,,
Enclitics\label{ch:enclitics,Individual enclitics\label{sec:indenc,"Interrogation, negation, disjunction \phono{-chu\label{ssec:innedi",,,"In negative sentences, \phono{-chu} generally co-occurs with \phono{mana} ‘not’~(\ref{Glo6:mana}); \phono{-chu} is also licensed by additive enclitic \phono{-pis}~(\ref{Glo6:Kaspin}), (\ref{Glo6:Manchakushpa}) and \phono{ni} ‘nor’~(\ref{Glo6:Apuraw}), (\ref{Glo6:wayta}).",Glo6:mana,"\gsrc Aa, \textbf{mana}yá kan\textbf{chu}. \textbf{Mana}yá bula kan\textbf{chu}. | \gll aa mana-yá ka-n-chu mana-yá bula ka-n-chu | \gls ah no-EMPH be-3-NEG no-EMPH ball be-3-NEG | \glt Ah, there are\textbf{n’t} any. There are\textbf{n’t} any balls.",Glo6:Kaspin,\gsrc Kaspin\textbf{pis} kan\textbf{chu}. | \gll kaspi-n-pis ka-n-chu | \gls stick-3-ADD be-3-NEG | \glt She does\textbf{n’t} have a stick.,Glo6:Manchakushpa,"\gsrc Manchakushpa tuta\textbf{s} puñu:\textbf{chu}. | \gll mancha-ku-shpa tuta-s puñu-:-chu | \gls scare-REFL-SUBIS night-ADD sleep-1-NEG | \glt Being scared, I \textbf{don’t} sleep at night.",Glo6:Apuraw,\gsrc Apuraw wañururqariki. \textbf{Ni} apanña\textbf{chu}. | \gll apuraw wañu-ru-rqa-r-iki ni apa-n-ña-chu | \gls quick die-URGT-PST-R-IKI nor bring-3-DISC-NEG | \glt He died quickly. They \textbf{didn’t even} bring him [to the hospital].,Glo6:wayta,\gsrc \textbf{Manam} wayta\textbf{chu} \textbf{ni} pishqu\textbf{chu}. | \gll mana-m wayta-chu ni pishqu-chu | \gls no-EVD flower-NEG nor bird-NEG | \glt \textbf{Neither} a flower \textbf{nor} a bird.,,,,,,,,,,
Enclitics\label{ch:enclitics,Individual enclitics\label{sec:indenc,"Interrogation, negation, disjunction \phono{-chu\label{ssec:innedi",,,"In prohibitions, \phono{-chu} co-occurs with \phono{ama} ‘don’t’~(\ref{Glo6:wawqi}).",Glo6:wawqi,"\gsrc “¡\textbf{Ama} wawqi:taqa wañuchiy\textbf{chu}!” niptinshi wañurachin paywantapis. | \gll ama wawqi-:-ta-qa wañu-chi-y-chu ni-pti-n-shi wañu-ra-chi-n pay-wan-ta-pis | \gls PROH brother-1-ACC-TOP die-CAUS-IMP-NEG say-SUBDS-3-EVR die-URGT-CAUS-3 he-INSTR-ACC-ADD | \glt When he said, “\textbf{Don’t} kill my brother!” they killed him with him, too.",,,,,,,,,,,,,,,,,,
Enclitics\label{ch:enclitics,Individual enclitics\label{sec:indenc,"Interrogation, negation, disjunction \phono{-chu\label{ssec:innedi",,,"\phono{-chu} does not appear in subordinate clauses, where negation is indicated with a negative particle alone~(\ref{Glo6:qali}), (\ref{Glo6:qatrachakunanpaq}).\footnote{An anonymous reviewer points out that elsewhere in Quechua, the correlates of negative \phono{-chu} typically can appear in subordinate clauses. There are no naturally-occurring examples of this in the Yauyos corpus.}",Glo6:qali,"\gsrc \textbf{Mana} qali kaptinqa ñuqanchikpis taqllakta hapishpa qaluwanchik. | \gll mana qali ka-pti-n-qa ñuqanchik-pis taqlla-kta hapi-shpa qaluwa-nchik | \gls no man be-SUBDS-3-TOP we-ADD plow-ACC grab-SUBIS turn.earth-1PL | \glt When there are \textbf{no} \textbf{men}, we grab the plow and turn the earth.",Glo6:qatrachakunanpaq,\gsrc \textbf{Mana} qatrachakunanpaq mandilchanta watachakun. | \gll mana qatra-cha-ku-na-n-paq mandil-cha-n-ta wata-cha-ku-n | \gls no dirty-FACT-REFL-NMLZ-3-PURP apron-DIM-3-ACC tie-DIM-REFL-3 | \glt She’s tying on an apron \textbf{so} she \textbf{doesn’t} get dirty.,,,,,,,,,,,,,,,,
Enclitics\label{ch:enclitics,Individual enclitics\label{sec:indenc,"Interrogation, negation, disjunction \phono{-chu\label{ssec:innedi",,,"In negative sentences, \phono{-chu} never occurs on the same segment as does an evidential enclitic~(\ref{Glo6:lluqsirqanki}).",Glo6:lluqsirqanki,Not found,,,,,,,,,,,,,,,,,,
Enclitics\label{ch:enclitics,Individual enclitics\label{sec:indenc,"Interrogation, negation, disjunction \phono{-chu\label{ssec:innedi",,,"Finally, interrogative \phono{-chu} is further restricted in that it does not appear in questions using interrogative pronouns~(\ref{Glo6:hamurqa}).\footnote{\phono{¿*Pi-taq} \phono{hamu-n-chu?} \phono{¿*Pi-taq-chu} \phono{hamu-n?} ‘Who is coming?’}",Glo6:hamurqa,Not found,,,,,,,,,,,,,,,,,,
Enclitics\label{ch:enclitics,Individual enclitics\label{sec:indenc,"Restrictive, limitative \phono{-lla",,,"\phono{-lla} indicates exclusivity or limitation in number\index[sub]{restrictive}: the individual~(\ref{Glo6:Iskwilapam}--\ref{Glo6:Kichwa}) or event/event type~(\ref{Glo6:Fwirti}), (\ref{Glo6:lliwtam}) remains limited to itself and is accompanied by no other.",Glo6:Iskwilapam,\gsrc Iskwilapam niytu:kunaqa wawa:kunaqa rinmi ñuqa\textbf{lla}m ka: analfabitu. | \gll iskwila-pa-m niytu-:-kuna-qa wawa-:-kuna-qa ri-n-mi ñuqa-lla-m ka-: analfabitu | \gls school-LOC-EVD nephew-1-PL-TOP baby-1-PL-TOP go-3-EVD I-RSTR-EVD be-1 illiterate | \glt My grandchildren are in school. My children went. I’m the \textbf{only} illiterate one.,Glo6:Kichwa,"\gsrc Kichwa\textbf{lla}ktam limakuya: kaytrawlaq manam kastillanukta lima:chu. | \gll kichwa-lla-kta-m lima-ku-ya-: kay-traw-laq mana-m kastillanu-kta lima-:-chu | \gls Quechua-RSTR-ACC-EVD speak-REFL-PROG-1 DEM.P-LOC-CONT no-EVD Spanish-ACC speak-1-NEG | \glt I’m talking \textbf{just} Quechua. Here, still, we don’t speak Spanish.",Glo6:Fwirti,\gsrc Fwirti kashpa\textbf{lla}má linchik pustaman. | \gll fwirti ka-shpa-lla-m-á li-nchik pusta-man | \gls strong be-SUBIS-RSTR-EVD-EMPH go-1PL clinic-ALL | \glt \textbf{Only} if it’s bad will we go to the health clinic.,Glo6:lliwtam,"\gsrc Lliw lliwtam rantishpa\textbf{lla}ñam kanan kamatapis chay polarkunatapis. | \gll lliw lliw-ta-m ranti-shpa-lla-ña-m kanan kama-ta-pis chay polar-kuna-ta-pis | \gls all all-ACC-EVD buy-SUBIS-RSTR-DISC-EVD now blanket-ACC-ADD DEM.D fleece-PL-ACC-ADD | \glt Now \textbf{just} buying everything -- blankets, [polyester] fleece.",,,,,,,,,,,,
Enclitics\label{ch:enclitics,Individual enclitics\label{sec:indenc,"Restrictive, limitative \phono{-lla",,,"\phono{-lla} can generally be translated as ‘just’~(\ref{Glo6:Chayna}), (\ref{Glo6:Sirka}) or ‘only’~(\ref{Glo6:Chay}); it sometimes has an ‘exactly’ interpretation~(\ref{Glo6:Iskinanpi}).",Glo6:Chayna,Not found,Glo6:Sirka,\gsrc Sirka\textbf{lla}tam riya: manam karutachu. | \gll sirka-lla-ta-m ri-ya-: mana-m karu-ta-chu | \gls close-RSTR-ACC-EVD go-PROG-1 no-EVD far-ACC-NEG | \glt I \textbf{just} go close; I don’t go far.,Glo6:Chay,\gsrc Chay\textbf{lla}tam yatrani. Masta yatranichu. | \gll chay-lla-ta-m yatra-ni mas-ta yatra-ni-chu | \gls DEM.D-LIM-ACC-EVD know-1 more-ACC know-1-NEG | \glt I \textbf{only} know that. I don’t know more.,Glo6:Iskinanpi,"\gsrc Iskinanpi sikya tuna\textbf{lla}npi wallpay watrakunraq. | \gll iskina-n-pi sikya tuna-lla-n-pi wallpa-y watra-ku-n-raq | \gls corner-3-LOC aqueduct corner-RSTR-3-LOC chicken-1 give.birth-REFL-3-CONT | \glt My hen lays eggs in the corner, \textbf{right} in the corner of the canal.",,,,,,,,,,,,
Enclitics\label{ch:enclitics,Individual enclitics\label{sec:indenc,"Restrictive, limitative \phono{-lla",,,"It is very, very widely employed~(\ref{Glo6:abaskuna}--\ref{Glo6:Chaytam}).",Glo6:abaskuna,"\gsrc Lliwta abaskuna albirhakuna ayvis\textbf{lla} rantikuni apani llaqtatam. | \gll lliw-ta abas-kuna albirha-kuna ayvis-lla ranti-ku-ni apa-ni llaqta-ta-m | \gls all-ACC broad.beans-PL peas-PL sometimes-RSTR buy-REFL-1 bring-1 town-ACC-EVD | \glt Everything -- broad beans, peas -- \textbf{once in while} I sell stuff -- I bring it into town.",Glo6:Chaytam,\gsrc Chaytam aysashpa\textbf{lla} pasachiwaq. | \gll chay-ta-m aysa-shpa-lla pasa-chi-wa-q | \gls DEM.D-ACC-EVD pull-SUBIS-RSTR pass-CAUS-1.OBJ-AG | \glt They had me cross the river pulling [me by the hand].,,,,,,,,,,,,,,,,
Enclitics\label{ch:enclitics,Individual enclitics\label{sec:indenc,Discontinuative \phono{-ña,,,"Discontinuitive. \phono{-ña}\index[sub]{discontinuitive} indicates transition --~change of state or quality. In affirmative statements, it can generally be translated as ‘already’~(\ref{Glo6:Kundinadaw}--\ref{Glo6:Paqwayanchik}); in negative statements, as ‘no more’ or ‘no longer’~(\ref{Glo6:Unaytrik}), (\ref{Glo6:Manana}); and in questions, as ‘yet’~(\ref{Glo6:Pasarun}), (\ref{Glo6:Rimaya}).",Glo6:Kundinadaw,\gsrc Kundinadaw\textbf{ña}m wakqa kayan. | \gll kundinadaw-ña-m wak-qa ka-ya-n | \gls condemned-DISC-EVD DEM.D-TOP be-PROG-3 | \glt That one is \textbf{already} condemned.,Glo6:Paqwayanchik,"\gsrc Paqwayanchik\textbf{ña}m talpuyta, ¿aw? Papaktapis talpulalu:\textbf{ña}m, kanan halakta, ¿aw? | \gll paqwa-ya-nchik-ña-m talpu-y-ta aw papa-kta-pis talpu-la-lu-:-ña-m kanan hala-kta aw | \gls finish-PROG-1PL-DISC-EVD plant-INF-ACC yes potato-ACC-ADD plant-UNINT-URGT-1-DISC-EVD now corn-ACC yes | \glt We’re finishing the planting \textbf{already}, no? We’ve \textbf{already} planted the potatoes, now the corn, no?",Glo6:Unaytrik,\gsrc Unaytrik. Kananqa kan\textbf{ña}chu imapis. | \gll unay-tri-k kanan-qa ka-n-ña-chu ima-pis | \gls before-EVC-IK now-TOP be-3-DISC-NEG what-ADD | \glt That would be a long time ago. Now there isn’t anything \textbf{any more}.,Glo6:Manana,\gsrc \textbf{Manaña} ni santu ni imapis. | \gll mana-ña ni santu ni ima-pis | \gls no-DISC nor saint nor what-ADD | \glt There are \textbf{no longer} saints or anything.,Glo6:Pasarun,\gsrc ¿Pasarun\textbf{ñachu}? Tapushun. | \gll pasa-ru-n-ña-chu tapu-shun | \gls pass-URGT-3-DISC-Q ask-1PL.FUT | \glt Did she go by \textbf{yet}? Let’s ask.,Glo6:Rimaya,\gsrc ¿Rimaya\textbf{nña}\textbf{chu} kanan wakpi? | \gll rima-ya-n-ña-chu kanan wak-pi | \gls talk-PROG-3-DISC-Q now DEM.D-LOC | \glt Are they talking \textbf{yet} there now?,,,,,,,,
Enclitics\label{ch:enclitics,Individual enclitics\label{sec:indenc,Discontinuative \phono{-ña,,,"It can appear freely but never unaccompanied, redundantly, by \phono{ña}~(\ref{Glo6:tukuchkani}), (\ref{Glo6:riqsiyan}).",Glo6:tukuchkani,\gsrc “¡\textbf{Ñam} tukuchkani\textbf{ña}!” ¡Puk! ¡Puk! ¡Puk! sikisapa sapu. | \gll ña-m tuku-chka-ni-ña puk puk puk siki-sapa sapu | \gls DISC-EVD finish-DUR-1-DISC puk puk puk behind-MULT.POSS frog | \glt “I’m \textbf{already} finishing up!” Puk! Puk! Puk! said the frog with the behind bigger than usual.,Glo6:riqsiyan,\gsrc \textbf{Ñam} riqsiyan\textbf{ña} hukya yaykun. | \gll ña-m riqsi-ya-n-ña huk-ya yayku-n | \gls DISC-EVD know-PROG-3-DISC one-EMPH enter-3 | \glt They’re getting to know it \textbf{already} and another comes in.,,,,,,,,,,,,,,,,
Enclitics\label{ch:enclitics,Individual enclitics\label{sec:indenc,Inclusion \phono{-pis,,,"\phono{-pis}\index[sub]{inclusion} indicates the inclusion of an item or event into a series of similar items or events. Translated as ‘and’, ‘too’, ‘also’, and ‘even’~(\ref{Glo6:Turnuchawan}--\ref{Glo6:Mamanwa}) or, when negated, ‘neither’ or ‘not even’~(\ref{Glo6:Imapaqtaq}--\ref{Glo6:Pata}).",Glo6:Turnuchawan,"\gsrc Turnuchawan ñuqakunaqa trabaha: walmi\textbf{pis} qali\textbf{pis}. | \gll turnu-cha-wan ñuqa-kuna-qa trabaha-: walmi-pis qali-pis | \gls turn-DIM-INSTR I-PL-TOP work-1 woman-ADD man-ADD | \glt We work in turns, the women \textbf{and} the men.",Glo6:Mamanwa,"\gsrc Maman wañukuptin\textbf{pis} manam waqanchu. | \gll mama-n wañu-ku-pti-n-pis mana-m waqa-n-chu | \gls mother-3 die-REFL-SUBDS-3-ADD no-EVD cry-3-NEG | \glt \textbf{Even} when his mother died, he didn’t cry.",Glo6:Imapaqtaq,"\gsrc “¿Imapaqtaq ñuqa waqashaq?” nin. “Warmiypaq\textbf{pis} waqarqani\textbf{chu}.” | \gll ima-paq-taq ñuqa waqa-shaq nin warmi-y-paq-pis waqa-rqa-ni-chu | \gls what-PURP-SEQ I cry-1.FUT say-3 woman-1-BEN-ADD cry-PST-1-NEG | \glt “Why am I going to cry?” he said. “I did\textbf{n’t} cry for my wife, \textbf{either}.”",Glo6:Pata,\gsrc Pata saqayta\textbf{pis} atipan\textbf{chu}. | \gll pata saqa-y-ta-pis atipa-n-chu | \gls terrace go.up-INF-ACC-ADD be.able-3-NEG | \glt They ca\textbf{n’t} \textbf{even} go up one terrace.,,,,,,,,,,,,
Enclitics\label{ch:enclitics,Individual enclitics\label{sec:indenc,Inclusion \phono{-pis,,,"\phono{-pis} may --~or, even, may generally~-- imply contrast with some preceding element. Where it scopes over subordinate clauses, it can often be translated ‘although’ or ‘even’~(\ref{Glo6:Uratam}), (\ref{Glo6:Hinaptin}).",Glo6:Uratam,\gsrc Uratam muna\textbf{shpapis}. | \gll ura-ta-m muna-shpa-pis | \gls hour-ACC-EVD want-SUBIS-ADD | \glt \textbf{Although} I want to know the time.,Glo6:Hinaptin,"\gsrc Hinaptin wasipiña rumiwan takaptin\textbf{pis} uyan\textbf{chu}. | \gll hinaptin wasi-pi-ña rumi-wan taka-pti-n-pis uya-n-chu | \gls then house-LOC-DISC stone-INSTR hit-SUBDS-3-ADD be.able-3-NEG | \glt Later, at home, \textbf{even when} they hit it with a rock, it couldn’t.",,,,,,,,,,,,,,,,
Enclitics\label{ch:enclitics,Individual enclitics\label{sec:indenc,Inclusion \phono{-pis,,,"Attaching to interrogative-indefinite stems, it forms indefinites and, with \phono{mana}, negative indefinites~(\ref{Glo6:Chaynam}--\ref{Glo6:chambyakuqpaq}).",Glo6:Chaynam,\gsrc Chaynam \textbf{imallatapis} wasiman apamun. | \gll chayna-m ima-lla-ta-pis wasi-man apa-mu-n | \gls thus-EVD what-RSTR-ACC-ADD house-ALL bring-CISL-3 | \glt That way he brings a little \textbf{something} to his house.,Glo6:chambyakuqpaq,\gsrc Alli chambyakuqpaq \textbf{manam imapis} faltanmanchu. | \gll alli chambya-ku-q-paq mana ima-pis falta-n-man-chu | \gls good work-REFL-AG-BEN no what-ADD be.missing-3-COND-NEG | \glt \textbf{Nothing} can be lacking for a good worker.,,,,,,,,,,,,,,,,
Enclitics\label{ch:enclitics,Individual enclitics\label{sec:indenc,Inclusion \phono{-pis,,,"It is in free variation with \phono{-pas}, and, after a vowel, with \phono{-s}~(\ref{Glo6:Diskansakamuy}--\ref{Glo6:harquruwara}), the latter particularly common in the \ACH{} dialect.",Glo6:Diskansakamuy,"\gsrc “¡Diskansakamuy wasikipa!” niwan kikin\textbf{pas} diskansuman ripun. | \gll diskansa-ka-mu-y wasi-ki-pa ni-wa-n kiki-n-pas diskansu-man ripu-n | \gls rest-REFL-CISL-IMP house-2-LOC say-1.OBJ-3 self-3-ADD rest-ALL go-3 | \glt “Go rest in your house,” he said to me and he, himself, \textbf{too}, went to rest.",Glo6:harquruwara,"\gsrc Ñuqata\textbf{s} harquruwara Kashapataman riranim. | \gll ñuqa-ta-s harqu-ru-wa-ra Kashapata-man ri-ra-ni-m | \gls I-ACC-ADD toss.out-URGT-1.OBJ-PST Kashapata-ALL go-PST-1-EVD | \glt They threw me out, \textbf{too}, and I went to Kashapata.",,,,,,,,,,,,,,,,
Enclitics\label{ch:enclitics,Individual enclitics\label{sec:indenc,Topic-marking \phono{-qa\label{ssec:topic,,,"\phono{-qa}\index[sub]{topic marker} indicates the topic of a clause~(\ref{Glo6:sultiram}--\ref{Glo6:Difindiwanchik}), including in those cases where it attaches to subordinate clauses~(\ref{Glo6:pasiyuman}), (\ref{Glo6:Qipiruptinqa}).",Glo6:sultiram,\gsrc Madri sultiram kaya: ñuqalla\textbf{qa}. | \gll madri sultira-m ka-ya-: ñuqa-lla-qa | \gls mother alone-EVD be-PROG-1 I-RSTR-TOP | \glt \textbf{I}’m a single mother.,Glo6:Difindiwanchik,\gsrc Difindiwanchik malichukunapaq\textbf{qa}. | \gll difindi-wa-nchik malichu-kuna-paq-qa | \gls defend-1.OBJ-1PL curse-PL-ABL-TOP | \glt It protects us against \textbf{curses}.,Glo6:pasiyuman,"\gsrc Lluqsila pasiyuman yaykushpa\textbf{qa} manaña puydila\uo{}chu piru. | \gll lluqsi-la pasiyu-man yayku-shpa-qa mana-ña puydi-la-chu piru | \gls go.out-PST walk-ALL enter-SUBIS-TOP no-DISC be.able-PST-NEG but | \glt They went out for a walk but \textbf{when they went in}, they couldn’t.",Glo6:Qipiruptinqa,"\gsrc Qipiruptinqa~\dots{} chay kundur\textbf{qa} qipiptin huk turuta pagaykun. | \gll qipi-ru-pti-n-qa chay kundur-qa qipi-pti-n huk turu-ta paga-yku-n | \gls carry-URGT-SUBDS-3-TOP DEM.D condor-TOP carry-SUBDS-3 one bull-ACC pay-EXCEP-3 | \glt \textbf{When he carried her}, after the condor carried her, she payed him a bull.",,,,,,,,,,,,
Enclitics\label{ch:enclitics,Individual enclitics\label{sec:indenc,Continuative \phono{-Raq,,,"\phono{-Raq}\index[sub]{continuitive} --~realized in \CH{} as \phono{-laq}~(\ref{Glo6:Kichwallaktam}) and in all other dialects as \phono{-raq}~-- indicates continuity of action, state or quality.",Glo6:Kichwallaktam,"\gsrc Kichwallaktam limakuya: kaytraw\textbf{laq} manam kastillanukta lima:chu. | \gll kichwa-lla-kta-m lima-ku-ya-: kay-traw-laq mana-m kastillanu-kta lima-:-chu | \gls Quechua-RSTR-ACC-EVD talk-REFL-PROG-1 DEM.P-LOC-CONT no-EVD Spanish-ACC talk-1-NEG | \glt I’m just talking Quechua. Here, \textbf{still}, we don’t speak Spanish.",,,,,,,,,,,,,,,,,,
