Chapter,Section,Subsection,Subsubsection,Subsubsubsection,Knowledge Point,Label 1,Content 1,Label 2,Content 2,Label 3,Content 3,Label 4,Content 4,Label 5,Content 5,Label 6,Content 6,Label 7,Content 7,Label 8,Content 8,Label 9,Content 9,Label 10,Content 10
Parts of speech,Adverbs,Group 1 adverbs: Deictic,,,"The manner deictic {\itshape (ɛ́) mpù} never occurs as nominal modifier. It generally serves to introduce gestures and ideophones, as for instance in \REF{ADVmpu1}. In this example, the first occurrence of {\itshape mpù} frames the ideophone while the second refers to a gesture that may actually be made or not, i.e.\ the gesture is most likely implied, but not necessarily made.",ADVmpu1,"\gsrc yɔ́ɔ̀ Nzàmbí njí \textbf{mpù} bã̂ã̂ã̂ã̂ njì dígɛ̀ \textbf{mpù} | \gll yɔ́ɔ̀ Nzàmbí njî-H mpù bã̂ã̂ã̂ã̂ njì dígɛ̀ mpù | \gls so emptyset1.PN.PRS come-R like.this IDEO:walking.far come look like.this | \glt `So Nzambi comes like this [depiction of walking a long distance], comes looking like this.'",,,,,,,,,,,,,,,,,,
Parts of speech,Adverbs,Group 1 adverbs: Deictic,,,"\noindent Also, {\itshape mpù} is used in comparison constructions as in \REF{ADVmpu2}. In these cases, {\itshape mpù} is translated as `like, than' rather than `like this'.",ADVmpu2,\gsrc Màmá à ndáà gyà ntɛ̀ \textbf{mpù} Màmbì | \gll Màmá a ndáà gyà ntɛ̀ mpù Màmbì. | \gls ∅1.PN 1.have also ∅7.length ∅3.size like ∅1.PN | \glt `Mama is as tall as Mambi.',,,,,,,,,,,,,,,,,,
Parts of speech,Adverbs,Group 1 adverbs: Deictic,,,"A further distinctive morphosyntactic property in adverbial subclasses is the phrase position in which adverbs can occur. As a default position, all adverb classes occur phrase finally. This is also true for group 1 adverbs, as shown in \REF{ADV1finala} and \REF{ADV1finalb}.",ADV1finala,\gsrc mɛ́ bvú nâ nkwálá wúù tfùndɛ́ mɛ̀ \textbf{vâ} | \gll mɛ-H bvû-H nâ nkwálá wúù tfùndɛ-H mɛ̀ vâ | \gls 1SG-PRS think-R COMP emptyset3.machete 3.PST2 miss-R 1SG here | \glt `I think that the machete missed [injured] me here.',ADV1finalb,\gsrc mɛ́ pã́ ná kɛ̀ dígɛ̀ mùdì wà nû \textbf{ɛ́} \textbf{pɛ́} | \gll mɛ-H pã̂-H ná kɛ̀ dígɛ m-ùdì wà nû ɛ́ pɛ́ | \gls 1SG.PRS try-R again go see N1-person 1:ATT 1.DEM.PROX LOC there | \glt `I try again and go to see that person there.',,,,,,,,,,,,,,,,
Parts of speech,Adverbs,Group 1 adverbs: Deictic,,,"In contrast to group 3, group 1 adverbs also pervasively appear in phrase-initial positions, as in \REF{ADV1initiala} and \REF{ADV1initialb}. This position is clearly correlated with information structure, moving the deictic adverb into a focus position.\footnote{See \sectref{sec:IS} on information structure for a more detailed discussion.} While also group 2 (temporal) adverbs can occur in this initial focus position, deictic adverbs are significantly more frequently focused in the Gyeli text corpus.",ADV1initiala,\gsrc \textbf{ɛ́} \textbf{vâ} mɛ̀ dyùwɔ́ nâ \textbf{ɛ́} \textbf{vâ} yíì sílɛ̀ njì búlɛ̀ | \gll ɛ́ vâ mɛ dyùwɔ-H nâ ɛ́ vâ yíì sílɛ̀ njì búlɛ | \gls LOC here 1SG.PST1 hear-R COMP LOC here 7.FUT finish.FUT come destroy | \glt `I heard that it [the road] will all come here to be destroyed [the plants].',ADV1initialb,"\gsrc \textbf{ɛ́} \textbf{pɛ́-ɛ́} mɛ̀ɛ̀ lwɔ̃̂ nyà ndáwɔ̀ | \gll ɛ́ pɛ́-ɛ́ mɛ̀ɛ̀ lwɔ̃̂ nyà ndáwɔ̀ | \gls LOC there-DIST 1SG.FUT build real emptyset9.house | \glt `Over there, I will build a real house.'",,,,,,,,,,,,,,,,
Parts of speech,Adverbs,Group 1 adverbs: Deictic,,,"\noindent If a deictic adverb occurs in the initial focus position, it is often repeated again at the end of the phrase in its default position, as shown in \REF{ADV1botha} and \REF{ADV1bothb}.",ADV1botha,"\gsrc \textbf{ɛ́} \textbf{pɛ̀} bà sílɛ́ bî lwɔ̃̂ mándáwɔ̀ \textbf{ɛ́} \textbf{pɛ̀} | \gll ɛ́ pɛ̀ ba sílɛ-H bî lwɔ̃̂ H-ma-ndáwɔ̀ ɛ́ pɛ̀ | \gls LOC there 2.PST1 finish-R 1PL.OBJ build OBJ.LINK-ma6-house LOC there | \glt `There, they have finished to build us houses.'",ADV1bothb,"\gsrc \textbf{ɛ́} \textbf{wû} bèyá lwɔ̃́ kwádɔ́ yã̂ \textbf{ɛ́} \textbf{wû} | \gll ɛ́ wû bèyá lwɔ̃̂-H kwádɔ́ y-ã̂ ɛ́ wû | \gls LOC there 2PL[Kwasio] build-R emptyset7.village 7-POSS.1SG LOC there | \glt `Over there, you (pl.) build my village over there.'",,,,,,,,,,,,,,,,
Parts of speech,Adverbs,Group 1 adverbs: Deictic,,,"In the default case, it seems that {\itshape wû} denotes a medial distance between {\itshape vâ} `here' and {\itshape pɛ̀} `over there' and occurs mainly in the verbal domain. In contrast, {\itshape tè} is mostly used with nouns rather than with verbs where {\itshape tè} seems to be related more to specificity and/or anaphora than to actual location. In that sense, {\itshape tè} may be less part of the distance-related deictic system, as \REF{Advte1} illustrates. In this example, {\itshape tè} is more existential than about distance.",Advte1,\gsrc bã̂ yɔ́ɔ̀ yíì \textbf{tè} | \gll bã̂ y-ɔ́ɔ̀ yíì tè | \gls emptyset7.word 7-2SG.POSS 7.ID there | \glt `You are understood [lit. your word is there].',,,,,,,,,,,,,,,,,,
Parts of speech,Adverbs,Group 1 adverbs: Deictic,,,"\noindent Also in \REF{Advte2}, the use of {\itshape tè} is not primarily locative, but more anaphoric to the circumstances of earning only 250 Cameroon Francs.",Advte2,"\gsrc ká bá kɛ́ wɛ̂ vɛ̀ bé-bwúyà bébáà nà mà-wú mátánɛ̀ wɛ́ sá \textbf{tè} ná | \gll ká ba-H kɛ̀-H wɛ̂ vɛ̀ H-be-bwúyà bé-báà nà ma-wú má-tánɛ̀ wɛ-H sâ-H tè ná | \gls if 2-PRS go-R 2SG.OBJ give OBJ.LINK-be8-hundred 8-two COM ma6-ten 6-five 2SG-PRS do-R there how | \glt `If they go to give you 250 (Francs), how do you manage there? [because it's very little money]'",,,,,,,,,,,,,,,,,,
Parts of speech,Adverbs,Group 1 adverbs: Deictic,,,"In other cases, however, as in \REF{Advte3}, {\itshape tè} is place-denoting just like the other deictic adverbs. Speakers state that, in this example, {\itshape tè} can also be replaced by {\itshape pɛ̀} or {\itshape wû} in both instances.",Advte3,"\gsrc \textbf{tè} mɛ̀ɛ̀ jíbì kɛ̀ lwɔ̃̂ \textbf{tè} | \gll tè mɛ̀ɛ̀ jíbi kɛ̀ lwɔ̃̂ tè | \gls there 1SG.FUT start go build there | \glt `There, I will first go to build there.'",,,,,,,,,,,,,,,,,,
Parts of speech,Adverbs,Group 1 adverbs: Deictic,,,"Further, distance cannot be the only distinctive criterion within the locative deictic system: an increased sense of distance can be added phonologically by lengthening the final vowel of the adverb and an H tone, as shown in \REF{pEE} and in \REF{ADV1initialb} above.",pEE,\gsrc lèkfúdɛ̀ à nzí bíyɔ̀ nlô \textbf{pɛ́ɛ́} | \gll le-kfúdɛ̀ a nzí bíyɔ nlô pɛ́-ɛ́ | \gls le5-idiot 1 PROG.PST hit ∅3.head over.there-DIST | \glt `The idiot was hitting his head far over there.',ADV1initialb,"\gsrc \textbf{ɛ́} \textbf{pɛ́-ɛ́} mɛ̀ɛ̀ lwɔ̃̂ nyà ndáwɔ̀ | \gll ɛ́ pɛ́-ɛ́ mɛ̀ɛ̀ lwɔ̃̂ nyà ndáwɔ̀ | \gls LOC there-DIST 1SG.FUT build real emptyset9.house | \glt `Over there, I will build a real house.'",,,,,,,,,,,,,,,,
Parts of speech,Adverbs,Group 1 adverbs: Deictic,,,"\noindent This way of expressing further distance by vowel lengthening and H tones is possible with both {\itshape pɛ̀} and {\itshape wû}. An example for the latter is given in \REF{wUU}. In contrast, this does not seem to be possible with {\itshape tè}, which indicates again that {\itshape tè} behaves differently from the other more purely locative deictic elements.\footnote{{\itshape vâ} `here' also does not allow for final vowel lengthening and an H tone, but that is clearly a semantic restriction since it denotes a place that is close to the speaker.}",wUU,"\gsrc báà tfùbɔ̀ báà tfùbɔ̀ mpàgó wá nùmbà \textbf{wúú} | \gll báà tfùbɔ̀ báà tfùbɔ̀ mpàgó wá nùmbà wú-ú | \gls 2.FUT pierce 2.FUT pierce ∅3.road 3:ATT ∅1.logger there-DIST | \glt `They will cut, they will cut. The road of the loggers there.'",,,,,,,,,,,,,,,,,,
Parts of speech,Adverbs,Group 1 adverbs: Deictic,,,"Another difference between {\itshape wû} and {\itshape tè} concerns the combination with a vocative morpheme -{\itshape o} which, at the same time, can further take an H tone to indicate distance between the speaker and the addressee. This vocative morpheme can be used with {\itshape wû}, as shown in \REF{wuo}, but not with {\itshape tè} nor any other deictic element.",wuo,\gsrc mùdì kí tàtɔ̀ \textbf{wúó} | \gll m-ùdì kí tàtɔ wú-o-H | \gls N1-person NEG scream there-VOC-DIST | \glt `Nobody scream over there!',,,,,,,,,,,,,,,,,,
Parts of speech,Adverbs,Group 2 adverbs: Temporal,,,"The defining property of group 2 temporal adverbs is that they can all also occur in nominal modification as second constituent in a noun + attributive marker construction, as in \REF{G2nom}.",G2nom,Not found,,,,,,,,,,,,,,,,,,
Parts of speech,Adverbs,Group 2 adverbs: Temporal,,,All group 2 adverbs occur phrase finally as a default position. Examples are given in \REF{ADV2a} through \REF{ADV2c}.,ADV2a,\gsrc wɛ́ làwɔ́ \textbf{tɛ́ɛ̀} | \gll wɛ-H làwɔ-H tɛ́ɛ̀ | \gls 2SG-PRS talk-R now | \glt `You speak now.',ADV2c,\gsrc mɛ̀ nzí kɛ̀ jí \textbf{nàkùgúù} | \gll mɛ nzí kɛ̀ jí nàkùgúù | \gls 1SG PROG.PST go emptyset7.forest yesterday | \glt `I was going to the forest yesterday.',,,,,,,,,,,,,,,,
Parts of speech,Adverbs,Group 2 adverbs: Temporal,,,"They can all also occur phrase initially, as shown in \REF{ADV2d}. In these cases, they are in focus, as discussed for group 1 adverbs and in \sectref{sec:IS} on information structure. In \REF{ADV2d}, the narrator stresses that the mice will only eat the skulls the next day, as contrastive focus to the possibility that they might eat them right away.",ADV2d,"\gsrc àà \textbf{nàmɛ́nɔ́} bwáà dè \textbf{nàmɛ́nɔ́} | \gll àà nàmɛ́nɔ́ bwáà dè nàmɛ́nɔ́ | \gls EXCL tomorrow 2PL.FUT eat tomorrow | \glt `Ah, tomorrow you will eat, tomorrow.'",ADV2d,"\gsrc àà \textbf{nàmɛ́nɔ́} bwáà dè \textbf{nàmɛ́nɔ́} | \gll àà nàmɛ́nɔ́ bwáà dè nàmɛ́nɔ́ | \gls EXCL tomorrow 2PL.FUT eat tomorrow | \glt `Ah, tomorrow you will eat, tomorrow.'",,,,,,,,,,,,,,,,
Parts of speech,Adverbs,Group 3 adverbs: Manner,,,"%All of these manner adverbs are also found as nominal modifiers where they differ though in their behavior, as shown in \sectref{sec:MOD} and \ref{sec:INV}. Most of them such as {\itshape mpà} `good', {\itshape bíwɔ̀} `bad', and {\itshape bvùbvù} `much' are invariable also in noun phrases. Only -{\itshape fí} `different', the short form of -{\itshape fúsì} used as a deictic modifier, agrees with its head noun. In the verbal domain, however, all of them are invariable.",sec:INV,Not found,,,,,,,,,,,,,,,,,,
Parts of speech,Adverbs,Group 3 adverbs: Manner,,,"\hspace*{-3.5pt}In terms of their position, manner adverbs exclusively occur (intonation) phrase finally. Thus, the adverb may follow the verb if there is no object, as demonstrated in \REF{Advmpa} and \REF{Advfi}.",Advmpa,\gsrc wɛ̀ nzíí bàlɛ̀ \textbf{mpà} | \gll wɛ nzíì-H bàlɛ mpà | \gls 2SG PROG.PRS-R keep good | \glt `You are remembering well [lit. your are keeping the words well].',Advfi,\gsrc wɛ́ ná báàla nà nyɛ́ \textbf{fí} nà wɛ́ ndyándyá ná sálɛ́ ɛ́ pɛ̂ | \gll wɛ-H ná báàla-H nà nyɛ̂-H fī́ nà wɛ-H ndyándya-H ná sálɛ-H ɛ́ pɛ̂ | \gls 2SG-PRS again repeat-R COM see-R different COM 2SG-PRS work-R again emptyset7.work LOC there | \glt `You repeat [it] again and try something else and you work there again.',,,,,,,,,,,,,,,,
Parts of speech,Adverbs,Group 3 adverbs: Manner,,,"\noindent If the clause has an object, the manner adverb will follow the object instead of the verb, as shown in \REF{Advbiwo} and \REF{Advbvu}.",Advbiwo,\gsrc á sìmbɔ́ màtúà \textbf{bíwɔ̀} | \gll a-H sìmbɔ-H màtúà bíwɔ̀ | \gls 1-PRS drive-R emptyset1.car bad | \glt `He drives the car poorly.',Advbvu,\gsrc mɛ̀ɛ́ jí-lɛ́ wɛ̂ \textbf{bvùbvù} | \gll mɛ̀ɛ́ jí-lɛ́ wɛ̂ bvùbvù | \gls 1SG.PRS.NEG ask-NEG 2SG much | \glt `I don't ask you [for] much.',,,,,,,,,,,,,,,,
Parts of speech,Adverbs,Discussion: Multiple adverbs,,,"There seem to be some ordering principles among multiple phrase-final adverbs slot, with some adverbs seem closer to the center of the phrase than others. Since multiple adverbs do not occur very frequently in natural speech, it is not possible at this point to give a full account of adverb order in multiple adverb constructions. The present examples, however, suggest that group 1 adverbs are closest to the center, i.e.\ verb and following object, as shown in \REF{ADVM1} and \REF{ADVM2}.",ADVM1,Not found,ADVM2,\gsrc mɛ̀ nzí dyá \textbf{vâ} \textbf{kùgúù} \textbf{dẽ̂} màfú mábáà | \gll mɛ̀ nzí dyá vâ kùgúù dẽ̂ ma-fú má-báà. | \gls 1SG PROG.PST1 lie.down here emptyset7.evening dbtoday ma6-day 6-two | \glt `I was here in the evening two days ago.',,,,,,,,,,,,,,,,
Parts of speech,Ideophones,Phonological shape of ideophones,,,"Repetitive ideophones can be divided into those that have the same tone on each repeated syllable and those that change their tonal melody across repeated syllables. In \REF{IDEOredup1}, for instance, the ideophones involve repeated monosyllabic words each carrying the same tone.",IDEOredup1,Not found,,,,,,,,,,,,,,,,,,
Parts of speech,Ideophones,Phonological shape of ideophones,,,"In contrast, the ideophones in \REF{IDEOredup2} show an alternating tonal pattern with repeated monosyllabic words alternating between H and L tones. One could argue that two syllables, an H plus an L, actually constitute one unit that gets repeated rather than the single syllable. The fact that these ideophones are often used with an uneven number of syllables, however, indicates that also for tonally alternating ideophones the repeated unit is usually the monosyllabic word.",IDEOredup2,Not found,,,,,,,,,,,,,,,,,,
Parts of speech,Ideophones,Phonological shape of ideophones,,,"There are a few instances, however, where the word is disyllabic and again, it is the word that gets reduplicated, as shown in \REF{IDEOredup3}. In contrast to monosyllabic ideophone words, disyllabic ones are only subject to reduplication, but usually do not get repeated more than twice.",IDEOredup3,Not found,,,,,,,,,,,,,,,,,,
Parts of speech,Ideophones,Phonological shape of ideophones,,,"A large group of Gyeli ideophones systematically employs final vowel lengthening, as shown in \REF{IDEOlength}. The extreme length, often until the speaker needs to take another breath, is marked by four vowels (instead of two for phonological long vowels). All of these lengthened ideophones occur as monosyllabic words only.",IDEOlength,Not found,,,,,,,,,,,,,,,,,,
Parts of speech,Ideophones,Phonological shape of ideophones,,,"Closed syllables in ideophones frequently end in /m/, but also voiceless obstruents such as /f/ or /k/. Most of them are monosyllabic, as in \REF{IDEOsyll1}.",IDEOsyll1,Not found,,,,,,,,,,,,,,,,,,
Parts of speech,Ideophones,Phonological shape of ideophones,,,"\noindent There are also disyllabic ideophones whose second syllable is closed, ending in the nasal /m/, as shown in \REF{IDEOsyll2}.",IDEOsyll2,Not found,,,,,,,,,,,,,,,,,,
Parts of speech,Ideophones,Phonological shape of ideophones,,,"The other unusual syllable type found in ideophones is that of a consonantal nucleus. Examples are given in \REF{IDEOsyll3}. The voiceless bilabial in {\itshape p p p p} `depiction of smoking pipe' is produced with an ingressive airstream, imitating the inhaling when smoking.",IDEOsyll3,Not found,,,,,,,,,,,,,,,,,,
Parts of speech,Ideophones,Morphosyntactic properties of ideophones,,,"Ideophones in Gyeli frequently occur at the end of an intonation phrase as in \REF{IDEOadv1} and \REF{IDEOadv2}. In these cases, ideophones are similar to adverbs in their position and their function, namely depicting the manner in which an action or event happens.",IDEOadv1,\gsrc yɔ́ɔ̀ mùdã̂ dígɛ́ mísì \textbf{ndẽ́ẽ́ẽ́ẽ́} | \gll yɔ́ɔ̀ m-ùdã̂ dígɛ-H m-ísì ndẽ́ẽ́ẽ́ | \gls so N1-woman watch-R ma6-eye IDEO:staring | \glt `So the woman looks with her eyes [depiction of staring].',IDEOadv2,\gsrc bá kɛ́ ndáà nà tɛ́lɛ́ mákùndù má kùrã̂ \textbf{kɛ́}-\textbf{kɛ́}-\textbf{kɛ́}-\textbf{kɛ́}-\textbf{kɛ́} | \gll ba-H kɛ-H ndáà nà tɛ́lɛ-H H-ma-kùndù má kùrã̂ kɛ́-kɛ́-kɛ́-kɛ́-kɛ́ | \gls 2-PRS go-R also COM put-R OBJ.LINK-ma6-clay.house 6:ATT emptyset7.electricity IDEO:repeated.placement | \glt `They also go and put up electricity poles for clay houses [depiction of putting the electricity poles along the road].',,,,,,,,,,,,,,,,
Parts of speech,Ideophones,Morphosyntactic properties of ideophones,,,"In contrast to adverbs, ideophones also occur in constructions with the deictic element {\itshape mpù} `like this', as shown in \REF{IDEOadv3}.",IDEOadv3,"\gsrc yɔ́ɔ̀ Nzàmbí njí mpù \textbf{bã̂ã̂ã̂ã̂} njì dígɛ̀ mpù | \gll yɔ́ɔ̀ Nzàmbí nji-H mpù bã̂ã̂ã̂ã̂ njì dígɛ̀ mpù | \gls so ∅1.PN come-R like.this IDEO:walking.far come look like.this | \glt `So Nzambi comes like this [depiction of walking a long distance], comes looking like this.'",,,,,,,,,,,,,,,,,,
Parts of speech,Ideophones,Morphosyntactic properties of ideophones,,,"\subsubsection*{Ideophones as {\itshape nâ} complements} Similarly, the same sort of signaling happens when ideophones are used as complements in {\itshape nâ} clauses, as illustrated in \REF{IDEOna}.",IDEOna,"\gsrc Nzàmbí, màbɔ́ɔ̀ nkwɛ́ɛ̀ dé nâ \textbf{vɔ́sì} | \gll Nzàmbí ma-bɔ́ɔ̀ nkwɛ́ɛ̀ dé nâ vɔ́sì | \gls ∅1.PN ma6-breadfruit ∅3.basket LOC COMP IDEO:pouring | \glt `Nzambi pours the breadfruit into the basket.'",,,,,,,,,,,,,,,,,,
Parts of speech,Ideophones,Morphosyntactic properties of ideophones,,,"Gyeli ideophones occur independently from an intonation phrase, rather forming an intonation phrase on their own. In this, they differ from adverbs which cannot occur as independent intonation phrases. In \REF{IDEOfree1}, the ideophone occurs before the intonation phrase it refers to in the discourse. The ideophone is separated from the following intonation by a short pause.",IDEOfree1,"\gsrc \textbf{gbĩ́-gbĩ̀-gbĩ́-gbĩ̀-gbĩ́} à múà nà bábɛ̀ tí wúmbɛ́ wɛ̀ | \gll gbĩ́-gbĩ̀-gbĩ́-gbĩ̀-gbĩ́ a múà nà bábɛ̀ tí wúmbɛ-H wɛ̀ | \gls IDEO:roaming 1SG.PST1 PROSP COM emptyset7.illness NEG want-R die | \glt `[depiction of disease roaming in his body] He was about to be sick, not wanting to die.'",,,,,,,,,,,,,,,,,,
Parts of speech,Ideophones,Morphosyntactic properties of ideophones,,,"\noindent Intonationally independent ideophones can also follow the intonation phrase they are semantically linked to in the discourse, as shown in \REF{IDEOfree2}.",IDEOfree2,\gsrc wɛ́ dyúwɔ́ mpù bàmìntùlɛ̀ bɔ́gá bá tsígɛ̀ \textbf{tsùk-tsùk-tsùk} | \gll wɛ-H dyúwɔ-H mpù ba-mìntùlɛ̀ bɔ́-gá ba-H tsígɛ̀ tsùk-tsùk-tsùk | \gls 2SG-PRS hear-R like.this ba2-mouse 2-other 2-PRS take.off IDEO:rustling | \glt `You hear like this the other mice take off [depiction of noise made by mice].',,,,,,,,,,,,,,,,,,
Parts of speech,Ideophones,Morphosyntactic properties of ideophones,,,"\noindent In addition to intonational breaks, the end of an intonation phrase can be indicated by the tonal melody. In \REF{IDEOfree2}, it is the L tone on {\itshape tsígɛ̀} `take off', which shows the end on the intonation phrase. If the ideophone was part of the same intonation phrase, the final tone on {\itshape tsígɛ̀} would be H.",IDEOfree2,\gsrc wɛ́ dyúwɔ́ mpù bàmìntùlɛ̀ bɔ́gá bá tsígɛ̀ \textbf{tsùk-tsùk-tsùk} | \gll wɛ-H dyúwɔ-H mpù ba-mìntùlɛ̀ bɔ́-gá ba-H tsígɛ̀ tsùk-tsùk-tsùk | \gls 2SG-PRS hear-R like.this ba2-mouse 2-other 2-PRS take.off IDEO:rustling | \glt `You hear like this the other mice take off [depiction of noise made by mice].',,,,,,,,,,,,,,,,,,
Parts of speech,Pronouns,Subject pronouns,,,"While many subject pronouns are segmentally identical to the \textsc{stamp} markers of their person/class (see \tabref{Tab:Pros} for comparison), there are a few exceptions which clearly show that subject pronouns form a distinct paradigm. These exceptions include the first and second person plural, and the pronoun of agreement class 1. To indicate this distinction in the glosses, I mark subject pronouns with `{\SBJ}', while the \textsc{stamp} marker is only marked for its agreement class/person, as in \REF{SBJpro1} where subject pronoun (in bold) and \textsc{stamp} marker differ in their form.",SBJpro1,"\gsrc dɔ̃̀ \textbf{bí} yá táálɛ́ bê yàlànɛ̀ àà | \gll dɔ̃̀ bí ya-H táálɛ-H bê yàlanɛ àà | \gls so[French] 1PL.SBJ 1PL-PRS begin-R 2PL respond[Bulu] EXCL | \glt `So we start to respond to you, mhm.'",,,,,,,,,,,,,,,,,,
Parts of speech,Pronouns,Subject pronouns,,,"Other subject pronouns are segmentally identical to their \textsc{stamp} marker and might only differ tonally, depending on the tense-mood category, as in \REF{SBJpro2}.",SBJpro2,"\gsrc ah mbúmbù \textbf{wɛ̀} wɛ́ tɛ́lɛ́ núndɛ̀ | \gll ah mbúmbù wɛ wɛ-H tɛ́lɛ-H nú-ndɛ̀ | \gls EXCL emptyset1.namesake 2SG.SBJ 2SG-PRS stand-R 1-ANA | \glt `Ah namesake, is it you who is standing there?'",,,,,,,,,,,,,,,,,,
Parts of speech,Pronouns,Subject pronouns,,,"\noindent Thus, although the agreement class 2 subject pronoun {\itshape bá} is segmentally identical to its \textsc{stamp} marker, the two forms differ due to the \textsc{future} marking on the \textsc{stamp} marker in \REF{SBJpro3}.",SBJpro3,\gsrc \textbf{bá} báà bù mpàgó | \gll bá báà bù mpàgó | \gls 2.SBJ 2.FUT break ∅3.road | \glt `THEY will build a road.',,,,,,,,,,,,,,,,,,
Parts of speech,Pronouns,Subject pronouns,,,"The subject pronoun always occurs in subject position and always precedes the \textsc{stamp} marker. If the subject is preceded by a fronted object, as for instance an interrogative pronoun in \REF{SBJpro4}, the object pronoun will precede both the subject pronoun and \textsc{stamp} marker.",SBJpro4,"\gsrc gyí bí yá tfúgà yá tfúgá nà gyí | \gll gyí bí ya-H tfúga ya-H tfúga-H nà gyí | \gls what 1PL.SBJ 1PL-PRS suffer 1PL-PRS suffer-R COM what | \glt `What do we suffer, we suffer from what?'",,,,,,,,,,,,,,,,,,
Parts of speech,Pronouns,Subject pronouns,,,"There are certain words that can enter between the subject pronoun and the \textsc{stamp} marker. These are, for instance, the contrastive marker -{\itshape gà} (\sectref{sec:CONTRS}) that attaches to the subject pronoun, as in \REF{SBJpro5}.",SBJpro5,\gsrc yɔ́ɔ̀ Nzàmbí \textbf{nyɛ̀gà} à kɛ̃́ɛ̃̀ dígɛ̀ mísì | \gll yɔ́ɔ̀ Nzàmbí nyɛ-gà a kɛ̃́ɛ̃̀ dígɛ m-ísì | \gls so ∅1.PN 1.SBJ-CONTR 1.PST1 go.COMPL watch ma6-eye | \glt `So this Nzambi has gone and was thinking very hard [lit. he watched with his eyes].',,,,,,,,,,,,,,,,,,
Parts of speech,Pronouns,Subject pronouns,,,"\noindent Other nominal modifiers, such as {\itshape bɔ́ɔ̀} `other' in \REF{SBJpro6} or {\itshape ndáà} `also' in \REF{SBJpro7} occur between the subject pronoun and the \textsc{stamp} marker.",SBJpro6,\gsrc \textbf{bí} \textbf{bɔ́ɔ̀} yá bígɛ́ mpá'à wá vɛ́ | \gll bí b-ɔ́ɔ̀ ya-H bígɛ-H mpá'à wá vɛ́ | \gls 1PL.SBJ 2-other 1PL-PRS develop-R emptyset3.side 3:ATT which | \glt `How will we others [in contrast to other Gyeli villages] make progress?',SBJpro7,"\gsrc ɛ̀sɛ́ béé ndáà bèyá làwɔ́ fàlà | \gll ɛ̀sɛ́ béé ndáà bèya-H làwɔ-H fàlà | \gls is.it[French] 2PL.SBJ also 2PL[Kwasio]-PRS speak-R emptyset1.French | \glt `Isn't it, you (pl.), you also speak French.'",,,,,,,,,,,,,,,,
Parts of speech,Pronouns,Non-subject pronouns,,,"Non-subject pronouns that serve as objects occur in all object positions discussed in \sectref{sec:verbalC} and \sectref{sec:IS}. The basic position is after the verb, as in \REF{NSBJ1x} and \REF{NSBJ3}.",NSBJ1x,\gsrc bwáá lã́ \textbf{bɔ̂} | \gll bwáa-H lã-H b-ɔ̂ | \gls 2PL-PRS tell-R 2-OBJ | \glt `You tell them!',NSBJ3,\gsrc byɔ̂ bé vɛ́ \textbf{bíì} màpè'è | \gll byɔ̂ be-H vɛ̀-H bíì ma-pè'è | \gls 8.OBJ 8-PRS give-R 1PL.OBJ ma6-wisdom | \glt `They give us wisdom.',,,,,,,,,,,,,,,,
