Chapter,Section,Subsection,Subsubsection,Subsubsubsection,Knowledge Point,Label 1,Content 1,Label 2,Content 2,Label 3,Content 3,Label 4,Content 4,Label 5,Content 5,Label 6,Content 6,Label 7,Content 7,Label 8,Content 8,Label 9,Content 9,Label 10,Content 10
Parts of speech,Pronouns,Non-subject pronouns,,,"Non-subject pronouns serving as objects can also be dislocated to the left edge of the clause, as in \REF{NSBJ1}. In this marked position \REF{NSBJ3} as well as in the in-situ focus position in \REF{NSBJ1}, the pronoun is optionally lengthened for emphasis.",NSBJ1,\gsrc \textbf{yɔ́ɔ̀} mɛ́ wúmbɛ́ wû | \gll yɔ́ɔ̀ mɛ-H wúmbɛ-H wû | \gls 7.OBJ 1SG-PRS want-R there | \glt `That is what I want there.',NSBJ3,\gsrc byɔ̂ bé vɛ́ \textbf{bíì} màpè'è | \gll byɔ̂ be-H vɛ̀-H bíì ma-pè'è | \gls 8.OBJ 8-PRS give-R 1PL.OBJ ma6-wisdom | \glt `They give us wisdom.',NSBJ1,\gsrc \textbf{yɔ́ɔ̀} mɛ́ wúmbɛ́ wû | \gll yɔ́ɔ̀ mɛ-H wúmbɛ-H wû | \gls 7.OBJ 1SG-PRS want-R there | \glt `That is what I want there.',,,,,,,,,,,,,,
Parts of speech,Pronouns,Non-subject pronouns,,,"The first person plural often occurs with the special form {\itshape bíyɛ̀} in the corpus, as in \REF{NSBJ2}. This seems even more emphatic than the lengthened form {\itshape bíì}. The data is not sufficient, however, to pinpoint the exact distribution and functional difference between the two emphatic forms. The first person plural is the only person category that has such a suppletive emphatic form.",NSBJ2,"\gsrc bvúlɛ̀ bá ntɛ́gɛ́lɛ́ ndáà bíyɛ̀ | \gll bvúlɛ̀ ba-H ntɛ́gɛlɛ-H ndáà bíyɛ̀ | \gls ba2.Bulu 2-PRS bother-R also 1PL.OBJ | \glt `The Bulu bother us, too.'",,,,,,,,,,,,,,,,,,
Parts of speech,Pronouns,Non-subject pronouns,,,"\noindent Non-subject pronouns also occur in obliques, as in \REF{NSBJ2x}.",NSBJ2x,\gsrc á nyùlɛ́nyúlɛ́ kɔ̀fí nà yɔ̂ | \gll a-H nyùlɛ-nyulɛ-H kɔ̀fí nà y-ɔ̂ | \gls 1-PRS drink-HAB-R emptyset7.coffee COM 7-OBJ | \glt `He usually drinks coffee with it [sugar]',,,,,,,,,,,,,,,,,,
Parts of speech,Pronouns,Non-subject pronouns,,,"Finally, non-subject pronouns are used as an information structure strategy after nominal subjects to mark subject focus, as in \REF{beEMPH2x}.",beEMPH2x,"\gsrc ngùndyá tè \textbf{nyɔ̂} bɛ́ nyî | \gll ngùndyá tè nyɔ̂ bɛ̀-H nyî | \gls ∅9.raffia there 9.OBJ be-R 9.DEM.PROX | \glt `The raffia there, IT is that.'",,,,,,,,,,,,,,,,,,
Parts of speech,Pronouns,Interrogative pronouns,,,"These interrogative pronouns replace a nominal {\NP}, which is shown in \REF{nza} and \REF{gyi}, respectively. In \REF{nza}, the interrogative replaces the subject {\NP} {\itshape m-ùdũ̂} `man' while, in \REF{gyi}, the interrogative {\itshape gyí} replaces the object {\NP} {\itshape má-jíwɔ́} `water'. In that sense, they behave like personal pronouns. Both interrogatives are used in all noun phrase environments, namely as subjects, objects, and obliques.",nza,Not found,gyi,Not found,nza,Not found,gyi,Not found,,,,,,,,,,,,
Parts of speech,Pronouns,Interrogative pronouns,,,Interrogative pronouns in oblique phrases are shown with the comitative marker {\itshape nà} in \REF{nanzá} and \REF{nagyí}.,nanzá,Not found,nagyí,Not found,,,,,,,,,,,,,,,,
Parts of speech,Pronouns,Interrogative pronouns,,,"{\itshape nà nzá} `with whom' is interesting in that {\itshape nzá} seems to take a plural marker if the expected answer is more than one person, as shown in \REF{banzá}. Since the prefix {\itshape bà}- comes with an L tone, it seems to behave like either a noun class or agreement prefix. Since {\itshape nzá} only occurs with humans, the prefix is invariably class 2 {\itshape bà}-, therefore it is difficult to test whether the prefix belongs to a noun or a modifier.",banzá,Not found,,,,,,,,,,,,,,,,,,
Parts of speech,Pronouns,Possessor pronouns,,,"\noindent Possessor pronouns in Gyeli consist of a root indicating the possessor and a prefix that agrees with the possessee, as shown in \REF{POSS}.",POSS,Not found,,,,,,,,,,,,,,,,,,
Parts of speech,Pronouns,Possessor pronouns,,,"\noindent Some possessor roots are influenced in their segmental form by the shape of the possessee agreement prefix. The first and second person plural are subject to variation if the possessee belongs to class 1 or 3. Then, the first high front vowel used in all other agreement classes turns into a high back vowel as an assimilation to the agreement prefix {\itshape w-} in class 1 and 3. The contrast between the two root shapes is illustrated in \REF{w}.",w,Not found,,,,,,,,,,,,,,,,,,
Parts of speech,Pronouns,Possessor pronouns,,,"In natural text, as opposed to elicitation, third person singular possessor pronouns are often lengthened, as shown in \REF{POSSlength}.",POSSlength,"\gsrc èé lûngà yá sã́ \textbf{wɛ́ɛ̀} yɔ́ɔ̀ yíì | \gll èé lûngà yá sã́ w-ɛ̂ y-ɔ́ɔ̀ yíì | \gls EXCL emptyset7.grave 7:ATT emptyset1.father 1-POSS.3SG 7-OBJ 7.COP | \glt `Right, his father's grave is over there.'",,,,,,,,,,,,,,,,,,
Parts of speech,Pronouns,Reflexive pronoun {\itshape mɛ́dɛ́,,,"In object noun phrases, {\itshape mɛ́dɛ́} `self' directly follows the object pronoun, indicating identity between the subject and the object, as in \REF{mede} for all animate person categories.\footnote{The other non-speech act participant categories, namely agreement classes 3 through 9, all adhere to the same pattern.}",mede,Not found,,,,,,,,,,,,,,,,,,
Parts of speech,Pronouns,Reflexive pronoun {\itshape mɛ́dɛ́,,,"The reflexive pronoun can appear in subject position, as in \REF{medeax}. This construction, however, is pragmatically more marked, as subjects are typically topics (\sectref{sec:IS}) and as such less marked. With the reflexive pronoun in subject position, the lines between reflexive and emphatic function become more blurred.",medeax,"\gsrc mɛ̀ \textbf{mɛ́dɛ́} mɛ́ nyɛ́ mɛ̂ | \gll mɛ mɛ́dɛ́ mɛ-H nyɛ̂-H mɛ̂ | \gls 1SG self 1SG-PRS see-R 1SG.OBJ self | \glt `ME, I see myself.'",,,,,,,,,,,,,,,,,,
Parts of speech,Pronouns,Reflexive pronoun {\itshape mɛ́dɛ́,,,"It is also grammatical to drop the reflexive pronoun altogether and only use the object pronoun, as in \REF{medesans}. For the first and second person singular and plural, it is inferred that the subject and object are coreferential. For third persons, however, the use of the object pronoun alone would lead to the interpretation that subject and object are not coreferential. Therefore, {\itshape mɛ́dɛ́} `self' must be used in these environments. The use of the reflexive pronoun is also preferred over the object pronoun alone with the first and second person, probably for the parallel structure with the third person reflexive marking.",medesans,\gsrc mɛ̀ mɛ́ nyɛ́ mɛ̂ | \gll mɛ mɛ-H nyɛ̂-H mɛ̂ | \gls 1SG 1SG-PRS see-R 1SG.OBJ self | \glt `I see myself.',,,,,,,,,,,,,,,,,,
Parts of speech,Pronouns,Reflexive pronoun {\itshape mɛ́dɛ́,,,"Reflexive pronouns are also used in adjunct position, as shown in \REF{refladj}.",refladj,\gsrc mɛ̀ nzí sâ yî púù yá mɛ̂ mɛ́dɛ́ | \gll mɛ nzí sâ yî púù yá mɛ̂ mɛ́dɛ́ | \gls 1SG PROG.PST do 7.DEM.PROX emptyset7.reason 7:ATT 1SG self | \glt `I was doing this for myself.',,,,,,,,,,,,,,,,,,
Parts of speech,Pronouns,Reflexive pronoun {\itshape mɛ́dɛ́,,,"With an emphatic function, the reflexive pronoun can be used in all kinds of noun phrases: subject, object, and adjunct. Typically, {\itshape mɛ́dɛ́} `self' follows a pronoun, as with the subject pronoun in \REF{mede1} and in the adjunct in \REF{mede2}.",mede1,"\gsrc bímbú lɛ́ mámbòngò mâ wɛ̀ \textbf{mɛ́dɛ́} dígɛ̂ \textbf{mɛ́dɛ́} | \gll bímbú lɛ́ ma-mbòngò mâ wɛ̀ mɛ́dɛ́ dígɛ̂ mɛ́dɛ́ | \gls emptyset5.amount 5:ATT ma6-plant 6.DEM.PROX 2SG.SBJ self look.IMP self | \glt `The amount of these plants, yourself, look yourself,'",mede2,\gsrc àà ndáwɔ̀ dé tù nyɛ̀ \textbf{mɛ́dɛ́} támé | \gll àà ndáwɔ̀ dé tù nyɛ̀ mɛ́dɛ́ támé | \gls 1.COP ∅9.house LOC inside 1. SBJ self alone | \glt `He is in his house all by himself.',,,,,,,,,,,,,,,,
Parts of speech,Pronouns,Reflexive pronoun {\itshape mɛ́dɛ́,,,"Unlike with its reflexive function, the reflexive pronoun can also occur after other parts of speech than pronouns when used emphatically. In \REF{mede3}, for instance, it occurs after the finite verb form, referring to the subject. Given that other words, such as the finite verb form in this example, can enter between the subject and reflexive pronoun, I analyze {\itshape mɛ́dɛ́} `self' as a free morpheme.",mede3,\gsrc à múà \textbf{mɛ́dɛ́} nyá mùdì | \gll a múà mɛ́dɛ́ nyá m-ùdì | \gls 1 be.almost self real N1-person | \glt `He was himself a real (old) man.',,,,,,,,,,,,,,,,,,
Parts of speech,Pronouns,Reflexive pronoun {\itshape mɛ́dɛ́,,,"{\itshape mɛ́dɛ́} `self' also follows nouns (instead of pronouns), as in \REF{mede4} where it follows the left-dislocated object noun.",mede4,"\gsrc sá \textbf{mɛ́dɛ́} mɛ̀ nzí sâ yî | \gll sá mɛ́dɛ́ mɛ nzí sâ yî | \gls emptyset7.thing self 1SG PROG.PST do 7.DEM.PROX | \glt `The thing itself, I was doing this.'",,,,,,,,,,,,,,,,,,
Parts of speech,Other pro-forms,Interrogative pro-forms,Simple interrogative pro-forms,,"Simple interrogative pro-forms are used in questions to replace either a noun phrase or a temporal adverb. They occur independently as free morphemes. Gyeli has three pro-forms, as listed in \REF{simpinterr}, that occur in simple interrogative constructions.",simpinterr,Not found,,,,,,,,,,,,,,,,,,
Parts of speech,Other pro-forms,Interrogative pro-forms,Simple interrogative pro-forms,,"The interrogative pro-form {\itshape líní} `when' exclusively occurs in simple constructions, no matter if it occurs at the beginning or the end of the question phrase, as shown in \REF{lini}.",lini,Not found,,,,,,,,,,,,,,,,,,
Parts of speech,Other pro-forms,Interrogative pro-forms,Simple interrogative pro-forms,,"The main use of {\itshape líní} `when' is in temporal adverbial clauses (\sectref{sec:ADVfull}) to express simultaneity. In fact, its use as an interrogative pro-form is rare, even if possible, as shown in \REF{lini}. When a question asks for a temporal adjunct in the answer, speakers prefer to use complex interrogatives, which can be translated as `what day' and `what time', as discussed in the next section.",lini,Not found,,,,,,,,,,,,,,,,,,
Parts of speech,Other pro-forms,Interrogative pro-forms,Simple interrogative pro-forms,,"In contrast to {\itshape líní} `when', the other two interrogative pro-forms {\itshape vɛ́} `where' and {\itshape ná} `how' only appear in simple constructions if they are used in-situ at the end of the phrase, as illustrated in \REF{wherevE} and \REF{howna}.",wherevE,\gsrc ɛ́ ná mwánɔ̀ nùù \textbf{vɛ́} | \gll ɛ́ ná m-wánɔ̀ nùù vɛ́ | \gls LOC how N1-child 1.COP where | \glt `What! Where is the child?',howna,"\gsrc kó mbúmbù nyɛ̀ nzí lèmbò dyùù bɔ̂ fàmíì bá bùdì \textbf{ná} | \gll kó mbúmbù nyɛ nzí lèmbo dyùù b-ɔ̂ fàmíì bá b-ùdì ná | \gls EXCL ∅1.namesake 1.SBJ PROG.PST know kill 2-OBJ ∅1.family 2:ATT ba2-person how | \glt `Oh namesake, how could he kill them, the family of people?'",,,,,,,,,,,,,,,,
Parts of speech,Other pro-forms,Interrogative pro-forms,Complex interrogative pro-forms,,"Gyeli has two interrogative pro-forms that are constructed with the locative preposition {\itshape ɛ́} preceding the interrogative form: {\itshape ɛ́ ná} `how' and {\itshape ɛ́ vɛ́} `where'. Examples of both interrogatives that require a temporal and a manner adjunct in the answer are given in \REF{eve} and \REF{ena}, respectively. Ungrammatical examples stem from elicited grammaticality judgments.",eve,Not found,ena,Not found,,,,,,,,,,,,,,,,
Parts of speech,Other pro-forms,Interrogative pro-forms,Complex interrogative pro-forms,,\noindent The complex form {\itshape ɛ́ ná} `how' is also used as a greeting in \REF{enahow},enahow,"\gsrc mbúmbù \textbf{ɛ́} \textbf{ná} | \gll mbúmbù ɛ́ ná | \gls ∅1.namesake LOC how | \glt `Namesake, how is it?'",,,,,,,,,,,,,,,,,,
Parts of speech,Other pro-forms,Interrogative pro-forms,Complex interrogative pro-forms,,"The second option for complex interrogatives are interrogative pro-forms such as {\itshape vɛ́} `which' and {\itshape níyɛ̀} `how many', which occur as the second constituent in an attributive construction with a noun and an attributive marker, as in \REF{intercomp1} and explained in detail in \sectref{sec:NIntPro}.",intercomp1,Not found,,,,,,,,,,,,,,,,,,
Parts of speech,Other pro-forms,Pro-adverbs {\itshape mpù and {\itshape ndɛ̀náà ,,,"Both pro-adverbs signal a non-verbal gesture or part of the communication that is happening simultaneously to speech time. In \REF{likethis1}, the speaker is communicating the number of his children by showing two fingers; {\itshape mpù} is signaling this non-verbal gesture.",likethis1,Not found,,,,,,,,,,,,,,,,,,
Parts of speech,Other pro-forms,Pro-adverbs {\itshape mpù and {\itshape ndɛ̀náà ,,,"\noindent Similarly, in \REF{likethis2}, {\itshape ndɛ̀náà} indicates that the greeting is ongoing between the speech act participants.",likethis2,\gsrc mɛ́ sùmɛ́lɛ́ bê \textbf{ndɛ̀náà} | \gll mɛ-H sùmɛlɛ-H bê ndɛ̀náà | \gls 1SG-PRS greet-R 2PL.OBJ like.that | \glt `I greet you like this.',,,,,,,,,,,,,,,,,,
Parts of speech,Other pro-forms,Pro-adverbs {\itshape mpù and {\itshape ndɛ̀náà ,,,"\noindent {\itshape mpù} often introduces the use of ideophones, as in \REF{likethis3}.",likethis3,"\gsrc yɔ́ɔ̀ Nzàmbí njí \textbf{mpù} bã̂ã̂ã̂ã̂ njì dígɛ̀ mpù | \gll yɔ́ɔ̀ Nzàmbí njî-H mpù bã̂ã̂ã̂ã̂ njì dígɛ mpù | \gls so ∅1.PN come-R like.this IDEO:walking far come look like.this | \glt `So Nzambi comes like this [depiction of walking a long distance], comes looking like this.'",,,,,,,,,,,,,,,,,,
Parts of speech,Other pro-forms,Pro-adverbs {\itshape mpù and {\itshape ndɛ̀náà ,,,"\noindent The deictic reference of pro-adverbs can also be anaphoric rather than signaling an ongoing or immediately following non-verbal communicative event. This is the case in \REF{likethis4}, for instance, where {\itshape ndɛ̀náà} summarizes the situation that the speaker has elaborated previously.",likethis4,"\gsrc bon pílì yí báàlá nà bɛ̀ \textbf{ndɛ̀náà} ndɛ̀náà ndáà ná | \gll bon pílì yi-H báàla-H nà bɛ̀ ndɛ̀náà ndɛ̀náà ndáà ná | \gls good[French] when 7-PRS repeat-R COM be like.that like.that also still | \glt `So, when it continues and is still like this and like that.'",,,,,,,,,,,,,,,,,,
Parts of speech,Other pro-forms,Pro-adverbs {\itshape mpù and {\itshape ndɛ̀náà ,,,"As \REF{likethis4} and \REF{likethis5} show, {\itshape mpù} and {\itshape ndɛ̀náà} `like this' can both occur directly after the finite verb, as expected for an adverb. While {\itshape mpù} is often followed by an object, this is not the case for {\itshape ndɛ̀náà} in the corpus. Speakers state, however, that it would be perfectly grammatical.",likethis4,"\gsrc bon pílì yí báàlá nà bɛ̀ \textbf{ndɛ̀náà} ndɛ̀náà ndáà ná | \gll bon pílì yi-H báàla-H nà bɛ̀ ndɛ̀náà ndɛ̀náà ndáà ná | \gls good[French] when 7-PRS repeat-R COM be like.that like.that also still | \glt `So, when it continues and is still like this and like that.'",likethis5,Not found,,,,,,,,,,,,,,,,
Parts of speech,Other pro-forms,Pro-adverbs {\itshape mpù and {\itshape ndɛ̀náà ,,,"{\itshape Mpù}, unlike {\itshape ndɛ̀náà}, is often preceded by the preposition {\itshape ɛ́}, as in \REF{likethis6}.",likethis6,\gsrc yɔ́ɔ̀ Nzàmbí dígɛ́ mísì \textbf{ɛ́} \textbf{mpù} | \gll yɔ́ɔ̀ Nzàmbí dígɛ-H m-ísì ɛ́ mpù | \gls so ∅1.PN look-R ma6-eye LOC like.this | \glt `So Nzambi looks with the eyes like this.',,,,,,,,,,,,,,,,,,
Parts of speech,Other pro-forms,Pro-clausal {\itshape ngáà,,,"The pro-clausal tag question particle {\itshape ngáà} is used to verify the truth value of a clause in leading polar questions (\sectref{sec:Questions}), as in \REF{Qtag1}. It is extra-clausal as evidenced by a phonetic break that separates {\itshape ngáà} from the main clause and its ability to occur by itself, for instance as a response to an interlocutor's statement. A {\itshape ngáà} response by itself expresses either surprise, a truth verification (`is that right?', `really?'), or agreement (`isn't that right!', `really!').",Qtag1,"\gsrc \textbf{ngáà} wɛ́ nyɛ́ mpù | \gll ngáà wɛ-H nyɛ̂-H mpù | \gls Q(tag) 2SG-PRS see-R like.this | \glt `Right, you see that?'",,,,,,,,,,,,,,,,,,
Parts of speech,Other pro-forms,Pro-clausal {\itshape ngáà,,,"\noindent {\itshape ngáà} appears both at the beginning of the question, as in \REF{Qtag1}, or at the end of it, as in \REF{Qtag2}.",Qtag1,"\gsrc \textbf{ngáà} wɛ́ nyɛ́ mpù | \gll ngáà wɛ-H nyɛ̂-H mpù | \gls Q(tag) 2SG-PRS see-R like.this | \glt `Right, you see that?'",Qtag2,"\gsrc wɛ́ nyɛ́ mpù \textbf{ngáà} | \gll wɛ-H nyɛ̂-H mpù ngáà | \gls 2SG-PRS see-R like.this Q(tag) | \glt `You see that, don't you?'",,,,,,,,,,,,,,,,
Parts of speech,Other pro-forms,Pro-clausal {\itshape ngáà,,,The pro-clausal particle is used in both affirmative and negated questions. An example of the latter is given in \REF{Qtag3}.,Qtag3,"\gsrc wɛ̀ɛ́ nyɛ́lɛ́ mpù \textbf{ngáà} | \gll wɛ̀ɛ́ nyɛ̂-lɛ mpù ngáà | \gls 2SG.NEG.PRS see-NEG like.this Q(tag) | \glt `You don't see that, do you?'",,,,,,,,,,,,,,,,,,
Parts of speech,Other pro-forms,Pro-clausal {\itshape ngáà,,,"In affirmative questions, Gyeli also uses French loanwords or code-switching.\footnote{The status of these French words in Gyeli is not clear at the moment.} In \REF{Qtag4}, {\itshape ɛ̀sɛ́} taken from French {\itshape est-ce} `is it' is used as tag question marker. There seems to be a preference to use it phrase initially.",Qtag4,"\gsrc \textbf{ɛ̀sɛ́} béé ndáà bèyá làwɔ́ fàlà | \gll ɛ̀sɛ́ béé ndáà bèya-H làwɔ-H fàlà | \gls is.it[French] 2PL.SBJ also 2PL[Kwasio]-PRS speak-R emptyset1.French | \glt `Isn't it, you (pl.) also, you speak French.'",,,,,,,,,,,,,,,,,,
Parts of speech,Other pro-forms,Pro-clausal {\itshape ngáà,,,"In contrast, {\itshape nɔ́ɔ̀} from French {\itshape non} `no' is used phrase finally with the same function, as in \REF{Qtag5}.",Qtag5,"\gsrc béé ndáà bèyá làwɔ́ fàlà \textbf{nɔ́ɔ̀} | \gll béé ndáà bèya-H làwɔ-H fàlà nɔ́ɔ̀ | \gls is.it[French] 2PL.SBJ also 2PL[Kwasio]-PRS speak-R emptyset1.French no[French] | \glt `You (pl.) also, you speak French, isn't it?'",,,,,,,,,,,,,,,,,,
Parts of speech,Other pro-forms,Pro-sentence forms,,,"Pro-sentence forms replace an entire sentence. They are typically answers to to polar questions (\sectref{sec:Questions}), making a statement about its truth value. They can, however, also occur as response to a statement that the speaker agrees or disagrees with. Gyeli has several pro-sentence forms for each agreement and disagreement signal. \REF{yes} provides a list of pro-forms that signal agreement. These different pro-forms seem to correlate with pragmatic and semantic differences. {\itshape ɛ́ɛ̀} seems to be the regular way to say `yes', while {\itshape ɛ̀hɛ́ɛ́} is used more emphatically to signal strong agreement. The exact use of the other pro-forms is less well understood.",yes,Not found,,,,,,,,,,,,,,,,,,
Parts of speech,Other pro-forms,Pro-sentence forms,,,"When asked for the translation of `yes', speakers would answer with \REF{yes1}. In natural speech as in the corpus, however, a range of other agreement signaling pro-forms are used. They all have in common that they only consist of a long vowel or nasal. The tonal melody and vowel length is crucial in distinguishing agreement from disagreement, as the segmentally similar but tonally different pairs in, for instance, \REF{yes4} and \REF{no2} show. Agreement signals have long segments with either a falling or L or H tone, as in \REF{yes1} through \REF{yes4}. \REF{yes5} and \REF{yes6}, which are tonally identical, are used for emphatic agreement, as in English `exactly!'.",yes1,Not found,yes4,Not found,no2,Not found,yes1,Not found,yes4,Not found,yes5,Not found,yes6,Not found,,,,,,
Parts of speech,Other pro-forms,Pro-sentence forms,,,"There are fewer pro-forms for disagreement than for agreement. The default form is {\itshape tɔ̀sâ} in \REF{no1}, which is derived from the negative polarity item {\itshape tɔ̀} (\sectref{sec:InvQUANT1}) and the noun {\itshape sâ} `thing'.",no1,Not found,,,,,,,,,,,,,,,,,,
Parts of speech,Other pro-forms,Pro-sentence forms,,,"The other two forms in \REF{no2} and \REF{no3} are identical in their tonal pattern. They also differ from agreement forms in their relative brevity. Disagreement forms are never lengthened, but rather short. In \REF{no2} and \REF{no3}, the medial glottal stop reinforces the impression of short segments.",no2,Not found,no3,Not found,no2,Not found,no3,Not found,,,,,,,,,,,,
Parts of speech,Elements of the nominal phrase,Modifiers with agreement prefix,{\itshape -ɛ́sɛ̀ `all',,"In Gyeli, {\itshape ɛ́sɛ̀} `all' is typically used with plural nouns. Also singular forms can, however, be modified by -{\itshape ɛ́sɛ̀} `all' in a specific context, which is also shown in \tabref{Tab:All}. This special context requires a situation where a typical singular entity consists of or is cut up into several parts. Taking the example of a cat, {\itshape síngì yɛ́sɛ̀} `all the cat' would mean that a cat is cut up into different parts, but then all the parts are used, which is different from meaning `the whole cat' (\sectref{sec:mandjimo}), as shown in \REF{allcat}.",allcat,Not found,,,,,,,,,,,,,,,,,,
Parts of speech,Elements of the nominal phrase,Modifiers with agreement prefix,Anaphoric marker {\itshape ndɛ̀,,The anaphoric marker {\itshape ndɛ̀} signals reference to an entity that has been mentioned before in the discourse. It occurs in two variants: (i) with an agreement prefix and (ii) as the stem only without an agreement prefix. The variant with agreement prefix is more frequent in the text corpus with almost six times more agreeing than free stem forms. A natural text example of {\itshape ndɛ́} with an agreement prefix is given in \REF{41t}.,41t,"\gsrc bèdéwò \textbf{bíndɛ̀} byɔ̀ mɛ́ lɔ́ njì lɛ́bɛ̀lɛ̀ bédéwò bà wɛ̀ | \gll be-déwò bí-ndɛ̀ byɔ̂ mɛ-H lɔ́ njì lɛ́bɛlɛ H-be-déwò bà wɛ̀ | \gls be8-food 8-ANA 8.OBJ 1-PRS RETRO come follow be8-food AP 2SG.OBJ | \glt `That (aforementioned) food, I have come to look for the food at your place.'",,,,,,,,,,,,,,,,,,
Parts of speech,Elements of the nominal phrase,Modifiers with agreement prefix,Anaphoric marker {\itshape ndɛ̀,,"Another possibility would be to analyze the CV morph as an attributive marker. As shown in \sectref{sec:ATT}, many of the attributive markers across different agreement classes have a CV shape with a plain vowel and an H tone. Most attributive markers link a noun to a second constituent that could be another noun or another part of speech, such as an adjective or interrogative pronoun, as discussed in \sectref{sec:CONC}. Thus, this analysis would also make sense syntactically. Arguments against this explanation, however, concern the form of some attributive markers and their distribution. First, the attributive marker forms of agreement classes 1, 3, 7, and 9 differ from the CV shape element found with {\itshape ndɛ̀}. For instance, in agreement class 1, the attributive marker is {\itshape wà}, while {\itshape ndɛ̀} would be preceded by {\itshape nú}-; in agreement class 7, the attributive marker is {\itshape yá}, but {\itshape ndɛ̀} is preceded by {\itshape yí}-. Second, there are examples where {\itshape ndɛ̀} plus its preceding CV morph follow a true attributive, as shown in \REF{ANAnoATT}. This makes it clear that the morph cannot be an attributive marker.",ANAnoATT,\gsrc mùdì \textbf{wà} \textbf{nú}ndɛ́ dígɛ́ mísì. | \gll m-ùdì wà nú-ndɛ̀ dígɛ-H m-ísì | \gls N1-person 1:ATT 1-ANA look-R ma6-eye | \glt `That (aforementioned) person thinks very hard [lit. looks with his eyes].',,,,,,,,,,,,,,,,,,
Parts of speech,Elements of the nominal phrase,Modifiers with agreement prefix,Anaphoric marker {\itshape ndɛ̀,,"Unlike other nominal modifiers that always agree with their head noun, the anaphoric marker can also appear with its stem only. When following an identificational marker, {\itshape ndɛ̀} occurs without an agreement prefix, as shown in \REF{ANA41t}, which was uttered at the end of a story.",ANA41t,\gsrc kàndá wɛ́ \textbf{ndɛ̀} | \gll kàndá wɛ́ ndɛ̀ | \gls ∅7.proverb ID ANA | \glt `The story is this.',,,,,,,,,,,,,,,,,,
