Chapter,Section,Subsection,Subsubsection,Subsubsubsection,Knowledge Point,Label 1,Content 1,Label 2,Content 2,Label 3,Content 3,Label 4,Content 4,Label 5,Content 5,Label 6,Content 6,Label 7,Content 7,Label 8,Content 8,Label 9,Content 9,Label 10,Content 10
Simple clauses,Information structure,Left dislocation,Left dislocation of nominal noun phrases,,"Left dislocation is also used in conjunction with the sentential modifier {\itshape ndáà} `also', as in \REF{left4}.",left4,"\gsrc nà \textbf{màntúà} \textbf{ndáà}, à nzí dè \textbf{mɔ̂} | \gll nà mà-ntúà ndáà a nzí dè m-ɔ̂ | \gls COM ma6-mango also 1 PROG.PST eat 6-OBJ | \glt `[The woman ate the oranges.] And she also ate mangoes.'",,,,,,,,,,,,,,,,,,
Simple clauses,Information structure,Left dislocation,Left dislocation of nominal noun phrases,,"as in \REF{Emp4}. Nzambi's wife explains to her husbands friend that their fields are not producing enough food. She then changes the topic from the problems in food production to the food itself, which she asks the friend for.",Emp4,"\gsrc bèdéwò béndɛ̀ \textbf{byɔ̀} mɛ́ lɔ́ njì lɛ́bɛ̀lɛ̀ bédéwò bà wɛ̂ | \gll be-déwò bé-ndɛ̀ b-yɔ̀ mɛ-H lɔ́ njì lɛ́bɛlɛ H-be-déwò bà wɛ̂ | \gls be8-food 8-ANA 8-OBJ 1-PRS RETRO come follow be8-food AP 2SG.OBJ | \glt `[The field is running out of food.] This food, I have come to look for the food at your place.'",,,,,,,,,,,,,,,,,,
Simple clauses,Information structure,Left dislocation,Left dislocation of pronominal noun phrases,,"Thus, in \REF{Top1}, the object pronoun is left dislocated, but does not occur in-situ after the verb. In this example, the chief of Ngolo talks about his wishes to obtain houses with tin roofs. He finishes his statements by the summary `This I want', referring to all the points he brought up about new houses in the village and tin roofs.",Top1,"\gsrc \textbf{yɔ́ɔ̀} mɛ́ wúmbɛ́ wû | \gll y-ɔ́ɔ̀ mɛ-H wúmbɛ-H wû | \gls 7-OBJ 1SG-PRS want-R there | \glt `[ I will build houses in Ngolo, each with a tin roof.] I want THIS there.'",,,,,,,,,,,,,,,,,,
Simple clauses,Information structure,Left dislocation,Left dislocation of pronominal noun phrases,,"In \REF{Top2}, he similarly talks about a topic, namely a tree that people are going to take down without even asking for permission. He concludes by summarizing the general topic of the tree: `This I have planted.'",Top2,"\gsrc \textbf{yɔ́ɔ̀} \textbf{yɔ́ɔ̀} mɛ̀ jìlɛ́ mà | \gll y-ɔ́ɔ̀ y-ɔ́ɔ̀ mɛ jìlɛ-H mà | \gls 7-OBJ 7-OBJ 1SG.PST1 place-R COMPL[Kwasio] | \glt `This, this I have placed [there].'",,,,,,,,,,,,,,,,,,
Simple clauses,Information structure,Left dislocation,Left dislocation of pronominal noun phrases,,"While most instances of topicalization seem to involve a pronominal object, as in \REF{Top1} and \REF{Top2}, there are also examples where a lexical object noun phrase is left dislocated, but not cross-referenced in-situ. This is the case in \REF{Top3}.",Top1,"\gsrc \textbf{yɔ́ɔ̀} mɛ́ wúmbɛ́ wû | \gll y-ɔ́ɔ̀ mɛ-H wúmbɛ-H wû | \gls 7-OBJ 1SG-PRS want-R there | \glt `[ I will build houses in Ngolo, each with a tin roof.] I want THIS there.'",Top2,"\gsrc \textbf{yɔ́ɔ̀} \textbf{yɔ́ɔ̀} mɛ̀ jìlɛ́ mà | \gll y-ɔ́ɔ̀ y-ɔ́ɔ̀ mɛ jìlɛ-H mà | \gls 7-OBJ 7-OBJ 1SG.PST1 place-R COMPL[Kwasio] | \glt `This, this I have placed [there].'",Top3,"\gsrc nà \textbf{nákúndɛ̀kúndɛ̀} \textbf{ndáà}, à bíyɛ́lɛ́ | \gll nà nákúndɛ̀kúndɛ̀ ndáà a bíyɛlɛ-H | \gls CONJ ∅1.bean also 1.PST1 cook-PST | \glt `[The woman cooked rice for her child.] And she also cooked beans.'",,,,,,,,,,,,,,
Simple clauses,Information structure,Object pronoun fronting,,,"Pronominal objects can be fronted in a way that they occur before a simple predicate, as in \REF{front1}. While in a pragmatically more neutral clause the object pronoun {\itshape yɔ̂} `it' would occur after the verb, it is here fronted and the predicate appears phrase finally, making it more salient in terms of information structure. Nzambi explains to his friend's wife that her child would be very tender when one steams it, wrapped in leaves. He then emphasizes that he will EAT the child, which can be interpreted as an instance of truth value focus, highlighting the truth of his future deeds.",front1,\gsrc mɛ̀ɛ̀ \textbf{yɔ̂} \textbf{dè} | \gll mɛ̀ɛ̀ y-ɔ̂ dè | \gls 1SG.FUT 7-OBJ eat | \glt `[This tender child is good when you wrap it in a leaf package.] I will EAT it [the child].',,,,,,,,,,,,,,,,,,
Simple clauses,Information structure,Object pronoun fronting,,,"If a clause contains a complex predicate with an auxiliary, the pronominal object under fronting appears between the auxiliary and the main verb, as shown in \REF{front2}. The context is the same as in \REF{front1}. Again, the protagonist of the story stresses what he is going to do with the child, namely eat it. The verb {\itshape dè} `eat' appears in focus position, since the pronoun {\itshape nyɛ̂} `him' is defocused.",front2,\gsrc mɛ́ lígɛ́ \textbf{nyɛ̂} \textbf{dè} | \gll mɛ-H lígɛ-H nyɛ̂ dè | \gls 1SG-PRS stay-R 1.OBJ eat | \glt `I stay to EAT him [the child].',front1,\gsrc mɛ̀ɛ̀ \textbf{yɔ̂} \textbf{dè} | \gll mɛ̀ɛ̀ y-ɔ̂ dè | \gls 1SG.FUT 7-OBJ eat | \glt `[This tender child is good when you wrap it in a leaf package.] I will EAT it [the child].',,,,,,,,,,,,,,,,
Simple clauses,Information structure,Object pronoun fronting,,,"A similar example is presented in \REF{front3}. Again, the predicate is complex with an aspectual auxiliary verb that is followed by a pronominal object so that the main verb occurs phrase finally. Here, the speaker explains the troubles the Bagyeli encounter with their Bulu neighbors.",front3,\gsrc nyɛ̀ náà à múà \textbf{wɛ̂} \textbf{bíyɔ̀} | \gll nyɛ nâ a múà wɛ̂ bíyɔ | \gls 1 COMP 1 PROSP 2SG.OBJ hit | \glt `He [the Bulu person says] that he is about to BEAT you [the Gyeli person].',,,,,,,,,,,,,,,,,,
Simple clauses,Special clause types,Questions,Polar questions with {\itshape nà(nâ),,"They are usually marked by the question marker {\itshape nà} or {\itshape nànâ}, which grammatically marks a sentence as a question. The first version is the shorter default form {\itshape nà}, as shown in \REF{PQ1}, which also has a longer emphatic form {\itshape nànâ}, as in \REF{PQ2}. Both only occur at the beginning of a phrase.",PQ1,\gsrc \textbf{nà} wɛ̀ nyɛ́ nyɛ̂ | \gll nà wɛ nyɛ̂-H nyɛ̂ | \gls Q 2SG.PST1 see-R 1.OBJ | \glt `Did you see him?',PQ2,\gsrc \textbf{nànâ} wɛ̀ nyɛ́ nyɛ̂ | \gll nànâ wɛ nyɛ̂-H nyɛ̂ | \gls Q 2SG.PST1 see-R 1.OBJ | \glt `Did you really see him?',,,,,,,,,,,,,,,,
Simple clauses,Special clause types,Questions,Polar questions with {\itshape nà(nâ),,"The emphatic question marker {\itshape nànâ} in polar questions pragmatically expresses insistence or even disbelief. Thus, in \REF{PQ2}, the speaker who asks the question rather expects the addressee to not have seen the person in question and insists on getting a true answer.",PQ2,\gsrc \textbf{nànâ} wɛ̀ nyɛ́ nyɛ̂ | \gll nànâ wɛ nyɛ̂-H nyɛ̂ | \gls Q 2SG.PST1 see-R 1.OBJ | \glt `Did you really see him?',,,,,,,,,,,,,,,,,,
Simple clauses,Special clause types,Questions,Polar questions with {\itshape nà(nâ),,"Prosody does not seem to play a role in terms of indicating a question. Therefore, question markers are the only means to mark questions clearly as such, especially in polar questions that do not employ any other question indicating devices, in contrast to constituent questions, which use interrogatives. Nevertheless, the use of question markers is not obligatory, not even in polar questions, as shown in \REF{PQ3}. In this example, it has to be clear from the context, however, that the sentence is a question. Otherwise, {\itshape nà} as in \REF{PQ1} has to be used.",PQ3,\gsrc wɛ̀ nyɛ́ nyɛ̂ | \gll wɛ nyɛ̂-H nyɛ̂ | \gls 2SG.PST1 see-R 1.OBJ | \glt `Did you see him?',PQ1,\gsrc \textbf{nà} wɛ̀ nyɛ́ nyɛ̂ | \gll nà wɛ nyɛ̂-H nyɛ̂ | \gls Q 2SG.PST1 see-R 1.OBJ | \glt `Did you see him?',,,,,,,,,,,,,,,,
Simple clauses,Special clause types,Questions,Polar questions with {\itshape nà(nâ),,"In addition to their syntactic function of marking a phrase as a question, question markers also have a pragmatic function. In contexts where it is clear that a phrase is meant as a question and {\itshape nà} is still used, the question marker serves as marking emphasis. For instance, \REF{PQ1} could also be translated as `Did you really see him?', just as in \REF{PQ2}. Using the longer form {\itshape nànâ}, as in \REF{PQ2}, is even more emphatic and indicates the speakers disbelief: speakers would also translate the question in \REF{PQ2} as `Are you sure that you saw him?'",PQ1,\gsrc \textbf{nà} wɛ̀ nyɛ́ nyɛ̂ | \gll nà wɛ nyɛ̂-H nyɛ̂ | \gls Q 2SG.PST1 see-R 1.OBJ | \glt `Did you see him?',PQ2,\gsrc \textbf{nànâ} wɛ̀ nyɛ́ nyɛ̂ | \gll nànâ wɛ nyɛ̂-H nyɛ̂ | \gls Q 2SG.PST1 see-R 1.OBJ | \glt `Did you really see him?',PQ2,\gsrc \textbf{nànâ} wɛ̀ nyɛ́ nyɛ̂ | \gll nànâ wɛ nyɛ̂-H nyɛ̂ | \gls Q 2SG.PST1 see-R 1.OBJ | \glt `Did you really see him?',PQ2,\gsrc \textbf{nànâ} wɛ̀ nyɛ́ nyɛ̂ | \gll nànâ wɛ nyɛ̂-H nyɛ̂ | \gls Q 2SG.PST1 see-R 1.OBJ | \glt `Did you really see him?',,,,,,,,,,,,
Simple clauses,Special clause types,Questions,Polar questions with {\itshape nà(nâ),,"{\itshape nà} can also co-occur with interrogatives, as shown in \REF{PQ4}. {\itshape nà} is not required to indicate that the sentence is a question, since this is already achieved through the interrogative construction {\itshape púù yá gyí} `why'. It seems, however, that {\itshape nà} here has an emphasizing function.",PQ4,\gsrc \textbf{nà} \textbf{púù} \textbf{yá} \textbf{gyí} wɛ̀ pálɛ́ gyàgà mányâ | \gll nà púù yá gyí wɛ̀ pálɛ́ gyàga H-ma-nyâ | \gls Q emptyset7.reason 7:ATT what 2SG.PST1 NEG.PST buy OBJ.LINK-ma6-milk | \glt `Why didn't you buy milk?',,,,,,,,,,,,,,,,,,
Simple clauses,Special clause types,Questions,Leading questions with {\itshape ngáà,,"The question marker {\itshape ngáà} is used for leading questions, i.e.\ polar questions that lead the addressee to give a specific yes or no answer, as expected by the speaker. {\itshape ngáà} roughly corresponds to {\itshape n'est-ce pas} in French and {\itshape right?} or {\itshape isn't it?} in English, which are sometimes also referred to as tag questions. I therefore gloss {\itshape ngáà} as ``{\Q}(tag)''. Just like the question marker {\itshape nànâ}, {\itshape ngáà} has both a syntactic and pragmatic function. Syntactically, it encodes question marking. Pragmatically, it leads the addressee to give an expected answer. In contrast to {\itshape nà(nâ)}, {\itshape ngáà} can occur both at the beginning and the end of a question, as shown in \REF{LQ1}. The expected answer to the questions in \REF{LQ1} would be {\itshape ɛ́ɛ̀} `yes' (or a variant thereof, as shown in \sectref{sec:ProSent}).",LQ1,Not found,LQ1,Not found,,,,,,,,,,,,,,,,
Simple clauses,Special clause types,Questions,Leading questions with {\itshape ngáà,,"\noindent {\itshape ngáà} is used in the same form for negated questions, as shown in \REF{LQ2}. Here, the expected answer would be {\itshape tɔ̀sâ} `no'.",LQ2,Not found,,,,,,,,,,,,,,,,,,
Simple clauses,Special clause types,Questions,Constituent questions,,"Subject interrogative pronouns always occur in-situ, i.e.\ phrase initially. An example of a subject question using the human/animate interrogative pronoun {\itshape nzá} `who' is given in \REF{SCQ1}.",SCQ1,Not found,,,,,,,,,,,,,,,,,,
Simple clauses,Special clause types,Questions,Constituent questions,,"\noindent \REF{SCQ2} provides an example for a question asking for an inanimate subject, thus using {\itshape gyí} `what'.",SCQ2,Not found,,,,,,,,,,,,,,,,,,
Simple clauses,Special clause types,Questions,Constituent questions,,"As a side note, there seems to be a preference to use the \textsc{progressive} marker {\itshape nzí} in past questions, even though the meaning is not necessarily progressive. Questions can also be formed without the \textsc{progressive} marker, as in \REF{SCQ3}, but speakers would spontaneously form questions with this aspect marker. They state that questions without it are also grammatical and apparently mean the same. {\itshape nzí} therefore most likely also serves another function than \textsc{progressive}, but this needs further investigation.",SCQ3,Not found,,,,,,,,,,,,,,,,,,
Simple clauses,Special clause types,Questions,Constituent questions,,"For object questions, the same interrogative pronouns are used as for subject questions. In \REF{OCQ1}, the object interrogative pronoun {\itshape nzá} `who' is left dislocated to the beginning of the phrase. As \REF{OCQ1b} shows, this also holds for negated questions. Both questions occur in O S V (X) word order.",OCQ1,Not found,OCQ1b,\gsrc \textbf{nzá} wɛ̀ɛ́ kwálɛ̀lɛ̀ | \gll nzá wɛ̀ɛ́ kwàlɛ-lɛ | \gls who 2SG.PRS.NEG like-NEG | \glt `Who don't you like?',,,,,,,,,,,,,,,,
Simple clauses,Special clause types,Questions,Constituent questions,,"\noindent Likewise, the inanimate interrogative pronoun {\itshape gyí} `what' can be left dislocated in object questions, as shown in \REF{OCQ2}. Again, this also holds for negated questions, as in \REF{OCQ2b}.",OCQ2,Not found,OCQ2b,Not found,,,,,,,,,,,,,,,,
Simple clauses,Special clause types,Questions,Constituent questions,,"The object interrogative pronoun can also occur in-situ, as shown in \REF{OCQ3} for both {\itshape nzá} `who' and {\itshape gyí} `what'. In terms of its pragmatics, the in-situ position differs from left dislocation in terms of information structure. The object position in-situ is the focus position, and thus the object interrogative appears in focus in \REF{OCQ3}.",OCQ3,Not found,OCQ3,Not found,,,,,,,,,,,,,,,,
Simple clauses,Special clause types,Questions,Constituent questions,,"In questions with double objects, the object interrogative can occur in three positions. In \REF{QIO}, the question asks for the recipient object (which is often referred to as the direct object, but, as explained in \sectref{sec:HLinker}, direct and indirect objects cannot be distinguished on formal grounds in Gyeli). The object interrogative can appear either in (i) left dislocation at the beginning of the phrase, as in \REF{QIO1}, (ii) in the first object slot, as in \REF{QIO2}, and (iii) in the second object slot, as in \REF{QIO3}.",QIO,Not found,QIO1,Not found,QIO2,Not found,QIO3,Not found,,,,,,,,,,,,
Simple clauses,Special clause types,Questions,Constituent questions,,"\noindent The same holds for {\itshape gyí} when asking for the patient object, as illustrated for all three possible positions in \REF{QDO}.",QDO,Not found,,,,,,,,,,,,,,,,,,
Simple clauses,Special clause types,Questions,Constituent questions,,"In \REF{AQ1}, for instance, the constituent that is asked for is a comitative oblique encoding accompaniment. This is expressed by a comitative marker plus an interrogative pronoun in the question. The oblique question can occur both phrase initially and in-situ.",AQ1,Not found,,,,,,,,,,,,,,,,,,
Simple clauses,Special clause types,Questions,Constituent questions,,"\noindent The same pattern holds for oblique questions comprised of an associative plural construction, as in \REF{AQ2}.",AQ2,Not found,,,,,,,,,,,,,,,,,,
Simple clauses,Special clause types,Questions,Constituent questions,,Some verbs with reciprocal meaning require the comitative marker {\itshape nà}. They behave peculiarly in question formation in that they both require an interrogative pronoun in left dislocation and a comitative oblique noun phrase at the end of the question. The object is taken up again in the oblique phrase by a resumptive object pronoun. This is shown in \REF{QCOM}.,QCOM,Not found,,,,,,,,,,,,,,,,,,
Simple clauses,Special clause types,Questions,Constituent questions,,"Other examples of adjunct questions concern locative questions. Again, as shown in \REF{QLOC}, the locative oblique phrase can occur phrase initially or in-situ, even though the left dislocated variant seems to be much more frequent, given its relatively unmarked status.",QLOC,Not found,,,,,,,,,,,,,,,,,,
Simple clauses,Special clause types,Questions,Constituent questions,,"Temporal questions are also formed with oblique noun phrases. Depending on the expected time specificity, speakers usually use {\itshape dúbɔ̀ lé vɛ́} `what day', as in \REF{with1}, or {\itshape wùlà yá vɛ́} `what time', as in \REF{with2}. Again, both examples can occur phrase initially and in-situ with the in-situ position being the more marked one.",with1,% \gsrc \textbf{bá} \textbf{nà} \textbf{nzá} bâ kɛ̀ pɛ̂? | \gll % bá nà nzá bâ kɛ-H pɛ̂ | \gls % 2-PRS COM who 2.FUT go there | % \glt `Who will they go there with?',with2,Not found,,,,,,,,,,,,,,,,
Simple clauses,Special clause types,Questions,Constituent questions,,"\noindent Finally, also purpose obliques including {\itshape púù yá gyí} `what reason' are expressed following the same structure, as \REF{QPur} shows.",QPur,Not found,,,,,,,,,,,,,,,,,,
Simple clauses,Special clause types,Possessor raising,,,"Possessor raising is a pervasive phenomenon in Gyeli. While I use the term possessor raising in line with the literature on this topic, I do not imply an analysis of raising in the syntactic tree, but rather a marked possession construction. Thus, the possessor can be expressed as the subject or object of a clause, avoiding adnominal possession marking and benefactive obliques. In \REF{PR1}, the possessor is expressed in the subject.",PR1,\gsrc \textbf{mɛ́} dvúɔ́ nkû | \gll mɛ-H dvúɔ̀-H nkû | \gls 1SG-PRS hurt-R emptyset3.foot | \glt `My foot hurts.',,,,,,,,,,,,,,,,,,
Simple clauses,Special clause types,Possessor raising,,,"In most cases, however, the possessor has object status. In \REF{PR2}, for instance, the possessor {\itshape mɛ̂} takes the object position, while {\itshape mbɔ̀} `arm' occurs as a bare locative oblique noun phrase.",PR2,\gsrc ká yí nyí \textbf{mɛ̂} mbɔ̀ mpángì yí kùgá nâ nyíì \textbf{wɛ̀} mbɔ̀ | \gll ká yi-H nyî-H mɛ̂ m-bɔ̀ mpángì yi-H kùga-H nâ nyíì wɛ m-bɔ̀ | \gls when 7-PRS enter-R 1SG.OBJ N3-arm emptyset7.bamboo 7-PRS can-R COMP enter.SBJV 2SG N3-arm | \glt `When it goes into my arm . . . the bamboo can sting your arm.',,,,,,,,,,,,,,,,,,
Simple clauses,Special clause types,Possessor raising,,,"A possessor can also occur in copula constructions, as shown in \REF{PR3}. Here, the possessor appears in the copula complement.",PR3,\gsrc nzà nyíì \textbf{mɛ̀} mɔ̂ | \gll nzà nyíì mɛ̀ mɔ̂ | \gls emptyset9.hunger 9.COP 1SG.OBJ emptyset3.stomach | \glt `I am hungry [lit. hunger is me in the stomach].',,,,,,,,,,,,,,,,,,
Simple clauses,Special clause types,Possessor raising,,,"While the previous examples could also have been expressed by possessive pronouns as modifiers to the noun, other possessor raising constructions are rather equivalent to benefactives. In \REF{PR4}, for example, the structure could be modified to `build houses for me' with a purpose or benefactive oblique phrase introduced by {\itshape púù yá} (see \sectref{sec:OBL}).",PR4,\gsrc mɛ̀ bùdɛ́ nâ á lwɔ́ngɔ́ \textbf{mɛ̂} màndáwɔ̀ | \gll mɛ bùdɛ-H nâ a-H lwɔ́ngɔ-H mɛ̂ ma-ndáwɔ̀ | \gls 1SG have-R COMP 1-PRS build[Kwasio]-R 1SG.OBJ ma6-house | \glt `I say that she [Nadine] ought to build me houses.',,,,,,,,,,,,,,,,,,
Simple clauses,Special clause types,Possessor raising,,,"\noindent The same benefactive reading holds for copula constructions, as in \REF{PR5}.",PR5,"\gsrc nlã̂ wá zì ndáwɔ̀ nyà zì nyíì \textbf{mɛ̂} \textbf{vé} | \gll nlã̂ wá zì ndáwɔ̀ nyà zì nyíì mɛ̂ vé | \gls emptyset3.story 3:ATT emptyset7.tin emptyset9.house 9:ATT tin 9.COP 1SG.OBJ where | \glt `The problem with the tin, where is the tin (roofed) house for me?'",,,,,,,,,,,,,,,,,,
Simple clauses,Special clause types,Possessor raising,,,"As a counterpart to benefactive readings, possessor raising can also express adverse functions, as in \REF{PR6} where the speaker experiences a bad event. The construction is further special in terms of information structure, since the possessor object pronoun is fronted before the verb so that the verb appears in focus position (see \sectref{sec:OBJfront}). This shows that possessor objects indeed behave identical to other objects.",PR6,\gsrc bùdì bà sílɛ̃́ɛ̃̀ \textbf{mɛ̂} wɛ̀ ndáwɔ̀ tù vâ | \gll b-ùdì ba sílɛ̃́ɛ̃̀ mɛ̂ wɛ̀ ndáwɔ̀ tù vâ | \gls ba2-person 2.PST1 finish.COMPL 1SG.OBJ die emptyset9.house inside here | \glt `The people have all died here inside the house.',,,,,,,,,,,,,,,,,,
Simple clauses,Special clause types,Comparison constructions,,,"Comparison and superlative constructions in Gyeli, just as in many other Bantu and generally African languages, as observed, for instance, by \citet[157]{stassen84} are expressed verbally with the verb {\itshape bálɛ} `surpass'. This holds for the comparison of the quality of two entities, as in \REF{CC1}. In this example, the compared quality is {\itshape mpà} `good', an adjective, followed by the infinitival form of {\itshape bálɛ} `surpass'. The slot of the adjective can also be filled with nouns denoting quality, size, or color, for instance with {\itshape nkpámá} `new (cl. 3/4)' or {\itshape mpùlɛ́} `yellow (cl. 3/4)'. Morphosyntactically, there is no difference in the use of such a noun or an adjective as a comparison parameter. Nouns are, in fact, frequent parameters in comparison constructions due to the fact that the class of adjectives (\sectref{sec:QUAL}) is rather small.",CC1,\gsrc kàbà yíì mpà bálɛ̀ sɔ́tì | \gll kàbà yíì mpà bálɛ sɔ́tì | \gls ∅7.dress 7.COP good surpass ∅1.trousers | \glt `The dress is better than the trousers.',,,,,,,,,,,,,,,,,,
Simple clauses,Special clause types,Comparison constructions,,,"The pattern is the same for adverbial comparison. In \REF{CC2}, {\itshape mpà} serves as an adverb to {\itshape kɛ̀} `go, run'. Just as in the previous example, it is followed by the comparison verb.",CC2,\gsrc Màmbì á kɛ́ mpà bálɛ̀ Àdà | \gll Màmbì a-H kɛ̀-H mpà bálɛ̀ Àdà | \gls emptyset1.PN 1-PRS go-R good surpass emptyset1.PN | \glt `Mambi runs better than Ada.',,,,,,,,,,,,,,,,,,
Simple clauses,Special clause types,Comparison constructions,,,"In \REF{CC2} and \REF{CC3}, the comparison is between two subjects. {\itshape bálɛ} is also used to compare two objects while the subject is identical, as in \REF{CC3a}.",CC2,\gsrc Màmbì á kɛ́ mpà bálɛ̀ Àdà | \gll Màmbì a-H kɛ̀-H mpà bálɛ̀ Àdà | \gls emptyset1.PN 1-PRS go-R good surpass emptyset1.PN | \glt `Mambi runs better than Ada.',CC3,\gsrc Adà à tsìlɔ́ békáládɛ̀ bálɛ̀ Màmbì | \gll Adà a tsìlɔ-H H-be-káládɛ̀ bálɛ̀ Màmbì | \gls ∅1.PN 1.PST1 write-R OBJ.LINK-be8-letter surpass ∅1.PN | \glt `Ada wrote more letters than Mambi.',CC3a,\gsrc Àdà à dé mántúà \textbf{bálɛ̀} mànjù | \gll Àdà a dè-H H-ma-ntúà bálɛ ma-njù | \gls ∅1.PN 1.PST1 eat-R OBJ.LINK-ma6-mango surpass ma6-banana | \glt `Ada ate more mangoes than bananas.',,,,,,,,,,,,,,
Simple clauses,Special clause types,Comparison constructions,,,"{\itshape bálɛ} can also function as the only verb in a clause that is tonally inflected for tense and mood, as in \REF{CC4}. Here, the comparison is between the second constituents of a noun + noun attributive construction, while the first constituent of the second construction is elided.",CC4,\gsrc lèdyṹũ̀ lé dẽ̂ bálɛ́ nàkùgúù | \gll le-dyṹũ̀ lé dẽ̂ bálɛ-H nàkùgúù | \gls le5-heat 5:ATT today surpass-R yesterday | \glt `Today it's warmer than yesterday.',,,,,,,,,,,,,,,,,,
Simple clauses,Special clause types,Comparison constructions,,,"In \REF{CC6}, a comparison construction is used to express semantically a superlative by comparing one person's driving style to that of everyone else.",CC6,\gsrc Adà á dvùdɔ́ màtúà bálɛ̀ bɔ́gà | \gll Adà a-H dvùdɔ-H màtúà bálɛ bɔ́-gà | \gls emptyset1.PN 1-PRS drive-R emptyset1.car surpass 2-other | \glt `Ada drives the car faster than all [the fastest].',,,,,,,,,,,,,,,,,,
Simple clauses,Special clause types,Comparison constructions,,,"\noindent In contrast, in \REF{CC5}, a superlative is expressed without comparing two entities. Instead, {\itshape bálɛ} follows an object noun phrase, which is subject to the superlative interpretation, while {\itshape kɛ̀ mpfúndɔ́} encodes in which way Ada's car is the best, namely in going fast.",CC5,\gsrc Adà á dvùdɔ́ màtúà bálɛ̀ kɛ̀ mpfúndɔ́ | \gll Adà a-H dvùdɔ-H màtúà bálɛ kɛ̀ mpfúndɔ́ | \gls emptyset1.PN 1-PRS drive-R emptyset1.car surpass go emptyset3.speed | \glt `Ada drives the fastest car.',,,,,,,,,,,,,,,,,,
