Chapter,Section,Subsection,Subsubsection,Subsubsubsection,Knowledge Point,Label 1,Content 1,Label 2,Content 2,Label 3,Content 3,Label 4,Content 4,Label 5,Content 5,Label 6,Content 6,Label 7,Content 7,Label 8,Content 8,Label 9,Content 9,Label 10,Content 10
,,,,,"The main function of adnominal possessive constructions is to denote possession of a \isi{definite} possessum. In addition, \textitbf{punya} ‘\textsc{poss}’ serves other functions in ``\textsc{possr}{}-\textsc{np} – \textitbf{punya} ‘\textsc{poss}’ – \textsc{possm}{}-\textsc{np}'' constructions. It is employed to mark and emphasize \isi{locational}, temporal, or \isi{associative} relations, to indicate beneficiary relations, or to signal speaker attitudes and evaluations. Besides, the ligature is also used in reflexive expressions. (Possession of an \isi{indefinite} possessum is not expressed with an \isi{adnominal possessive construction}, but with a \isi{two-argument existential clause} or a nominal clause; details are presented in §\ref{Para_11.4.2} and §\ref{Para_12.2}, respectively.)",Para_11.4.2,Not found,Para_12.2,Not found,,,,,,,,,,,,,,,,
,,,,,"Semantically, the possessor and the possessum can designate human, nonhuman animate, or inanimate referents. Overall, adnominal possessive constructions do not make a distinction between alienable and inalienable possession, with one exception. Possessive constructions with the elided possessive marker signal inalienable possession of body parts or kinship relations (see §\ref{Para_9.1.3}).",Para_9.1.3,Not found,,,,,,,,,,,,,,,,,,
,,,,,"In the following sections, adnominal possessive constructions are discussed in more detail. The possessive marker \textitbf{punya} ‘\textsc{poss}’ with its different realizations is examined in §\ref{Para_9.1}. The different realizations of the possessor and possessum \isi{noun} phrases are described in §\ref{Para_9.2}. Noncanonical possessive constructions are discussed in §\ref{Para_9.3}. The main points of this chapter are summarized in §\ref{Para_9.4}. (For the uses of adnominal possessive constructions in two-argument existential clauses, see §\ref{Para_11.4.1}.)",Para_9.1,Not found,Para_9.2,Not found,Para_9.3,Not found,Para_9.4,Not found,Para_11.4.1,Not found,,,,,,,,,,
,Possessive marker \textitbf{punya ‘\textsc{poss’,,,,"The possessive marker \textitbf{punya} ‘\textsc{poss}’ is related to the full \isi{bivalent} \isi{verb} \textitbf{punya} ‘have’ which is still used synchronically in two-argument clauses to predicate possession of an \isi{indefinite} possessum. In such clauses, the possessor is encoded by the grammatical subject (\textsc{s}) while the \isi{indefinite} possessum is the direct object (\textsc{o}) of the \isi{verb} (\textsc{v}) \textitbf{punya} ‘have’. This is illustrated in (\ref{Example_9.1}): the possessor \textitbf{sa} ‘1\textsc{sg}’ is the grammatical subject while the possessum \textitbf{rencana} ‘thought’ is the direct object of \textitbf{punya} ‘have’. Overall, however, verbal clauses with \textitbf{punya} ‘have’ are rather rare. Instead, speakers typically express possession of an \isi{indefinite} possessum with a \isi{two-argument existential clause} with \textitbf{ada} ‘exist’. This is demonstrated in (\ref{Example_9.2}): the possessor \textitbf{sa} ‘\textsc{1sg}’ is the subject while the \isi{indefinite} possessum \textitbf{ana} ‘child’ is the direct object of existential \textitbf{ada} ‘exist’. (This type of \isi{two-argument existential clause} is discussed in detail in §\ref{Para_11.4.2}.)",Example_9.1,\glll ... S ... V O | \gll malam \textbf{saya} suda \textbf{punya} \textbf{rencana} | \gls night 1SG already have plan,Example_9.2,Not found,Para_11.4.2,Not found,,,,,,,,,,,,,,
,Possessive marker \textitbf{punya ‘\textsc{poss’,,,,"The most common function of Papuan Malay \textitbf{punya} ‘\textsc{poss}’ is that of a ligature in adnominal referential possessive constructions, that is, possessive constructions with \isi{definite} referents. Such constructions have the syntactic structure ``\textsc{possr-np} \textitbf{punya} \textsc{possm-np}''. As shown in (\ref{Example_9.3}), this type of possessive construction contrasts with the verbal constructions in (\ref{Example_9.1}) and (\ref{Example_9.2}): the possessive relation is not encoded by a two-argument clause but in a single construction which consists of two \isi{noun} phrases, which in turn functions as an argument in a clause. Hence, \textitbf{Yosina} in (\ref{Example_9.3}) is not a grammatical subject but the possessor. Likewise, \textitbf{swara} ‘voice’ is not the direct object of a \isi{verbal clause}, but a \isi{definite} possessum. The entire possessive construction in (\ref{Example_9.3}) functions as the direct object of the \isi{bivalent} \isi{verb} \textitbf{dengar} ‘hear’. The contrastive examples in (\ref{Example_9.2}) and (\ref{Example_9.3}) also illustrate the distinctions between possession of an \isi{indefinite} and a \isi{definite} possessum, respectively.",Example_9.3,\glll ... ... ... ... POSSR-NP LIG POSSM-NP | \gll bapa kwatir tertarik dengar \textbf{Yosina} \textbf{punya} \textbf{swara} | \gls father afraid be.pulled hear Yosina POSS voice,Example_9.1,\glll ... S ... V O | \gll malam \textbf{saya} suda \textbf{punya} \textbf{rencana} | \gls night 1SG already have plan,Example_9.2,Not found,Example_9.3,\glll ... ... ... ... POSSR-NP LIG POSSM-NP | \gll bapa kwatir tertarik dengar \textbf{Yosina} \textbf{punya} \textbf{swara} | \gls father afraid be.pulled hear Yosina POSS voice,Example_9.3,\glll ... ... ... ... POSSR-NP LIG POSSM-NP | \gll bapa kwatir tertarik dengar \textbf{Yosina} \textbf{punya} \textbf{swara} | \gls father afraid be.pulled hear Yosina POSS voice,Example_9.2,Not found,Example_9.3,\glll ... ... ... ... POSSR-NP LIG POSSM-NP | \gll bapa kwatir tertarik dengar \textbf{Yosina} \textbf{punya} \textbf{swara} | \gls father afraid be.pulled hear Yosina POSS voice,,,,,,
,Possessive marker \textitbf{punya ‘\textsc{poss’,,,,"Sometimes, however, it is ambiguous whether the \textitbf{punya} construction should receive a predicative reading as in (\ref{Example_9.4a}) or an adnominal interpretation as in (\ref{Example_9.4b}), as there is no difference in intonation or stress between the utterances.",Example_9.4a,\gll [de] [\textbf{punya}] [piring kusus] | \gls 3SG have/POSS plate be.special | \glt Predicative reading: ‘he/she \textbf{has} special plates’,Example_9.4b,\gll [\textbf{de} \textbf{punya} \textbf{piring}] [kusus] | \gls 3SG have/POSS plate be.special | \glt Adnominal reading: ‘\textbf{his/her plates} are special’,,,,,,,,,,,,,,,,
,Possessive marker \textitbf{punya ‘\textsc{poss’,,,,"In adnominal possessive constructions, the ligature \textitbf{punya} ‘\textsc{poss}’ has four different realizations which are discussed in the following sections: long \textitbf{punya} ‘\textsc{poss}’ and its reduced form \textitbf{pu} in §\ref{Para_9.1.1}, the clitic \textitbf{=p} ‘\textsc{poss}’ in §\ref{Para_9.1.2}, and \isi{elision} in §\ref{Para_9.1.3}. In §\ref{Para_9.1.4}, a possible \isi{grammaticalization} of the possessive marker is examined.",Para_9.1.1,Not found,Para_9.1.2,Not found,Para_9.1.3,Not found,Para_9.1.4,Not found,,,,,,,,,,,,
,Possessive marker \textitbf{punya ‘\textsc{poss’,\textsc{possr-np \textitbf{punya/\textitbf{pu \textsc{possm-np,,,"In adnominal possessive constructions, the possessive marker is most commonly realized with the long form \textitbf{punya} ‘\textsc{poss}’ or the reduced monosyllabic form \textitbf{pu} ‘\textsc{poss}’. This reduction is independent of the syntactic or semantic properties of the possessor or possessum, as illustrated in (\ref{Example_9.5}).",Example_9.5,Not found,,,,,,,,,,,,,,,,,,
,Possessive marker \textitbf{punya ‘\textsc{poss’,\textsc{possr-np \textitbf{punya/\textitbf{pu \textsc{possm-np,,,"Both ligature forms occur with possessors encoded by lexical nouns as in (\ref{Example_9.5a}-\ref{Example_9.5g}, by personal pronouns as in (\ref{Example_9.5h}, \ref{Example_9.5i}), or by \isi{noun} phrases as in (\ref{Example_9.5j}-\ref{Example_9.5l}). With either ligature form, the possessor can denote a human referent as in (\ref{Example_9.5a}-\ref{Example_9.5d}, \ref{Example_9.5i}-\ref{Example_9.5k}), a nonhuman animate referent as in (\ref{Example_9.5e}, \ref{Example_9.5f}, \ref{Example_9.5h} ), or an inanimate referent as in (\ref{Example_9.5g}, \ref{Example_9.5l}). Likewise, the reduction is independent of the possessum’s properties. Both markers occur with possessa encoded by nouns as in (\ref{Example_9.5b}, \ref{Example_9.5e}, \ref{Example_9.5f}, \ref{Example_9.5l}), by demonstratives as in (\ref{Example_9.5c}, \ref{Example_9.5d}), or by \isi{noun} phrases as in (\ref{Example_9.5a}, \ref{Example_9.5g}, \ref{Example_9.5i}-\ref{Example_9.5k}). With either marker, the possessum can express an inalienably possessed referent as in (\ref{Example_9.5a}, \ref{Example_9.5b}, \ref{Example_9.5h}, \ref{Example_9.5k}) or an alienably possessed referent as in (\ref{Example_9.5c}-\ref{Example_9.5g}, \ref{Example_9.5i}, \ref{Example_9.5j}, \ref{Example_9.5l}).",Example_9.5a,Not found,Example_9.5g,Not found,Example_9.5h,Not found,Example_9.5i,Not found,Example_9.5j,Not found,Example_9.5l,Not found,Example_9.5a,Not found,Example_9.5d,Not found,Example_9.5i,Not found,Example_9.5k,Not found
,Possessive marker \textitbf{punya ‘\textsc{poss’,\textsc{possr-np \textitbf{punya/\textitbf{pu \textsc{possm-np,,,"With respect to the possessive marking of personal pronouns, there are no prosodic restrictions on the use of the two possessive marker forms: either can occur with the long and the short \isi{pronoun} forms, as illustrated in Table \ref{Table_9.2} and Table \ref{Table_9.2a}.\footnote{In the corpus there are only two unattested combinations, namely the marking with short \textitbf{pu} ‘\textsc{poss}’ of long third person plural \textitbf{dorang} ‘\textsc{3pl}’ and of short first person plural \textitbf{torang} ‘\textsc{1pl}’. The elicited examples in (\ref{Footnote_Example_9.1}) show, however, that possessive constructions with \textitbf{torang}/\textitbf{dorang} \textitbf{pu} ‘our/their’ are possible:",Table_9.2,Not found,Table_9.2a,Not found,Footnote_Example_9.1,\gll \textbf{torang} / \textbf{dorang} \textbf{pu} \textbf{ruma} ada di situ | \gls 1PL / 3PL POSS house exist at L.MED | \glt ‘\textbf{our/their house} is over there’ [Elicited BR111020-001.002-003] \z,,,,,,,,,,,,,,
,Possessive marker \textitbf{punya ‘\textsc{poss’,\textsc{possr-np \textitbf{punya/\textitbf{pu \textsc{possm-np,,,"Very occasionally, the reduced ligature takes on the form /\textstyleChCharisSIL{pum}/, /\textstyleChCharisSIL{pun}/, or /\textstyleChCharisSIL{puŋ}/ ‘\textsc{poss}’. This \isi{variation} is usually due to \isi{assimilation} to the word-initial segment of the following possessum, as illustrated in \tabref{Table_9.3}. That is, speakers realize short \textitbf{pu} ‘\textsc{poss}’ with a word-final nasal which receives its place features from the onset segment of the following prosodic word; when the following word has a vowel as onset, the nasal is typically realized as velar [\textstyleChCharisSIL{ŋ}]. (For more details on nasal place \isi{assimilation} see §\ref{Para_2.2.1}.)",Para_2.2.1,Not found,,,,,,,,,,,,,,,,,,
,Possessive marker \textitbf{punya ‘\textsc{poss’,\textsc{possr-np \textitbf{punya/\textitbf{pu \textsc{possm-np,,,"In a few cases, however, the reduced ligature takes on the form /\textstyleChCharisSIL{puŋ}/ regardless of the form of the following segment, as illustrated in (\ref{Example_9.6}) to (\ref{Example_9.8}).",Example_9.6,\gll ada sa \textup/puŋ/ \textbf{d}usung | \gls exist 1SG POSS garden | \glt ‘(over there) is \textbf{my} garden’,Example_9.8,"\gll ... tong \textup/puŋ/ \textbf{c}ara makang babi juga | \gls ... 1PL POSS manner eat pig also | \glt ‘[our way of eating is just like the Toraja one,] \textbf{our} way of eating pigs also’",,,,,,,,,,,,,,,,
,Possessive marker \textitbf{punya ‘\textsc{poss’,\textsc{possr-np \textitbf{=p \textsc{possm-np,,,"The possessive marker can be reduced further to \textitbf{=p} ‘\textsc{poss}’, if the \isi{possessor \isi{noun} phrase} ends in a vowel, as in (\ref{Example_9.9}) to (\ref{Example_9.11}). In this case, the marker is cliticized to the possessor. In this type of reduced possessive construction, the possessor is almost always a singular personal \isi{pronoun}, such as short first person \textitbf{sa} ‘\textsc{1sg}’, second person \textitbf{ko} ‘\textsc{2sg}’ in (\ref{Example_9.9}), or short third person \textitbf{de} ‘\textsc{3sg}’ as in (\ref{Example_9.10}). The possessor may, however, also be expressed by a \isi{noun} as in (\ref{Example_9.11}), although in the corpus this example is the only one attested. Again, the same construction is used for alienable and inalienable possession.",Example_9.9,"\gll sa bilang, i, \textbf{sa=p} \textbf{kaka}, de bilang \textbf{ko=p} \textbf{kaka}? | \gls 1SG say ugh! 1SG=POSS oSb 3SG say 2SG=POSS oSb | \glt ‘I said, ``ugh!, (that’s) \textbf{my older sister}'', she said, ``\textbf{your older sister}?'''",Example_9.11,Not found,Example_9.9,"\gll sa bilang, i, \textbf{sa=p} \textbf{kaka}, de bilang \textbf{ko=p} \textbf{kaka}? | \gls 1SG say ugh! 1SG=POSS oSb 3SG say 2SG=POSS oSb | \glt ‘I said, ``ugh!, (that’s) \textbf{my older sister}'', she said, ``\textbf{your older sister}?'''",Example_9.10,"\gll de timbul \textbf{de=p} \textbf{cucu} tanya dia, tete knapa | \gls 3SG emerge 3SG=POSS grandchild ask 3SG grandfather why | \glt ‘(when) he (grandfather) emerged, his grandchild asked him, ``grandfather, what happened?'''",Example_9.11,Not found,,,,,,,,,,
,Possessive marker \textitbf{punya ‘\textsc{poss’,\textsc{possr-np Ø \textsc{possm-np,,,"The possessive marker can also be elided, as illustrated in (\ref{Example_9.12}) to (\ref{Example_9.16}). The \isi{elision} is limited, however, to certain semantic kinds of possession. Attested are inalienable possession of body parts, as in (\ref{Example_9.12}) and (\ref{Example_9.13}), and kinship relations, as in (\ref{Example_9.14}) and (\ref{Example_9.15}). Most commonly, the possessor is human as in (\ref{Example_9.12}) to (\ref{Example_9.15}), but it may also be animate nonhuman as in (\ref{Example_9.16}).",Example_9.12,"\gll adu, \textbf{bapa} \textbf{Ø} \textbf{mulut} jahat skali | \gls oh.no! father ... mouth be.bad very | \glt ‘oh no!, \textbf{father’s language} is very bad’ (Lit. ‘\textbf{father’s mouth}’)",Example_9.16,"\gll {langsung} {potong} dia {buang} {tali-prutnya}  \textbf{de} \textbf{Ø} \textbf{tali-prut} buang, tinggal isi saja | \gls immediately cut 3SG throw(.away) intestines:3POSSR 3SG ... intestines throw(.away) stay contents just | \glt [About killing dogs:] ‘cut him up at once (and) throw away the intestines, (after having) thrown away \textbf{his intestines}, just the meat remains’",Example_9.12,"\gll adu, \textbf{bapa} \textbf{Ø} \textbf{mulut} jahat skali | \gls oh.no! father ... mouth be.bad very | \glt ‘oh no!, \textbf{father’s language} is very bad’ (Lit. ‘\textbf{father’s mouth}’)",Example_9.13,\gll \textbf{pace} \textbf{de} \textbf{Ø} \textbf{tangang} kluar ke samping | \gls man 3SG ... hand go.out to side | \glt [About an accident:] ‘\textbf{the man’s arm} stuck out sideways’,Example_9.14,\gll \textbf{de} \textbf{Ø} \textbf{mama} \textbf{ini} ke atas | \gls 3SG ... see 3SG POSS wife | \glt ‘\textbf{his mother here} (went) up (there)’,Example_9.15,"\gll dia liat dia pu maytua ... ah, \textbf{sa} \textbf{Ø} \textbf{maytua} cantik | \gls 3SG see 3SG POSS wife ... ah! 1SG ... wife be.beautiful | \glt ‘he saw his wife ... ``ah!, my wife is beautiful'''",Example_9.12,"\gll adu, \textbf{bapa} \textbf{Ø} \textbf{mulut} jahat skali | \gls oh.no! father ... mouth be.bad very | \glt ‘oh no!, \textbf{father’s language} is very bad’ (Lit. ‘\textbf{father’s mouth}’)",Example_9.15,"\gll dia liat dia pu maytua ... ah, \textbf{sa} \textbf{Ø} \textbf{maytua} cantik | \gls 3SG see 3SG POSS wife ... ah! 1SG ... wife be.beautiful | \glt ‘he saw his wife ... ``ah!, my wife is beautiful'''",Example_9.16,"\gll {langsung} {potong} dia {buang} {tali-prutnya}  \textbf{de} \textbf{Ø} \textbf{tali-prut} buang, tinggal isi saja | \gls immediately cut 3SG throw(.away) intestines:3POSSR 3SG ... intestines throw(.away) stay contents just | \glt [About killing dogs:] ‘cut him up at once (and) throw away the intestines, (after having) thrown away \textbf{his intestines}, just the meat remains’",,
,Possessive marker \textitbf{punya ‘\textsc{poss’,\textsc{possr-np Ø \textsc{possm-np,,,"In \textsc{possr-possm} constructions, the possessor is usually encoded by a short personal \isi{pronoun} form, as in (\ref{Example_9.14}) to (\ref{Example_9.16}). Much less often, the possessor is expressed with a lexical \isi{noun}, such as \textitbf{bapa} ‘father’ in (\ref{Example_9.12}). Also rather infrequently, the possessor is expressed by a \isi{noun} phrase such as \textitbf{pace de} ‘the man’ in (\ref{Example_9.13}), where adnominally used \textitbf{de} ‘\textsc{3sg}’ modifies \textitbf{pace} ‘man’ (for details on the adnominal uses of the personal pronouns, see §\ref{Para_6.2}).",Example_9.14,\gll \textbf{de} \textbf{Ø} \textbf{mama} \textbf{ini} ke atas | \gls 3SG ... see 3SG POSS wife | \glt ‘\textbf{his mother here} (went) up (there)’,Example_9.16,"\gll {langsung} {potong} dia {buang} {tali-prutnya}  \textbf{de} \textbf{Ø} \textbf{tali-prut} buang, tinggal isi saja | \gls immediately cut 3SG throw(.away) intestines:3POSSR 3SG ... intestines throw(.away) stay contents just | \glt [About killing dogs:] ‘cut him up at once (and) throw away the intestines, (after having) thrown away \textbf{his intestines}, just the meat remains’",Example_9.12,"\gll adu, \textbf{bapa} \textbf{Ø} \textbf{mulut} jahat skali | \gls oh.no! father ... mouth be.bad very | \glt ‘oh no!, \textbf{father’s language} is very bad’ (Lit. ‘\textbf{father’s mouth}’)",Example_9.13,\gll \textbf{pace} \textbf{de} \textbf{Ø} \textbf{tangang} kluar ke samping | \gls man 3SG ... hand go.out to side | \glt [About an accident:] ‘\textbf{the man’s arm} stuck out sideways’,Para_6.2,Not found,,,,,,,,,,
,Possessive marker \textitbf{punya ‘\textsc{poss’,\textsc{possr-np Ø \textsc{possm-np,,,"Contrary to the possessive constructions presented in §\ref{Para_9.1.1} and §\ref{Para_9.1.2}, the data presented in (\ref{Example_9.12}) to (\ref{Example_9.16}) shows that Papuan Malay also has the option to signal inalienable possession by omitting the possessive marker.",Para_9.1.1,Not found,Para_9.1.2,Not found,Example_9.12,"\gll adu, \textbf{bapa} \textbf{Ø} \textbf{mulut} jahat skali | \gls oh.no! father ... mouth be.bad very | \glt ‘oh no!, \textbf{father’s language} is very bad’ (Lit. ‘\textbf{father’s mouth}’)",Example_9.16,"\gll {langsung} {potong} dia {buang} {tali-prutnya}  \textbf{de} \textbf{Ø} \textbf{tali-prut} buang, tinggal isi saja | \gls immediately cut 3SG throw(.away) intestines:3POSSR 3SG ... intestines throw(.away) stay contents just | \glt [About killing dogs:] ‘cut him up at once (and) throw away the intestines, (after having) thrown away \textbf{his intestines}, just the meat remains’",,,,,,,,,,,,
,Possessive marker \textitbf{punya ‘\textsc{poss’,Grammaticalization of \textitbf{punya ‘\textsc{poss’,,,"In §\ref{Para_9.1.1} to §\ref{Para_9.1.3}, the reduction of possessive marker \textitbf{punya} ‘\textsc{poss}’ to its monosyllabic variants \textitbf{pu} or \textitbf{=p} ‘\textsc{poss}’ and its omission in \textsc{possr-possm} constructions was described.",Para_9.1.1,Not found,Para_9.1.3,Not found,,,,,,,,,,,,,,,,
,Realizations of \textsc{possr-np and \textsc{possm-np,,,,"This section discusses the different realizations of the possessor and possessum \isi{noun} phrases in adnominal possessive constructions. The syntactic categories that can take the possessor or possessum slots, together with their semantic properties are discussed in §\ref{Para_9.2.1.1}. Elision of the \isi{possessum \isi{noun} phrase} is described in §\ref{Para_9.2.1.2}, followed by a brief discussion of \isi{recursive} possessive constructions in §\ref{Para_9.2.1.3}.",Para_9.2.1.1,Not found,Para_9.2.1.2,Not found,Para_9.2.1.3,Not found,,,,,,,,,,,,,,
,Realizations of \textsc{possr-np and \textsc{possm-np,,,,"In adnominal possessive constructions, the possessor and/or possessum can be expressed by lexical nouns as in (\ref{Example_9.17}) and (\ref{Example_9.18}), by demonstratives as in (\ref{Example_9.19}) and (\ref{Example_9.20}), or by \isi{noun} phrases as in (\ref{Example_9.21}) to (\ref{Example_9.26}). Further, the possessor can be encoded by a personal \isi{pronoun} as in (\ref{Example_9.23}) to (\ref{Example_9.26}). Semantically, the possessor and the possessum can be human as in (\ref{Example_9.17}), nonhuman animate as in (\ref{Example_9.18}), or inanimate as in (\ref{Example_9.27}), respectively.",Example_9.17,\gll sa masi ingat \textbf{bapa} \textbf{pu} \textbf{muka} | \gls 1SG still remember father POSS front | \glt ‘I still remember \textbf{father’s face}’,Example_9.18,\gll ... pake \textbf{setang} \textbf{punya} \textbf{kwasa} | \gls ... use evil.spirit POSS power | \glt [About the power of evil spirits:] ‘[the sleeping person can’t wake up because the sorcerers are] using \textbf{the evil spirit’s power}’,Example_9.19,"\gll bapa {masi} {kenal} kaka Siduas pu, masi kenal  \textbf{ini} \textbf{pu} \textbf{muka} | \gls father still know oSb Siduas POSS still know D.PROX POSS front | \glt ‘do you (‘father’) still know Siduas’, still know \textbf{this (one)’s face}?’",Example_9.20,"\gll ko ambil dulu \textbf{ade} \textbf{pu} \textbf{itu} | \gls 2SG fetch first ySb POSS D.DIST | \glt ‘you pick (it) up first, \textbf{that (fish) of (your) younger sister}’ (Lit. ‘\textbf{younger sibling’s that}’)",Example_9.21,Not found,Example_9.26,"\gll ... [[\textbf{tong}] \textbf{pu} [\textbf{cara} [\textbf{makang} \textbf{babi}]]] juga | \gls ... 1PL POSS manner eat pig also | \glt ‘[our way of eating is just like the Toraja one,] \textbf{our way of eating pigs} also’",Example_9.23,"\gll [[\textbf{de}] {\textbf{pu}} [[\textbf{cucu} \textbf{kecil}] \textbf{itu}]] tiap hari de  menangis trus | \gls 3SG POSS grandchild be.small D.DIST every day 3SG cry be.continuous | \glt ‘\textbf{that small grandchild of his}, every day he/she cries continuously’",Example_9.26,"\gll ... [[\textbf{tong}] \textbf{pu} [\textbf{cara} [\textbf{makang} \textbf{babi}]]] juga | \gls ... 1PL POSS manner eat pig also | \glt ‘[our way of eating is just like the Toraja one,] \textbf{our way of eating pigs} also’",Example_9.17,\gll sa masi ingat \textbf{bapa} \textbf{pu} \textbf{muka} | \gls 1SG still remember father POSS front | \glt ‘I still remember \textbf{father’s face}’,Example_9.18,\gll ... pake \textbf{setang} \textbf{punya} \textbf{kwasa} | \gls ... use evil.spirit POSS power | \glt [About the power of evil spirits:] ‘[the sleeping person can’t wake up because the sorcerers are] using \textbf{the evil spirit’s power}’
,Realizations of \textsc{possr-np and \textsc{possm-np,,,,"In (\ref{Example_9.17}) and (\ref{Example_9.18}), the possessor and the possessum are expressed by lexical nouns.",Example_9.17,\gll sa masi ingat \textbf{bapa} \textbf{pu} \textbf{muka} | \gls 1SG still remember father POSS front | \glt ‘I still remember \textbf{father’s face}’,Example_9.18,\gll ... pake \textbf{setang} \textbf{punya} \textbf{kwasa} | \gls ... use evil.spirit POSS power | \glt [About the power of evil spirits:] ‘[the sleeping person can’t wake up because the sorcerers are] using \textbf{the evil spirit’s power}’,,,,,,,,,,,,,,,,
,Realizations of \textsc{possr-np and \textsc{possm-np,,,,In (\ref{Example_9.19}) the proximal \isi{demonstrative} \textitbf{ini} ‘\textsc{d.prox}’ takes the possessor slot and in (\ref{Example_9.20}) distal \textitbf{itu} ‘\textsc{d.dist}’ takes the possessum slot.,Example_9.19,"\gll bapa {masi} {kenal} kaka Siduas pu, masi kenal  \textbf{ini} \textbf{pu} \textbf{muka} | \gls father still know oSb Siduas POSS still know D.PROX POSS front | \glt ‘do you (‘father’) still know Siduas’, still know \textbf{this (one)’s face}?’",Example_9.20,"\gll ko ambil dulu \textbf{ade} \textbf{pu} \textbf{itu} | \gls 2SG fetch first ySb POSS D.DIST | \glt ‘you pick (it) up first, \textbf{that (fish) of (your) younger sister}’ (Lit. ‘\textbf{younger sibling’s that}’)",,,,,,,,,,,,,,,,
,Realizations of \textsc{possr-np and \textsc{possm-np,,,,"In (\ref{Example_9.21}) to (\ref{Example_9.26}), \isi{noun} phrases take the possessor or the possessum slot (the scope of the \isi{noun} phrases is indicated with brackets). In (\ref{Example_9.21}) the possessor is encoded by a \isi{noun} phrase with a verbal modifier plus an adnominal \isi{demonstrative}, while in (\ref{Example_9.22}) the possessor is expressed by a coordinate \isi{noun} phrase.",Example_9.21,Not found,Example_9.26,"\gll ... [[\textbf{tong}] \textbf{pu} [\textbf{cara} [\textbf{makang} \textbf{babi}]]] juga | \gls ... 1PL POSS manner eat pig also | \glt ‘[our way of eating is just like the Toraja one,] \textbf{our way of eating pigs} also’",Example_9.21,Not found,Example_9.22,"\gll itu ko pu [[\textbf{ko} \textbf{deng} \textbf{Mateus}] \textbf{pu} [\textbf{tugas}]] | \gls D.DIST 2SG POSS 2SG with Mateus POSS duty | \glt ‘that is your, \textbf{your and Mateus’ duty}’",,,,,,,,,,,,
