Chapter,Section,Subsection,Subsubsection,Subsubsubsection,Knowledge Point,Label 1,Content 1,Label 2,Content 2,Label 3,Content 3,Label 4,Content 4,Label 5,Content 5,Label 6,Content 6,Label 7,Content 7,Label 8,Content 8,Label 9,Content 9,Label 10,Content 10
,Adpositional phrase\label{sec:5.6,Simple adpositional phrase\label{sec:5.6.1,,,No ‘less than’ comparatives were found in the data. Superlative constructions are possible but are not used often in Moloko culture. \REF{ex:5:131} illustrates what people say in an elicitation context.,ex:5:131,Not found,,,,,,,,,,,,,,,,,,
,Adpositional phrase\label{sec:5.6,Simple adpositional phrase\label{sec:5.6.1,,,The adposition aka ‘on’ is used with the verb lo ‘go’ to mark the purpose of a trip \REF{ex:5:132}.,ex:5:132,\gsrc Aban olo \textbf{aka} yam. | \gll Abaŋ ɔ-lɔ \textbf{aka} jam | \gls Aban 3S-go on water | \glt ‘Aban goes to get water.’ (lit. she goes on water),,,,,,,,,,,,,,,,,,
,Adpositional phrase\label{sec:5.6,Simple adpositional phrase\label{sec:5.6.1,,,"The adposition anga indicates possession. The predicate possessive construction is discussed in \sectref{sec:10.1.2}. In the possessive construction, anga indicates a possessive relationship between the noun in the adpositional phrase and the other noun phrase in the construction. In \REF{ex:5:133}, anga indicates that dəray ‘head’ is possessed by ləme ‘us.’",ex:5:133,"\gsrc [Dəray ga] [\textbf{anga} ləme.] | \gll [dəraj ga] [\textbf{aŋga} lɪmɛ] | \gls head ADJ POSS 1PEX | \glt ‘We got the head.’ (lit. the head, belonging to us)",,,,,,,,,,,,,,,,,,
,Adpositional phrase\label{sec:5.6,Simple adpositional phrase\label{sec:5.6.1,,,The adposition afa ‘at the house of’ plus a noun phrase gives a location\is{Deixis!Locational} at the house of the referent specified in the noun phrase \REF{ex:5:134}.,ex:5:134,\gsrc Nolo afa bahay. | \gll nʊ-lɔ afa bahaj | \gls oneS-go {at.house.of chief | \glt ‘I go to the chief’s house.’,,,,,,,,,,,,,,,,,,
,Adpositional phrase\label{sec:5.6,Simple adpositional phrase\label{sec:5.6.1,,,"The adposition ka ‘like’ introduces an adverbial complement that expresses manner. Ka appears twice in \REF{ex:5:135}. In the second instance, ka carries the directional extension ala ‘towards.’",ex:5:135,Not found,,,,,,,,,,,,,,,,,,
,Adpositional phrase\label{sec:5.6,Complex adpositional phrase\label{sec:5.6.2,,,"There are two complex adpositional phrases, each composed of the combination of a preposition and a postposition that surround the noun phrase. The adpositions give locational\is{Deixis!Locational} information. The first, kə…aka ‘on’ marks the noun phrase as being a location to which the event expressed by the verb is directed. It can be employed in a physical sense (\ref{ex:5:136}--\ref{ex:5:138}) or a figurative sense \REF{ex:5:139}.",ex:5:136,Not found,ex:5:138,\gsrc Azaɗ oloko \textbf{kə} dəray a məwta \textbf{aka}. | \gll à-zaɗ ɔlɔkʷɔ \textbf{kə} dəraj a muwta \textbf{aka} | \gls 3S+PFV-carry wood on head GEN truck on | \glt ‘He/she carried the wood on top of the truck.’ (lit. on the head of the truck),ex:5:139,\gsrc Hərmbəlom agə ɓərav va \textbf{ka} war anga məze dedelen ga \textbf{aka}. | \gll Hʊrmbʊlɔm a-gə ɓərav =va \textbf{ka} war aŋga mɪʒɛ dɛdɛlɛŋ ga \textbf{aka} | \gls God 3S-do heart =PRF on child POSS person black ADJ on | \glt ‘God was angry with the black man’s child.’ (lit. God did heart on the child that belongs to the black person),,,,,,,,,,,,,,
,Adpositional phrase\label{sec:5.6,Complex adpositional phrase\label{sec:5.6.2,,,"The second complex adpositional phrase, a…ava ‘in,’ the preposition and postposition surround a noun phrase to mark that noun phrase as being a physical location in which the action of the verb is directed (\ref{ex:5:140} and \ref{ex:5:141}).",ex:5:140,\gsrc Olo \textbf{a} kosoko \textbf{ava}. | \gll ɔ-lɔ \textbf{a} kɔsɔkʷɔ \textbf{ava} | \gls 3S-go at market in | \glt ‘He/she goes to market.’,ex:5:141,\gsrc Afaɗ dala \textbf{a} ombolo \textbf{ava}. | \gll a-faɗ dala \textbf{a} ambɔlɔ \textbf{ava} | \gls 3S-put money at sack in | \glt ‘He/she put the money into [his] sack.’,,,,,,,,,,,,,,,,
,Adpositional phrase\label{sec:5.6,Complex adpositional phrase\label{sec:5.6.2,,,"The postpositions aka ‘on’ and ava ‘in’ have the same forms as the verb adpositional\is{Adpositionals} extensions =aka ‘on’ and =ava ‘in’ (see \sectref{sec:7.5.1}). The extensions permit the presence of the complex adpositional phrase which gives further precision concerning the location of the event (\ref{ex:5:142} and \ref{ex:5:143}\footnote{Even though the verb in this example has verbal extensions, it is not conjugated for subject since it is a climactic point in the story where nominalised forms are often found. This is discussed further in Sections \ref{sec:7.6} and \ref{sec:8.2.3}.}). In the examples, the postpositions and verbal extensions are both bolded.",ex:5:142,\gsrc Afəɗ\textbf{aka} war elé háy na \textbf{kə} ver \textbf{aka}. | \gll a-fəɗ=\textbf{aka} war ɛlɛ haj na \textbf{kə} vɛr \textbf{aka} | \gls 3S-place=on child eye millet PSP on stone on | \glt ‘She put the grain of millet on the grinding stone.’,ex:5:143,\gsrc Məmət\textbf{ava} alay \textbf{a} ver \textbf{ava}. | \gll mə-mət=\textbf{ava}=alaj \textbf{a} vɛr \textbf{ava} | \gls NOM-die=in=away at room in | \glt ‘She died in the room.’,,,,,,,,,,,,,,,,
