Chapter,Section,Subsection,Subsubsection,Subsubsubsection,Knowledge Point,Label 1,Content 1,Label 2,Content 2,Label 3,Content 3,Label 4,Content 4,Label 5,Content 5,Label 6,Content 6,Label 7,Content 7,Label 8,Content 8,Label 9,Content 9,Label 10,Content 10
Nominal morphology,Nominal modifiers,Demonstratives,,,"Aside from expressing a temporal adverb, which is restricted to the demonstratives of locative class 16, demonstratives of all three locative classes, viz. 16, 17 and 18, can be used as locative adverbs. These demonstratives can describe general locations for class 16, as in (\ref{bkm:Ref99548183}), and 17, as in (\ref{bkm:Ref99548184}), and a contained location, e.g. ‘in there/here’, for class 18, as in (\ref{bkm:Ref99548185}).",bkm:Ref99548183,\gsrc bàzyíménè hênà | \gll ba-zyiHmé̲n-e héna | \gls SM2-stand-STAT DEM.IV16 | \glt ‘S/he stands there.’,bkm:Ref99548184,"\gsrc wáshàkêːzyì kûnò kùshàmbà ndíshâmbà | \gll o-ásha-ké̲ːzy-i kúno ku-shamb-a ndí̲-shá̲mb-a | \gls SM2SG-NEG.SBJV-come-NEG DEM.II17 INF-bath-FV SM1SG.REL-bath-FV | \glt ‘You cannot come here, I am bathing.’",bkm:Ref99548185,\gsrc bàrèrè mwínà | \gll ba-reHre mwiná | \gls SM2-sleep.STAT DEM.IV18 | \glt ‘They are asleep in there.’,,,,,,,,,,,,,,
Nominal morphology,Nominal modifiers,Connectives,,,Connective constructions are used to link two nouns or pronouns through use of a connective clitic. (\ref{bkm:Ref437444323}) gives an example of a connective construction in Fwe.,bkm:Ref437444323,\gsrc mìnwè yómwânce | \glll mi-nwe i-ó= mu-ánce | \gll head connective dependent | \gls NP\textsubscript{4}-finger PP\textsubscript{4}-CON= NP\textsubscript{1}-child,,,,,,,,,,,,,,,,,,
Nominal morphology,Nominal modifiers,Connectives,,,"The connective clitic consists of a connective stem and a pronominal prefix (see \tabref{tab:4:1}), which agrees in noun class with the head of the connective construction. The connective stem consists of a single vowel, which is determined by the noun class of the dependent of the connective construction, though in this case there are significant differences between Zambian and Namibian Fwe. In Namibian Fwe, the connective stem is identical to the vowel of the augment. This is illustrated in (\ref{bkm:Ref98512478}--\ref{bkm:Ref98512481}) with a connective clitic that has a pronominal prefix of class 3, which is realized as w-o-, w-e- or w-a-, depending on the augment of the following noun.",bkm:Ref98512478,\gsrc mùcírà wóꜝndávù (< òndávù ‘lion’) | \gll mu-círa u-ó=∅-ndavú | \gls NP3-tail PP3-CON=NP1a-lion | \glt ‘the tail of a lion’,bkm:Ref98512481,\gsrc mùbárá ꜝwámàbûnà (< àmàbûnà ‘leaves’) | \gll mu-bará u-á=ma-búna | \gls NP3-color PP3-CON=NP6-leaf | \glt ‘the color of the leaves’,,,,,,,,,,,,,,,,
Nominal morphology,Nominal modifiers,Connectives,,,"In Zambian Fwe, the vowel of the connective stem is always /o/, regardless of the augment of the noun with which the connective is used, as in (\ref{bkm:Ref98512501}--\ref{bkm:Ref98512503}).",bkm:Ref98512501,\gsrc téꜝndé ꜝryóꜝndávù (< òndávù ‘lion’) | \gll ∅-téndé ri-ó=∅-ndavú | \gls NP5-leg PP5-CON=NP1a-lion | \glt ‘the leg of the lion’,bkm:Ref98512503,\gsrc téꜝndé ꜝryókàzyùnì (< àkàzyùnì ‘bird’) | \gll ∅-téndé ri-ó=ka-zyuni | \gls NP5-leg PP5-CON=NP12-bird | \glt ‘the leg of the bird’,,,,,,,,,,,,,,,,
Nominal morphology,Nominal modifiers,Connectives,,,"The form of the connective also changes depending on the nature of the dependent noun. When the dependent is a noun that cannot take an augment, the vowel of the connective stem is always /a/, in both Namibian and Zambian Fwe. This is the case with proper names, as in (\ref{bkm:Ref492119044}), and adverbs, as in (\ref{bkm:Ref491175346}). The vowel of the connective is also realized as a when used with a demonstrative pronoun, as in (\ref{bkm:Ref71190780}--\ref{bkm:Ref71190782}), as opposed to when the connective is used with an adnominal demonstrative, in which case the vowel of the connective is determined by the augment of the demonstrative; see (\ref{bkm:Ref491276208}--\ref{bkm:Ref491276210}).",bkm:Ref492119044,\gsrc hànjà \textbf{ryaRebecca} | \gll hanja ri-a=Rebecca | \gls hand PP5-CON=Rebecca | \glt ‘Rebecca’s hand’,bkm:Ref491175346,\gsrc èzìàmbò \textbf{zàshûnù} nzícìkóró ꜝcámàyùnì | \gll e-zi-ambo zi-a=shúnu N-zí-ci-koró ci-á=mayuni | \gls AUG-NP8-topic PP8-CON=today COP-PP8-NP7-school PP7-CON=Mayuni | \glt ‘Today’s topic is Mayuni school.’,bkm:Ref71190780,\gsrc bànyûmbù nèmìcírà \textbf{yábò} | \gll ba-nyúmbu ne=mi-círa i-á=bo | \gls NP2-wildebeest COM=NP4-tail PP4-CON=DEM.III2 | \glt ‘The wildebeests and their tails.’,bkm:Ref71190782,\gsrc ècìntù nècìntù cìkwèsì òbùrótù \textbf{bwácò} nòbùbbí ꜝ\textbf{bwácò} | \gll e-ci-ntu ne=ci-ntu ci-kwesi o-bu-rótu bu-a=có no=bu-bbí bu-a=có | \gls AUG-NP7-thing COM=NP7-thing SM7-have AUG-NP14-good PP14-CON=DEM.III7 COM=AUG-NP14-bad PP14-CON=DEM.III7 | \glt ‘Everything has its advantage and its disadvantage.’,bkm:Ref491276208,"\textbf{òmùkìtí} \textbf{ꜝ}\textbf{wábèná} \textbf{bàntù} mànì wáràtèndàhàrà | \gll o-mu-kití u-á=bená ba-ntu mani o-ára-tend-ahar-a | \gls AUG-NP3-party PP3-CON=DEM.IV2 NP2-person when SM3-REM.FUT-do-NEUT-FV | \glt ‘Those people’s party, when will it take place?’",bkm:Ref491276210,\gsrc \textbf{èmísì} \textbf{yècí} \textbf{cìshámù} mùshámù | \gll e-mi-ísi i-e=cí ci-shamú N-mu-shamú | \gls AUG-NP4-root PP4-CON=DEM.I7 NP7-tree COP-NP3-medicine | \glt ‘The roots of this tree are medicine.’,,,,,,,,
Nominal morphology,Nominal modifiers,Connectives,,,"Another group of nouns that never take an augment are nouns marked with a locative prefix of class 16, 17 or 18. With these nouns, however, the vowel of the connective is not consistently realized as a-, but as o- with class 17 and 18, as in (\ref{bkm:Ref99548320}--\ref{bkm:Ref75251506}), and as a- with class 16, as in (\ref{bkm:Ref75251507}). These forms resemble the augment, which is determined by vowel harmony with the nominal prefix, and therefore the expected augment with class 16 would be a-, and o- with class 17 and 18, even though these nouns may never take an augment.",bkm:Ref99548320,\gsrc bàntù \textbf{bòkúmùnzì} | \gll ba-ntu ba-o=kú-mu-nzi | \gls NP2-person PP2-CON=NP17-NP3-village | \glt ‘the people of the village’,bkm:Ref75251506,\gsrc zíryó ꜝ\textbf{zómúrùwà} | \gll zi-ryó zi-o=mú-ru-wa | \gls NP8-food PP8-CON=NP18-NP11-field | \glt ‘the crops of the field’,bkm:Ref75251507,\gsrc zíryó \textbf{zàhámùkítì} | \gll zi-ryó zi-a=há-mu-kití | \gls NP8-food PP8-CON=NP16-NP3-party | \glt ‘the food at the party’,,,,,,,,,,,,,,
Nominal morphology,Nominal modifiers,Connectives,,,"Nouns that take a secondary class 2 prefix (used to mark respect; see \sectref{bkm:Ref489005545}) also never take an augment. When such a noun takes a connective clitic, the connective stem is reduced to zero, as in (\ref{bkm:Ref99548365}).",bkm:Ref99548365,\gsrc ndóꜝrúfù rùbànyámùzàmbàràrà kúnjòvù | \gll ndó-ru-fú ru-∅=ba-nyámuzambarara kú-∅-njovu | \gls COP.DEF11-NP11-death PP11-CON=NP2-Nyamuzambarara NP17-NP1a-elephant | \glt ‘That is the death of Mrs. Nyamuzambarara by an elephant.’,,,,,,,,,,,,,,,,,,
Nominal morphology,Nominal modifiers,Connectives,,,Both the connective stem and the pronominal prefix are underlyingly toneless. The connective clitic may be realized as high-toned only when the floating high tone of the nominal augment attaches to it (see \sectref{bkm:Ref444175456} on the formal properties of the nominal augment). Examples of high-toned connective clitics are given in (\ref{bkm:Ref491179934}--\ref{bkm:Ref491179935}).,bkm:Ref491179934,\gsrc mùcírà wóꜝndávù | \gll mu-círa u-ó=∅-ndavú | \gls NP3-tail PP3-CON=NP1a-lion | \glt ‘tail of a lion’,bkm:Ref491179935,\gsrc ènshùkí ꜝzómùkêntù | \gll e-N-shukí zi-ó=mu-kéntu | \gls AUG-NP10-hair PP10-CON=NP1-woman | \glt ‘the hair of the woman’,,,,,,,,,,,,,,,,
Nominal morphology,Nominal modifiers,Connectives,,,"When the connective is used with a dependent noun that can never take an augment, the connective stem is consistently realized as low-toned, as illustrated with locative-marked nouns in (\ref{bkm:Ref71188211}--\ref{bkm:Ref71188213}).",bkm:Ref71188211,\gsrc mìnwè yòkúmàànjà | \gll mi-nwe i-o=kú-ma-anja | \gls NP4-finger PP4-CON=NP17-NP6-hand | \glt ‘fingers of the hands’,bkm:Ref71188213,\gsrc bàntù bòmúnjûò | \gll ba-ntu ba-o=mú-N-júo | \gls NP2-person PP2-CON=NP18-NP9-house | \glt ‘people of the house’,,,,,,,,,,,,,,,,
Nominal morphology,Nominal modifiers,Connectives,,,"{\citet{Velde2013}} notes that the connective element in Bantu languages generally has an intermediate position between affix and word, and therefore analyzes it as a clitic. The same applies to the connective in Fwe. The phonological integration is seen from the fact that the vowel of the connective stem interacts with the augment of the noun it attaches to, and from its tonal behavior: the connective clitic may be the target for high tone shift, as in (\ref{bkm:Ref491181481}), where the high tone of the syllable mú spreads onto the preceding connective ryó. High tone spread never crosses word boundaries (see \sectref{bkm:Ref430865664}), thus proving the phonological integration of the connective clitic into the noun.",bkm:Ref491181481,\gsrc èzwáyí ꜝryómúbùsùnsò | \gll e-∅-zwaí ri-o=mú-bu-sunso | \gls AUG-NP5-salt PP5-CON=NP18-NP14-relish | \glt ‘the salt of the relish’,,,,,,,,,,,,,,,,,,
Nominal morphology,Nominal modifiers,Connectives,,,"Syntactically, the connective clitic behaves like a separate word. When combined with nouns that have a pre-nominal modifier, such as a demonstrative, as in (\ref{bkm:Ref491276208}--\ref{bkm:Ref491276210}), the connective clitic is marked on the demonstrative, not the noun itself. This shows that the connective behaves like a phrasal clitic, rather than a nominal affix.",bkm:Ref491276208,"\textbf{òmùkìtí} \textbf{ꜝ}\textbf{wábèná} \textbf{bàntù} mànì wáràtèndàhàrà | \gll o-mu-kití u-á=bená ba-ntu mani o-ára-tend-ahar-a | \gls AUG-NP3-party PP3-CON=DEM.IV2 NP2-person when SM3-REM.FUT-do-NEUT-FV | \glt ‘Those people’s party, when will it take place?’",bkm:Ref491276210,\gsrc \textbf{èmísì} \textbf{yècí} \textbf{cìshámù} mùshámù | \gll e-mi-ísi i-e=cí ci-shamú N-mu-shamú | \gls AUG-NP4-root PP4-CON=DEM.I7 NP7-tree COP-NP3-medicine | \glt ‘The roots of this tree are medicine.’,,,,,,,,,,,,,,,,
Nominal morphology,Nominal modifiers,Connectives,,,"The head of the connective construction can be left unexpressed, so the construction consists of a dependent only. In this case, the noun class of the pronominal prefix is determined by the intended or implied noun. In (\ref{bkm:Ref491184139}), a speaker asks where her citenge (piece of fabric worn as wrap-around skirt) is; the response uses headless connectives to ask for a description of the citenge, marked for agreement with the class 7 noun citenge with class 7 pronominal prefixes.",bkm:Ref491184139,\ea | \glll nòndìbónènì ècìtèngé ꜝcángù | \gll no-ndi-bón-en-i e-ci-tengé ci-angú | \gls SM\textsubscript{2SG}.PST-OM\textsubscript{1SG}-see-APPL-NPST.PFV AUG-NP\textsubscript{7}-citenge PP\textsubscript{7}-POSS\textsubscript{1SG},,,,,,,,,,,,,,,,,,
Nominal morphology,Nominal modifiers,Connectives,,,"Semantically, the relationship between the two nouns in a connective construction can be interpreted in different ways. A connective can be used to indicate possession, where the dependent is the possessor and the head the possessee, as in (\ref{bkm:Ref99548645}--\ref{bkm:Ref99548647}).",bkm:Ref99548645,\gsrc mùndáré òbàmùrútì | \gll mu-ndaré u-o=ba-mu-rutí | \gls NP3-maize PP3-CON=NP2-NP1-teacher | \glt ‘the maize of the teacher’,bkm:Ref99548647,\gsrc njûò yámùyéꜝnzángù | \gll N-júo i-á=mu-énz-angú | \gls NP9-house PP9-CON=NP1-friend-POSS1SG | \glt ‘the house of my friend’,,,,,,,,,,,,,,,,
Nominal morphology,Nominal modifiers,Connectives,,,"The relationship expressed by a connective construction may be a relationship of qualification, where the dependent describes some property of the head, as in (\ref{bkm:Ref99548665}--\ref{bkm:Ref99548667}).",bkm:Ref99548665,\gsrc mwánà wècìsìzánì | \gll mu-ána u-e=ci-sizaní | \gls NP1-child PP1-CON=NP7-female | \glt ‘a female child’,bkm:Ref99548667,\gsrc ràpá ꜝryókùcènà | \gll rapá ri-ó=ku-cen-a | \gls courtyard PP5-CON=INF-be_clean-FV | \glt ‘a clean courtyard’,,,,,,,,,,,,,,,,
Nominal morphology,Nominal modifiers,Connectives,,,"A connective may also express the location of the head with respect to the dependent, in which case the dependent is marked with a locative prefix of class 16, 17 or 18, as in (\ref{bkm:Ref99548933}--\ref{bkm:Ref99548934}).",bkm:Ref99548933,\gsrc mìnwè yòkúmàànjà | \gll mi-nwe i-o=kú-ma-anja | \gls NP4-finger PP4-CON=NP17-NP6-hand | \glt ‘fingers of the hands’,bkm:Ref99548934,\gsrc bàntù bòmúmùnzì | \gll ba-ntu ba-o=mú-mu-nzi | \gls NP2-person PP2-CON=NP18-NP3-village | \glt ‘people from the village’,,,,,,,,,,,,,,,,
Nominal morphology,Nominal modifiers,Connectives,,,"When the connective is used on an infinitive, it may take on some properties of a separate clause. The infinitive may, for instance, have its own object, either marked through a separate noun, as in (\ref{bkm:Ref448750425}), or with an object marker on the verb, as in (\ref{bkm:Ref448750435}).",bkm:Ref448750425,ndààzyá màshérêŋì ókùkwèrès’ éꜝmótà | \gll ndi-aazyá ma-sheréŋi a-ó=ku-kwer-es-á e-N-motá | \gls SM1SG-have_not NP6-money PP6-CON=INF-board-CAUS-FV AUG-NP9-car | \glt ‘I don’t have money for a taxi.’,bkm:Ref448750435,\gsrc mùròrà ókùtúsànzìsà | \gll mu-rora u-ó=ku-tú-sanz-is-a | \gls NP3-soap PP3-CON=INF-OM13-wash-CAUS-FV | \glt ‘soap for washing them (dishes) with’,,,,,,,,,,,,,,,,
Nominal morphology,Nominal modifiers,Quantifiers\label{bkm:Ref99546522,,,"The quantifier onshéː is used with the meaning ‘all, every, each, any’. It is typically used after the noun it modifies, as in (\ref{bkm:Ref99549023}), but may also be used before the noun, as in (\ref{bkm:Ref99549040}). The pronominal prefix used with this quantifier is realized as low-toned.",bkm:Ref99549023,\gsrc \textbf{èŋòmbè} \textbf{zònshéː} nàzáùrìsìwà | \gll e-N-ŋombe zi-onshéː na-zí̲-a-ur-is-iw-a | \gls AUG-NP10-cow PP10-all REM-SM10-PST-buy-CAUS-PASS-FV | \glt ‘All the cattle have been sold.’,bkm:Ref99549040,\textbf{yònshéː} \textbf{èntúsó} èyò ndíꜝóːrà òkùkùtùsà | \gll i-onshéː e-N-tusó e-yo ndí̲-ó̲ːr-a o-ku-ku-tus-a | \gls PP9-all AUG-NP9-help AUG-DEM.III9 SM1SG.REL-can-FV AUG-INF-OM2SG-help-FV | \glt ‘Any help that I can provide to you…’,,,,,,,,,,,,,,,,
Nominal morphology,Nominal modifiers,Quantifiers\label{bkm:Ref99546522,,,"The quantifier onshéː may also be used with pronominal prefixes of the first and second person, with an interpretation of ‘all of us/you; us/you together’, as in (\ref{bkm:Ref99549290}--\ref{bkm:Ref99549291}).",bkm:Ref99549290,"kùààzyá òzyò áshàká òkúfwà \textbf{twènshéː} tùsháká ꜝbúmì | \gll ku-aazyá o-zyo á̲-shak-á̲ o-ku-fw-á tu-enshéː tu-shak-á̲ bu-mí | \gls SM17-be_not AUG-DEM.III1 SM1.REL-want-FV AUG-INF-die-FV PP1PL-all SM1PL-want-FV NP14-life | \glt ‘There is no one who wants to die, \textbf{we} \textbf{all} want to be alive.’",bkm:Ref99549291,\gsrc háìbà \textbf{mwènshéː} mùbèrékà | \gll háiba mu-enshéː mu-berek-á̲ | \gls if PP2PL-all SM2PL-work-FV | \glt ‘If \textbf{you} \textbf{all} are working…’,,,,,,,,,,,,,,,,
Nominal morphology,Nominal modifiers,Quantifiers\label{bkm:Ref99546522,,,"The quantifier ngíː ‘many; other’ is typically used after the noun it modifies, as in (\ref{bkm:Ref99549339}--\ref{bkm:Ref99549360}), though a prenominal position is also possible, as in (\ref{bkm:Ref99549341}).",bkm:Ref99549339,\gsrc zìzyùnì zîngîː | \gll zi-zyuni zí-ngíː | \gls NP8-bird PP8-many | \glt ‘many birds’,bkm:Ref99549360,\gsrc nàdàmwá ꜝ\textbf{kúbàntù} \textbf{bângîː} | \gll na-dam-w-á̲ kú-ba-ntu bá-ngíː | \gls SM1.PST-beat-PASS-FV NP17-NP2-person PP2-many | \glt ‘S/he was beaten by many people.’,bkm:Ref99549341,\gsrc \textbf{zíngìː} \textbf{èmbúkà} bábàrâ bò | \gll zí-ngiː e-N-búka bá̲-bar-á̲ bo | \gls PP10-many AUG-NP10-book SM2.REL-read-FV DEM.III2 | \glt ‘S/he reads many books.’,,,,,,,,,,,,,,
Nominal morphology,Nominal modifiers,Quantifiers\label{bkm:Ref99546522,,,"The quantifier mwi can be realized as mwi, mwinya, or munya, without observable changes in meaning. This quantifier is used with the meaning ‘some, other, another, a certain’. It may be used before the noun, as in (\ref{bkm:Ref99549401}), or after it, as in (\ref{bkm:Ref99549411}).",bkm:Ref99549401,\gsrc \textbf{zyúmwì} múꜝkwámè | \gll zyú-mwi mú-kwamé | \gls PP1-other NP1-man | \glt ‘a certain man’,bkm:Ref99549411,\gsrc kùààzyá kùmwí òkò nèmúkàwánè \textbf{òbùhárò} \textbf{búmùnyà} | \gll ku-aazyá ku-mwí o-ko ne-mú̲-ka-wá̲n-e o-bu-háro bú-munya | \gls SM17-be_not PP17-other AUG-DEM.III17 REM-SM2PL-DIST-find-PFV.SBJV AUG-NP14-life PP14-other | \glt ‘There is nowhere where you can find another life.’,,,,,,,,,,,,,,,,
Nominal morphology,Nominal modifiers,Quantifiers\label{bkm:Ref99546522,,,"Used with a pronominal prefix of class 16, as in (\ref{bkm:Ref99549499}), this quantifier may have a temporal interpretation, e.g. ‘sometimes’.",bkm:Ref99549499,"\gsrc \textbf{hámùnyà} kàzíꜝyángà kwàrìzáùrì \textbf{hámùnyà} kàtúꜝzwángà kwàmakanga tùyá kwàrìnyântì | \gll há-munya ka-zí̲-y-á̲ng-a kwa-rizáuli há-munya ka-tú̲-zw-á̲ng-a kwa-makanga tu-y-á̲ kwa-rinyánti | \gls PP16-other PST.IPFV-SM10-go-HAB-FV NP17-Lizauli PP16-other PST.IPFV-SM1PL-come_out-HAB-FV NP17-Makanga SM1PL-go-FV NP17-Linyanti | \glt ‘\textbf{Sometimes} they would go to Lizauli. \textbf{Sometimes}, we would go from Makanga to Linyanti.’",,,,,,,,,,,,,,,,,,
Nominal morphology,Nominal modifiers,Quantifiers\label{bkm:Ref99546522,,,"Like other nominal modifiers, quantifiers may also be used nominally, replacing instead of modifying a noun. In this case, the quantifier takes the pronominal prefix that agrees in noun class with the noun it replaces or refers to, e.g. class 2 in (\ref{bkm:Ref496809163}) to indicate plural human referents, and class 1 in (\ref{bkm:Ref496809191}) to indicate a single human referent.",bkm:Ref496809163,\gsrc \textbf{bònshéː} bàrwárà kàmpòrwè | \gll ba-onshéː ba-rwá̲Hr-a ka-mporwe | \gls PP2-all SM2-be_ill-FV NP12-diarrhea | \glt ‘\textbf{They} \textbf{all} suffer from diarrhea.’,bkm:Ref496809191,"\gsrc bàkéntù bòbírè \textbf{zyúmwì} ákùzârà òmùntù \textbf{zyúmwì} ákùzârà èŋwárárà | \gll ba-kéntu ba-o=biré zyú-mwi á-ku-zár-a o-mu-ntu zyú-mwi á-ku-zár-a e-∅-ŋwarará | \gls NP2-woman PP2-CON=two PP1-other PP1-INF-give_birth-FV AUG-NP1-person PP1-other PP1-INF-give_birth-FV AUG-NP5-crow | \glt ‘Two women. \textbf{One} gave birth to a human being, \textbf{the} \textbf{other} \textbf{one} gave birth to a crow.’",,,,,,,,,,,,,,,,
Nominal morphology,Nominal modifiers,Possessives,,,"The possessive stem is marked for agreement with the head noun with a pronominal prefix (see \tabref{tab:4:1}). An example is given in (\ref{bkm:Ref494202008}), where the possessive stem etú is marked with a pronominal prefix u- of class 3, agreeing with the head noun mùnzí ‘village’.",bkm:Ref494202008,\gsrc mùnzí ꜝwétù | \gll mu-nzí u-etú | \gls NP3-village PP3-POSS1PL\- | \glt ‘our village’,,,,,,,,,,,,,,,,,,
Nominal morphology,Nominal modifiers,Possessives,,,"Fwe lacks a dedicated possessive stem for the third person plural. Instead, the demonstrative of class 2 (the class for plural human nouns) is used, abó, as in (\ref{bkm:Ref99549542}).",bkm:Ref99549542,\gsrc òmùndáré ꜝwábò | \gll o-mu-ndaré u-abó | \gls AUG\--NP3-maize PP3-DEM.III2 | \glt ‘their maize’,,,,,,,,,,,,,,,,,,
Nominal morphology,Nominal modifiers,Possessives,,,"All possessives have a floating high tone which surfaces on the mora preceding the possessive, usually the last mora of the noun it modifies. In (\ref{bkm:Ref450574530}), the low-toned noun vùmò ‘stomach’, is realized as vùmó when followed by the possessive ryángù ‘my’.",bkm:Ref450574530,\gsrc vùmó ꜝryángù | \gll ∅-vumó ri-angú | \gls NP5-stomach PP5-POSS1SG | \glt ‘my stomach’,,,,,,,,,,,,,,,,,,
Nominal morphology,Nominal modifiers,Possessives,,,"Possessives may be used adnominally, modifying a noun, or nominally, replacing a noun. When used adnominally, the possessive may follow the noun it modifies, as in (\ref{bkm:Ref98835526}), or may precede the noun it modifies, in which case focus lies on the possessive, as in (\ref{bkm:Ref485747165}). In this setting, another speaker has just finished telling a short story. The speaker focuses the possessive ‘my’ here to indicate that his story, too, is short.",bkm:Ref98835526,\label{bkm:Ref450574530} | \glll vùmó ꜝryángù | \gll ∅-vumó ri-angú | \gls NP\textsubscript{5}-stomach PP\textsubscript{5}-POSS\textsubscript{1SG},bkm:Ref485747165,\gsrc rwàngú rùtângò ndùfwíhì nórò | \gll ru-angú ru-tángo N-ru-fwíi no=ró | \gls PP11-POSS1SG NP11-story COP-NP11-short COM=DEM.III11 | \glt ‘My story is also short.’,,,,,,,,,,,,,,,,
Nominal morphology,Nominal modifiers,Possessives,,,"When a possessive is used to replace a noun, the entity referred to can be inferred from context, and also provides the agreement prefix used on the possessive. In (\ref{bkm:Ref491186062}), two speakers discuss a cow; in the response, the possessive yángù is used to refer back to this cow, and agrees in noun class by taking the pronominal prefix of class 9.",bkm:Ref491186062,Not found,,,,,,,,,,,,,,,,,,
Nominal morphology,Nominal modifiers,Possessives,,,"In some cases, the possessive stem may fuse with the noun it modifies as a suffix. This is restricted to a closed set of nouns expressing social or family relations, such as yenz ‘friend’, as in (\ref{bkm:Ref99549571}), ana ‘child’, as in (\ref{bkm:Ref99549589}), or isho ‘father’, as in (\ref{bkm:Ref99549600}).",bkm:Ref99549571,\gsrc mùyéꜝnzángù | \gll mu-énz-angú | \gls NP1-friend-POSS1SG | \glt ‘my friend’,bkm:Ref99549589,Not found,bkm:Ref99549600,\gsrc béshwétù | \gll ba-ísho-etú | \gls NP2-father-POSS1PL | \glt ‘our father’,,,,,,,,,,,,,,
Nominal morphology,Nominal modifiers,Possessives,,,"Some nouns that take suffixed possessives cannot occur without a possessive. Other nouns take suffixed possessives for the second and third person singular, and suffixed possessives for other persons, such as the noun mu-kúru ‘elder sibling’ in (\ref{bkm:Ref436225558}).",bkm:Ref436225558,\gsrc mùkúrwê | \gll mu-kúrw-é | \gls NP1-elder_sibling-POSS3SG | \glt ‘his/her (elder) sister’,,,,,,,,,,,,,,,,,,
